id|uri|siglaTipo|codTipo|numero|ano|ementa|dataApresentacao|uriOrgaoNumerador|statusProposicao|uriAutores|descricaoTipo|ementaDetalhada|keywords|uriPropPrincipal|uriPropAnterior|uriPropPosterior|urlInteiroTeor|urnFinal|texto|justificativa
2318968|https://dadosabertos.camara.leg.br/api/v2/proposicoes/2318968|PL|139|762|2022|Altera a Lei nº 10.742, de 6 de outubro de 2003, para vedar o ajuste nos preços de medicamentos em 2022.|2022-03-30T11:29||{'dataHora': '2022-04-13T00:00', 'sequencia': 17, 'siglaOrgao': 'CDC', 'uriOrgao': 'https://dadosabertos.camara.leg.br/api/v2/orgaos/2004', 'uriUltimoRelator': None, 'regime': 'Prioridade (Art. 151, II, RICD)', 'descricaoTramitacao': 'Devolução ao Relator', 'codTipoTramitacao': '170', 'descricaoSituacao': 'Tramitando em Conjunto', 'codSituacao': 925, 'despacho': 'Devolvido ao Relator, Dep. Felipe Carreras (PSB-PE)', 'url': None, 'ambito': 'Protocolar', 'apreciacao': 'Proposição Sujeita à Apreciação do Plenário'}|https://dadosabertos.camara.leg.br/api/v2/proposicoes/2318968/autores|Projeto de Lei||Alteração, Lei Federal, proibição, reajuste de preços, medicamento.|https://dadosabertos.camara.leg.br/api/v2/proposicoes/2242474|||https://www.camara.leg.br/proposicoesWeb/prop_mostrarintegra?codteor=2153714|||
2318972|https://dadosabertos.camara.leg.br/api/v2/proposicoes/2318972|PL|139|763|2022|Proíbe a cobrança de taxas de administração dos cartões de crédito e débito.|2022-03-30T12:04||{'dataHora': '2022-03-31T00:00', 'sequencia': 14, 'siglaOrgao': 'CCP', 'uriOrgao': 'https://dadosabertos.camara.leg.br/api/v2/orgaos/186', 'uriUltimoRelator': None, 'regime': 'Prioridade (Art. 151, II, RICD)', 'descricaoTramitacao': 'Publicação de Proposição', 'codTipoTramitacao': '604', 'descricaoSituacao': 'Tramitando em Conjunto', 'codSituacao': 925, 'despacho': 'Encaminhada à publicação. Publicação Inicial em avulso e no DCD de 01/04/2022.', 'url': None, 'ambito': 'Regimental', 'apreciacao': 'Proposição Sujeita à Apreciação do Plenário'}|https://dadosabertos.camara.leg.br/api/v2/proposicoes/2318972/autores|Projeto de Lei||Proibição, cobrança, taxa de administração, comerciante, pagamento, Administradora de cartões de crédito, utilização, cartão de crédito, cartão de débito.|https://dadosabertos.camara.leg.br/api/v2/proposicoes/777632|||https://www.camara.leg.br/proposicoesWeb/prop_mostrarintegra?codteor=2153726|||
2318973|https://dadosabertos.camara.leg.br/api/v2/proposicoes/2318973|PL|139|764|2022|Estabelece medidas para garantir o direito dos estudantes ao aprendizado da lingua portuguesa segundo as normas vigentes.|2022-03-30T12:17||{'dataHora': '2022-04-05T00:00', 'sequencia': 17, 'siglaOrgao': 'CCP', 'uriOrgao': 'https://dadosabertos.camara.leg.br/api/v2/orgaos/186', 'uriUltimoRelator': None, 'regime': 'Ordinário (Art. 151, III, RICD)', 'descricaoTramitacao': 'Publicação de Proposição', 'codTipoTramitacao': '604', 'descricaoSituacao': 'Tramitando em Conjunto', 'codSituacao': 925, 'despacho': 'Encaminhada à publicação. Publicação Inicial em avulso e no DCD de 06/04/2022 PAG 639', 'url': None, 'ambito': 'Regimental', 'apreciacao': 'Proposição Sujeita à Apreciação Conclusiva pelas Comissões - Art. 24 II'}|https://dadosabertos.camara.leg.br/api/v2/proposicoes/2318973/autores|Projeto de Lei||Obrigatoriedade, escola pública, escola privada, ensino, aluno, Língua Portuguesa, conformidade, Vocabulário Ortográfico da Língua Portuguesa (Volp), descumprimento, multa.|https://dadosabertos.camara.leg.br/api/v2/proposicoes/2265570|||https://www.camara.leg.br/proposicoesWeb/prop_mostrarintegra?codteor=2153731|||
2318974|https://dadosabertos.camara.leg.br/api/v2/proposicoes/2318974|PL|139|765|2022|Adiciona o § 8º no art. 155 do Decreto-Lei nº 2.848, de 7 de dezembro de 1940 (Código Penal).|2022-03-30T12:35||{'dataHora': '2022-04-01T00:00', 'sequencia': 17, 'siglaOrgao': 'CCJC', 'uriOrgao': 'https://dadosabertos.camara.leg.br/api/v2/orgaos/2003', 'uriUltimoRelator': None, 'regime': 'Ordinário (Art. 151, III, RICD)', 'descricaoTramitacao': 'Designação de Relator', 'codTipoTramitacao': '320', 'descricaoSituacao': 'Tramitando em Conjunto', 'codSituacao': 925, 'despacho': 'Designado Relator, Dep. Felipe Francischini (PSL-PR)', 'url': None, 'ambito': 'Protocolar', 'apreciacao': 'Proposição Sujeita à Apreciação do Plenário'}|https://dadosabertos.camara.leg.br/api/v2/proposicoes/2318974/autores|Projeto de Lei||Alteração, Código Penal, Crime contra o patrimônio, aumento da pena, furto, Cabo elétrico, Equipamento, ferrovia, Metrô.|https://dadosabertos.camara.leg.br/api/v2/proposicoes/2287305|||https://www.camara.leg.br/proposicoesWeb/prop_mostrarintegra?codteor=2153736|||
2318975|https://dadosabertos.camara.leg.br/api/v2/proposicoes/2318975|PL|139|766|2022|Dispõe sobre a cobertura de danos pessoais ocorridos em veículos atingidos por desastres naturais	.|2022-03-30T12:40||{'dataHora': '2022-04-01T10:28', 'sequencia': 16, 'siglaOrgao': 'CCJC', 'uriOrgao': 'https://dadosabertos.camara.leg.br/api/v2/orgaos/2003', 'uriUltimoRelator': None, 'regime': 'Ordinário (Art. 151, III, RICD)', 'descricaoTramitacao': 'Apensação', 'codTipoTramitacao': '106', 'descricaoSituacao': 'Tramitando em Conjunto', 'codSituacao': 925, 'despacho': 'Apensação desta proposição ao PL 4549/2016.', 'url': None, 'ambito': 'Protocolar', 'apreciacao': 'Proposição Sujeita à Apreciação do Plenário'}|https://dadosabertos.camara.leg.br/api/v2/proposicoes/2318975/autores|Projeto de Lei||Alteração, Lei do DPVAT, pagamento, indenização, Seguro Obrigatório de Danos Pessoais Causados por Veículos Automotores de Vias Terrestres (Seguro DPVAT), hipótese, desastre ambiental.|https://dadosabertos.camara.leg.br/api/v2/proposicoes/2078152|||https://www.camara.leg.br/proposicoesWeb/prop_mostrarintegra?codteor=2153738|||
2318977|https://dadosabertos.camara.leg.br/api/v2/proposicoes/2318977|PL|139|767|2022|Aumenta a pena do crime de homicídio qualificado.|2022-03-30T12:55||{'dataHora': '2022-04-05T00:00', 'sequencia': 14, 'siglaOrgao': 'CCP', 'uriOrgao': 'https://dadosabertos.camara.leg.br/api/v2/orgaos/186', 'uriUltimoRelator': None, 'regime': 'Prioridade (Art. 151, II, RICD)', 'descricaoTramitacao': 'Publicação de Proposição', 'codTipoTramitacao': '604', 'descricaoSituacao': 'Tramitando em Conjunto', 'codSituacao': 925, 'despacho': 'Encaminhada à publicação. Publicação Inicial em avulso e no DCD de 06/04/2022 PAG 642', 'url': None, 'ambito': 'Regimental', 'apreciacao': 'Proposição Sujeita à Apreciação do Plenário'}|https://dadosabertos.camara.leg.br/api/v2/proposicoes/2318977/autores|Projeto de Lei||Alteração, Código Penal, aumento da pena, homicídio qualificado, prática, crime, promessa de recompensa, motivo torpe, utilização, veneno, arma de fogo, emboscada, contra, mulher, condição, sexo feminino, agente de segurança.|https://dadosabertos.camara.leg.br/api/v2/proposicoes/1555271|||https://www.camara.leg.br/proposicoesWeb/prop_mostrarintegra?codteor=2153745|||
2318979|https://dadosabertos.camara.leg.br/api/v2/proposicoes/2318979|PL|139|769|2022|Dispõe sobre a regularização do descarte de livros didáticos vencidos.|2022-03-30T13:43|https://dadosabertos.camara.leg.br/api/v2/orgaos/2009|{'dataHora': '2023-01-31T00:00', 'sequencia': 25, 'siglaOrgao': 'CE', 'uriOrgao': 'https://dadosabertos.camara.leg.br/api/v2/orgaos/2009', 'uriUltimoRelator': 'https://dadosabertos.camara.leg.br/api/v2/deputados/160653', 'regime': 'Ordinário (Art. 151, III, RICD)', 'descricaoTramitacao': 'Saída de Relator da Comissão - Com Parecer Apresentado', 'codTipoTramitacao': '1255', 'descricaoSituacao': 'Aguardando Designação de Relator', 'codSituacao': 907, 'despacho': '(Fim de Legislatura) O Relator, Dep. Roberto de Lucena, deixou de ser membro da Comissão', 'url': None, 'ambito': 'Regimental', 'apreciacao': 'Proposição Sujeita à Apreciação Conclusiva pelas Comissões - Art. 24 II'}|https://dadosabertos.camara.leg.br/api/v2/proposicoes/2318979/autores|Projeto de Lei||Diretrizes, descarte, livro didático, escola pública, doação, Organização social, atividade, reutilização, reciclagem.||||https://www.camara.leg.br/proposicoesWeb/prop_mostrarintegra?codteor=2153773|||
2318981|https://dadosabertos.camara.leg.br/api/v2/proposicoes/2318981|PL|139|770|2022|Dispõe sobre a obrigatoriedade de o cartório proceder com a comunicação da atualização do nome do(a) contraente após o casamento ou divórcio.|2022-03-30T14:00||{'dataHora': '2022-04-01T10:28', 'sequencia': 16, 'siglaOrgao': 'CCJC', 'uriOrgao': 'https://dadosabertos.camara.leg.br/api/v2/orgaos/2003', 'uriUltimoRelator': None, 'regime': 'Prioridade (Art. 151, II, RICD)', 'descricaoTramitacao': 'Apensação', 'codTipoTramitacao': '106', 'descricaoSituacao': 'Tramitando em Conjunto', 'codSituacao': 925, 'despacho': 'Apensação desta proposição ao PL 7086/2010.', 'url': None, 'ambito': 'Protocolar', 'apreciacao': 'Proposição Sujeita à Apreciação do Plenário'}|https://dadosabertos.camara.leg.br/api/v2/proposicoes/2318981/autores|Projeto de Lei||Obrigatoriedade, cartório, oficialização, mudança, nome, pessoa, casamento, divórcio, comunicação, órgão público, alteração, Documento pessoal, pessoa física.|https://dadosabertos.camara.leg.br/api/v2/proposicoes/472419|||https://www.camara.leg.br/proposicoesWeb/prop_mostrarintegra?codteor=2153792|||
2318995|https://dadosabertos.camara.leg.br/api/v2/proposicoes/2318995|PL|139|771|2022|Denomina “Antônio Carlos Belchior” o Terminal Marítimo de Passageiros do Porto de Fortaleza, no Estado do Ceará.|2022-03-30T15:11|https://dadosabertos.camara.leg.br/api/v2/orgaos/2016|{'dataHora': '2023-01-31T00:00', 'sequencia': 32, 'siglaOrgao': 'CCULT', 'uriOrgao': 'https://dadosabertos.camara.leg.br/api/v2/orgaos/536996', 'uriUltimoRelator': 'https://dadosabertos.camara.leg.br/api/v2/deputados/157130', 'regime': 'Ordinário (Art. 151, III, RICD)', 'descricaoTramitacao': 'Saída de Relator da Comissão - Sem Parecer Apresentado', 'codTipoTramitacao': '1250', 'descricaoSituacao': 'Aguardando Designação de Relator', 'codSituacao': 907, 'despacho': '(Fim de Legislatura) O Relator, Dep. Túlio Gadêlha, deixou de ser membro da Comissão', 'url': None, 'ambito': 'Regimental', 'apreciacao': 'Proposição Sujeita à Apreciação Conclusiva pelas Comissões - Art. 24 II'}|https://dadosabertos.camara.leg.br/api/v2/proposicoes/2318995/autores|Projeto de Lei||Denominação, Terminal marítimo, porto, Fortaleza (CE), Ceará, Homenagem póstuma, cantor, logradouro público.||||https://www.camara.leg.br/proposicoesWeb/prop_mostrarintegra?codteor=2153889|||
2319000|https://dadosabertos.camara.leg.br/api/v2/proposicoes/2319000|PL|139|772|2022|Dispõe sobre a concessão de desconto nas tarifas de energia elétrica às Organizações Não Governamentais de proteção animal.|2022-03-30T16:11||{'dataHora': '2022-04-11T13:42', 'sequencia': 16, 'siglaOrgao': 'CMADS', 'uriOrgao': 'https://dadosabertos.camara.leg.br/api/v2/orgaos/6174', 'uriUltimoRelator': None, 'regime': 'Ordinário (Art. 151, III, RICD)', 'descricaoTramitacao': 'Apensação', 'codTipoTramitacao': '106', 'descricaoSituacao': 'Tramitando em Conjunto', 'codSituacao': 925, 'despacho': 'Apensação desta proposição ao PL 2453/2021.', 'url': None, 'ambito': 'Protocolar', 'apreciacao': 'Proposição Sujeita à Apreciação Conclusiva pelas Comissões - Art. 24 II'}|https://dadosabertos.camara.leg.br/api/v2/proposicoes/2319000/autores|Projeto de Lei||Concessão, desconto, Tarifa de energia elétrica, Organização da sociedade civil, Organização não governamental (ONG), proteção animal.|https://dadosabertos.camara.leg.br/api/v2/proposicoes/2289651|||https://www.camara.leg.br/proposicoesWeb/prop_mostrarintegra?codteor=2153899|||
2319001|https://dadosabertos.camara.leg.br/api/v2/proposicoes/2319001|PL|139|773|2022|Altera as Lei nº 9.249 e 9.250 de 26 de dezembro de 1995, para permitir a dedução de doações à Organizações Não Governamentais de proteção animal no imposto de renda de pessoas físicas e jurídicas.|2022-03-30T16:13||{'dataHora': '2022-04-11T00:00', 'sequencia': 17, 'siglaOrgao': 'CMADS', 'uriOrgao': 'https://dadosabertos.camara.leg.br/api/v2/orgaos/6174', 'uriUltimoRelator': None, 'regime': 'Ordinário (Art. 151, III, RICD)', 'descricaoTramitacao': 'Designação de Relator', 'codTipoTramitacao': '320', 'descricaoSituacao': 'Tramitando em Conjunto', 'codSituacao': 925, 'despacho': 'Designado Relator, Dep. Coronel Tadeu (PSL-SP)', 'url': None, 'ambito': 'Protocolar', 'apreciacao': 'Proposição Sujeita à Apreciação Conclusiva pelas Comissões - Art. 24 II'}|https://dadosabertos.camara.leg.br/api/v2/proposicoes/2319001/autores|Projeto de Lei||Alteração, Legislação Tributária Federal, critério, dedução, Imposto sobre a Renda da Pessoa Física (IRPF), Imposto de Renda das Pessoas Jurídicas (IRPJ), pessoa física, pessoa jurídica, doação, Organização da sociedade civil, proteção animal, benefício fiscal, tributação.|https://dadosabertos.camara.leg.br/api/v2/proposicoes/2289919|||https://www.camara.leg.br/proposicoesWeb/prop_mostrarintegra?codteor=2153902|||
2319003|https://dadosabertos.camara.leg.br/api/v2/proposicoes/2319003|PL|139|774|2022|Altera o inciso XVI do art. 20 da Lei nº 8.036, de 11 maio de 1990, que “Dispõe sobre o Fundo de Garantia do Tempo de Serviço, e dá outras providências”, para estabelecer hipótese de saque em razão de seca.|2022-03-30T16:28||{'dataHora': '2022-04-11T00:00', 'sequencia': 17, 'siglaOrgao': 'CSAUDE', 'uriOrgao': 'https://dadosabertos.camara.leg.br/api/v2/orgaos/2014', 'uriUltimoRelator': None, 'regime': 'Prioridade (Art. 151, II, RICD)', 'descricaoTramitacao': 'Designação de Relator', 'codTipoTramitacao': '320', 'descricaoSituacao': 'Tramitando em Conjunto', 'codSituacao': 925, 'despacho': 'Designada Relatora, Dep. Dra. Soraya Manato (PSL-ES)', 'url': None, 'ambito': 'Protocolar', 'apreciacao': 'Proposição Sujeita à Apreciação do Plenário'}|https://dadosabertos.camara.leg.br/api/v2/proposicoes/2319003/autores|Projeto de Lei||Alteração, Lei do FGTS, autorização, trabalhador, movimentação, Conta vinculada do FGTS, necessidade, caráter pessoal, decorrência, seca, Desastre ambiental.|https://dadosabertos.camara.leg.br/api/v2/proposicoes/2078437|||https://www.camara.leg.br/proposicoesWeb/prop_mostrarintegra?codteor=2153908|||
2319013|https://dadosabertos.camara.leg.br/api/v2/proposicoes/2319013|PL|139|776|2022|Institui o Dia Nacional da Educação Domiciliar (Homeschooling)|2022-03-30T17:33||{'dataHora': '2022-04-08T00:00', 'sequencia': 13, 'siglaOrgao': 'CCP', 'uriOrgao': 'https://dadosabertos.camara.leg.br/api/v2/orgaos/186', 'uriUltimoRelator': None, 'regime': '.', 'descricaoTramitacao': 'Publicação de Proposição', 'codTipoTramitacao': '604', 'descricaoSituacao': 'Devolvida ao Autor', 'codSituacao': 1120, 'despacho': 'Encaminhada à publicação. Publicação Inicial no DCD de 09/04/2022 PAG 125', 'url': 'https://www.camara.leg.br/proposicoesWeb/prop_mostrarintegra?codteor=2197837', 'ambito': 'Regimental', 'apreciacao': 'Indefinida'}|https://dadosabertos.camara.leg.br/api/v2/proposicoes/2319013/autores|Projeto de Lei||Criação, Dia Nacional da Educação Domiciliar, comemoração, dezembro.||||https://www.camara.leg.br/proposicoesWeb/prop_mostrarintegra?codteor=2153954|||
2319014|https://dadosabertos.camara.leg.br/api/v2/proposicoes/2319014|PL|139|778|2022|"Acrescenta artigos ao Decreto-Lei nº
1.001, de 21 de outubro de 1969 – Código
Penal Militar, para tipificar o crime de
assédio sexual, perseguição (stalking) e de
violência psicológica contra a mulher."|2022-03-30T17:48||{'dataHora': '2023-01-31T00:00', 'sequencia': 17, 'siglaOrgao': 'MESA', 'uriOrgao': 'https://dadosabertos.camara.leg.br/api/v2/orgaos/4', 'uriUltimoRelator': None, 'regime': 'Ordinário (Art. 151, III, RICD)', 'descricaoTramitacao': 'Despacho de Apensação', 'codTipoTramitacao': '129', 'descricaoSituacao': 'Tramitando em Conjunto', 'codSituacao': 925, 'despacho': 'Devido ao arquivamento do PL 6988/2002 nos termos do art. 105 do RICD, desapense-se do PL 6988/2002 o PL 4780/2016, o PL 10460/2018 e o PL 778/2022, e, em seguida, apense-os ao PL 582/2015.', 'url': None, 'ambito': 'Regimental', 'apreciacao': 'Proposição Sujeita à Apreciação do Plenário'}|https://dadosabertos.camara.leg.br/api/v2/proposicoes/2319014/autores|Projeto de Lei||Alteração, Código Penal Militar, Crime contra a liberdade individual, tipicidade penal, Perseguição (direito penal), Violência psicológica, Assédio sexual, vítima, mulher, militar.|https://dadosabertos.camara.leg.br/api/v2/proposicoes/962503|||https://www.camara.leg.br/proposicoesWeb/prop_mostrarintegra?codteor=2154045|||
2319017|https://dadosabertos.camara.leg.br/api/v2/proposicoes/2319017|PL|139|779|2022|Cria, no âmbito dos órgãos e entidades da administração direta e indireta da União, e das concessionárias de serviços públicos federais, a campanha anual de conscientização e enfrentamento da discriminação, assédio e abuso contra as mulheres.|2022-03-30T17:48||{'dataHora': '2022-04-05T00:00', 'sequencia': 14, 'siglaOrgao': 'CCP', 'uriOrgao': 'https://dadosabertos.camara.leg.br/api/v2/orgaos/186', 'uriUltimoRelator': None, 'regime': 'Ordinário (Art. 151, III, RICD)', 'descricaoTramitacao': 'Publicação de Proposição', 'codTipoTramitacao': '604', 'descricaoSituacao': 'Tramitando em Conjunto', 'codSituacao': 925, 'despacho': 'Encaminhada à publicação. Publicação Inicial em avulso e no DCD de 06/04/2022 PAG 668', 'url': None, 'ambito': 'Regimental', 'apreciacao': 'Proposição Sujeita à Apreciação do Plenário'}|https://dadosabertos.camara.leg.br/api/v2/proposicoes/2319017/autores|Projeto de Lei||Criação, âmbito, órgão público, entidade pública, Administração direta, Administração indireta, Concessionário (administração pública), campanha educativa, anual, conscientização, enfrentamento, discriminação, assédio moral, abuso, contra, mulher. _Divulgação, mídia, televisão, rede social. _Alteração, Lei das Concessões de Serviços Públicos, inclusão, cláusula essencial, Contrato de concessão, obrigatoriedade, Concessionária de serviços públicos, canal de atendimento, denúncia, programa de acolhimento, mulher, vítima, discriminação, assédio moral, abuso. _ Inexecução do contrato, declaração, caducidade, concessão, aplicação, sanção.|https://dadosabertos.camara.leg.br/api/v2/proposicoes/2264705|||https://www.camara.leg.br/proposicoesWeb/prop_mostrarintegra?codteor=2154061|||
2319041|https://dadosabertos.camara.leg.br/api/v2/proposicoes/2319041|PL|139|782|2022|Dispõe sobre inclusão de autistas na Lei nº 12.711, de 29 de agosto de 2012, que dispõe sobre cotas para ingresso na educação pública federal.|2022-03-30T19:54||{'dataHora': '2022-04-11T00:00', 'sequencia': 17, 'siglaOrgao': 'CE', 'uriOrgao': 'https://dadosabertos.camara.leg.br/api/v2/orgaos/2009', 'uriUltimoRelator': None, 'regime': 'Prioridade (Art. 151, II, RICD)', 'descricaoTramitacao': 'Designação de Relator', 'codTipoTramitacao': '320', 'descricaoSituacao': 'Tramitando em Conjunto', 'codSituacao': 925, 'despacho': 'Designado Relator, Dep. Eduardo Barbosa (PSDB-MG)', 'url': None, 'ambito': 'Protocolar', 'apreciacao': 'Proposição Sujeita à Apreciação Conclusiva pelas Comissões - Art. 24 II'}|https://dadosabertos.camara.leg.br/api/v2/proposicoes/2319041/autores|Projeto de Lei||Alteração, Lei de Cotas de Ingresso nas Universidades, reserva, vaga, Instituição Federal de Ensino Superior (IFES), Instituição federal de ensino, Ensino técnico de grau médio, Pessoa com transtorno do espectro autista.|https://dadosabertos.camara.leg.br/api/v2/proposicoes/2090381|||https://www.camara.leg.br/proposicoesWeb/prop_mostrarintegra?codteor=2154161|||
2319046|https://dadosabertos.camara.leg.br/api/v2/proposicoes/2319046|PL|139|783|2022|Acrescenta parágrafo ao artigo 8º, da Lei nº 8.069, de 13 de julho de 1990.|2022-03-30T20:27||{'dataHora': '2022-04-05T00:00', 'sequencia': 15, 'siglaOrgao': 'CCP', 'uriOrgao': 'https://dadosabertos.camara.leg.br/api/v2/orgaos/186', 'uriUltimoRelator': None, 'regime': 'Ordinário (Art. 151, III, RICD)', 'descricaoTramitacao': 'Publicação de Proposição', 'codTipoTramitacao': '604', 'descricaoSituacao': 'Aguardando Designação de Relator', 'codSituacao': 907, 'despacho': 'Encaminhada à publicação. Publicação Inicial em avulso e no DCD de 06/04/2022 PAG 677', 'url': None, 'ambito': 'Regimental', 'apreciacao': 'Proposição Sujeita à Apreciação Conclusiva pelas Comissões - Art. 24 II'}|https://dadosabertos.camara.leg.br/api/v2/proposicoes/2319046/autores|Projeto de Lei||Alteração, Estatuto da Criança e do Adolescente (ECA), Programa (administração), saúde, Política de saúde, garantia, totalidade, assistência à saúde, gestante, mulher, adolescente.||||https://www.camara.leg.br/proposicoesWeb/prop_mostrarintegra?codteor=2154188|||
2319047|https://dadosabertos.camara.leg.br/api/v2/proposicoes/2319047|PL|139|784|2022|Altera a Consolidação das Leis do Trabalho (CLT) para dispor sobre o gozo de férias de empregado que tenha filho com deficiência.|2022-03-30T20:27||{'dataHora': '2022-05-17T17:03', 'sequencia': 19, 'siglaOrgao': 'CPD', 'uriOrgao': 'https://dadosabertos.camara.leg.br/api/v2/orgaos/537480', 'uriUltimoRelator': None, 'regime': 'Prioridade (Art. 151, II, RICD)', 'descricaoTramitacao': 'Recebimento', 'codTipoTramitacao': '500', 'descricaoSituacao': 'Tramitando em Conjunto', 'codSituacao': 925, 'despacho': 'Recebimento pela CPD, apensado ao PL-4594/2020', 'url': None, 'ambito': 'Regimental', 'apreciacao': 'Proposição Sujeita à Apreciação Conclusiva pelas Comissões - Art. 24 II'}|https://dadosabertos.camara.leg.br/api/v2/proposicoes/2319047/autores|Projeto de Lei|Altera o Decreto-lei nº 5.452 de 1943.|Alteração, Consolidação das Leis do Trabalho (CLT), Gozo de férias, empregado, filho, dependente, pessoa com deficiência, compatibilidade, férias escolares.|https://dadosabertos.camara.leg.br/api/v2/proposicoes/2262926|||https://www.camara.leg.br/proposicoesWeb/prop_mostrarintegra?codteor=2154192|||
2319057|https://dadosabertos.camara.leg.br/api/v2/proposicoes/2319057|PL|139|785|2022|Dispõe sobre a oferta gratuita de água potável filtrada nos estabelecimentos comerciais que especifica.|2022-03-30T20:48||{'dataHora': '2022-04-05T00:00', 'sequencia': 17, 'siglaOrgao': 'CSAUDE', 'uriOrgao': 'https://dadosabertos.camara.leg.br/api/v2/orgaos/2014', 'uriUltimoRelator': None, 'regime': 'Prioridade (Art. 151, II, RICD)', 'descricaoTramitacao': 'Designação de Relator', 'codTipoTramitacao': '320', 'descricaoSituacao': 'Tramitando em Conjunto', 'codSituacao': 925, 'despacho': 'Designado Relator, Dep. Hiran Gonçalves (PP-RR)', 'url': None, 'ambito': 'Protocolar', 'apreciacao': 'Proposição Sujeita à Apreciação do Plenário'}|https://dadosabertos.camara.leg.br/api/v2/proposicoes/2319057/autores|Projeto de Lei||Obrigatoriedade, estabelecimento comercial, comercialização, água potável, oferta, Água filtrada, gratuidade, cliente.|https://dadosabertos.camara.leg.br/api/v2/proposicoes/611133|||https://www.camara.leg.br/proposicoesWeb/prop_mostrarintegra?codteor=2154252|||
2319064|https://dadosabertos.camara.leg.br/api/v2/proposicoes/2319064|PL|139|786|2022|Institui o Dia Nacional do Rio Doce.|2022-03-31T09:06||{'dataHora': '2022-04-08T00:00', 'sequencia': 13, 'siglaOrgao': 'CCP', 'uriOrgao': 'https://dadosabertos.camara.leg.br/api/v2/orgaos/186', 'uriUltimoRelator': None, 'regime': '.', 'descricaoTramitacao': 'Publicação de Proposição', 'codTipoTramitacao': '604', 'descricaoSituacao': 'Devolvida ao Autor', 'codSituacao': 1120, 'despacho': 'Encaminhada à publicação. Publicação Inicial no DCD de 09/04/2022 PAG 128', 'url': 'https://www.camara.leg.br/proposicoesWeb/prop_mostrarintegra?codteor=2197838', 'ambito': 'Regimental', 'apreciacao': 'Indefinida'}|https://dadosabertos.camara.leg.br/api/v2/proposicoes/2319064/autores|Projeto de Lei||Criação, Dia Nacional do Rio Doce,  comemoração, novembro.||||https://www.camara.leg.br/proposicoesWeb/prop_mostrarintegra?codteor=2154332|||
2319083|https://dadosabertos.camara.leg.br/api/v2/proposicoes/2319083|PL|139|789|2022|Extingue a concessão de saída temporária, alterando a Lei nº 7.210, de 11 de julho de 1984, Lei de Execução Penal.|2022-03-31T12:46||{'dataHora': '2022-08-03T00:00', 'sequencia': 20, 'siglaOrgao': 'PLEN', 'uriOrgao': 'https://dadosabertos.camara.leg.br/api/v2/orgaos/180', 'uriUltimoRelator': None, 'regime': 'Urgência (Art. 155, RICD)', 'descricaoTramitacao': 'Arquivamento', 'codTipoTramitacao': '502', 'descricaoSituacao': 'Arquivada', 'codSituacao': 923, 'despacho': 'Declarado prejudicado em face da aprovação em plenário do Substitutivo ao Projeto de Lei nº 583, de 2011, adotado pelo relator da Comissão de Constituição e Justiça e de Cidadania, apensado ao PL 6.579, de 2013, principal (Sessão Deliberativa Extraordinária de 3/8/2022 - 10h - 121ª Sessão).', 'url': None, 'ambito': 'Regimental', 'apreciacao': 'Proposição Sujeita à Apreciação do Plenário'}|https://dadosabertos.camara.leg.br/api/v2/proposicoes/2319083/autores|Projeto de Lei||Alteração, Lei de Execução Penal, extinção, concessão, Saída temporária, preso condenado.|https://dadosabertos.camara.leg.br/api/v2/proposicoes/2197578|||https://www.camara.leg.br/proposicoesWeb/prop_mostrarintegra?codteor=2154414|||
