id|uri|siglaTipo|codTipo|numero|ano|ementa|dataApresentacao|uriOrgaoNumerador|statusProposicao|uriAutores|descricaoTipo|ementaDetalhada|keywords|uriPropPrincipal|uriPropAnterior|uriPropPosterior|urlInteiroTeor|urnFinal|texto|justificativa
2334040|https://dadosabertos.camara.leg.br/api/v2/proposicoes/2334040|PL|139|2291|2022|Altera a Lei nº 11.326, de 24 de julho de 2006, para determinar que a Política Nacional da Agricultura Familiar e Empreendimentos Familiares Rurais priorize à mulher chefe de família o acesso às linhas de crédito e aos mecanismos para comercialização dos alimentos produzidos.|2022-08-15T14:12|https://dadosabertos.camara.leg.br/api/v2/orgaos/2001|{'dataHora': '2023-03-31T00:00', 'sequencia': 21, 'siglaOrgao': 'CAPADR', 'uriOrgao': 'https://dadosabertos.camara.leg.br/api/v2/orgaos/2001', 'uriUltimoRelator': 'https://dadosabertos.camara.leg.br/api/v2/deputados/178964', 'regime': 'Ordinário (Art. 151, III, RICD)', 'descricaoTramitacao': 'Abertura de Prazo', 'codTipoTramitacao': '350', 'descricaoSituacao': 'Aguardando Parecer', 'codSituacao': 915, 'despacho': 'Reabertura do Prazo para Emendas ao Projeto - Art. 166 do RICD (5 sessões a partir de 03/04/2023)', 'url': None, 'ambito': 'Regimental', 'apreciacao': 'Proposição Sujeita à Apreciação Conclusiva pelas Comissões - Art. 24 II'}|https://dadosabertos.camara.leg.br/api/v2/proposicoes/2334040/autores|Projeto de Lei||Alteração, Lei da Agricultura Familiar, Política Nacional da Agricultura Familiar e Empreendimentos Familiares Rurais, priorização, mulher, Chefe de família, acesso, Linha de crédito, meios, comercialização, produção, alimento.||||https://www.camara.leg.br/proposicoesWeb/prop_mostrarintegra?codteor=2203099|||
2334041|https://dadosabertos.camara.leg.br/api/v2/proposicoes/2334041|PL|139|2292|2022|Altera disposições da Lei nº 9.394, de 1996, de diretrizes e bases da educação nacional, para inserir, nos currículos da educação básica, o estudo da dimensão econômica da realidade.|2022-08-15T14:16||{'dataHora': '2022-08-30T00:00', 'sequencia': 17, 'siglaOrgao': 'CE', 'uriOrgao': 'https://dadosabertos.camara.leg.br/api/v2/orgaos/2009', 'uriUltimoRelator': None, 'regime': 'Ordinário (Art. 151, III, RICD)', 'descricaoTramitacao': 'Devolução ao Relator', 'codTipoTramitacao': '170', 'descricaoSituacao': 'Tramitando em Conjunto', 'codSituacao': 925, 'despacho': 'Devolvido ao Relator, Dep. Felipe Rigoni (PSB-ES)', 'url': None, 'ambito': 'Protocolar', 'apreciacao': 'Proposição Sujeita à Apreciação Conclusiva pelas Comissões - Art. 24 II'}|https://dadosabertos.camara.leg.br/api/v2/proposicoes/2334041/autores|Projeto de Lei||Alteração, Lei de Diretrizes e Bases da Educação Nacional (1996), inclusão, currículo escolar, educação infantil, ensino fundamental, ensino médio, estudo, situação econômica, Brasil.|https://dadosabertos.camara.leg.br/api/v2/proposicoes/2254589|||https://www.camara.leg.br/proposicoesWeb/prop_mostrarintegra?codteor=2203100|||
2334066|https://dadosabertos.camara.leg.br/api/v2/proposicoes/2334066|PL|139|2293|2022|Estabelece normas gerais em matéria tributária que alteram a legislação do Imposto sobre a Renda e Proventos de Qualquer Natureza das Pessoas Jurídicas e da Contribuição Social sobre o Lucro Líquido – CSLL, define pagamento do tributo devido mediante cessão de direitos creditórios, estabelece moratória para pessoas jurídicas devedoras, limite mensal máximo de oneração com prestação de pagamento de dívidas e suspensão de exigibilidade de créditos de natureza tributária, previdenciária, fundiária, trabalhista, bancária e financeira, a fim se garantir a manutenção regular das atividades empresariais assegurada às pessoas jurídicas em débito por dívida contraída até o fim do estado de Emergência em Saúde Pública de Importância Nacional (Espin), decretado em função da pandemia no Brasil decorrente das medidas de prevenção ao contágio do COVID-19 (coronavírus), como medida de enfrentamento aos efeitos econômicos e sociais da Espin, na forma que especifica.|2022-08-15T16:36|https://dadosabertos.camara.leg.br/api/v2/orgaos/2008|{'dataHora': '2023-03-28T00:00', 'sequencia': 21, 'siglaOrgao': 'CCP', 'uriOrgao': 'https://dadosabertos.camara.leg.br/api/v2/orgaos/186', 'uriUltimoRelator': 'https://dadosabertos.camara.leg.br/api/v2/deputados/204573', 'regime': 'Ordinário (Art. 151, III, RICD)', 'descricaoTramitacao': 'Notificações', 'codTipoTramitacao': '1005', 'descricaoSituacao': 'Aguardando Designação de Relator', 'codSituacao': 907, 'despacho': 'Avulso atualizado - despacho.', 'url': None, 'ambito': 'Protocolar', 'apreciacao': 'Proposição Sujeita à Apreciação Conclusiva pelas Comissões - Art. 24 II'}|https://dadosabertos.camara.leg.br/api/v2/proposicoes/2334066/autores|Projeto de Lei||Alteração, Legislação Tributária Federal, Imposto sobre a Renda e Proventos de Qualquer Natureza (IR), Contribuição Social sobre o Lucro Líquido (CSLL), norma geral, pagamento, tributo, cessão, direito creditório, moratória, pessoa jurídica, devedor, limite máximo, mensal, oneração, prestação, pagamento, dívida, suspensão, exigibilidade, crédito, natureza tributária, garantia, manutenção, atividade empresarial, decorrência, aquisição, dívida, fim, Emergência em Saúde Pública de Importância Nacional (ESPIN).||||https://www.camara.leg.br/proposicoesWeb/prop_mostrarintegra?codteor=2203135|||
2334080|https://dadosabertos.camara.leg.br/api/v2/proposicoes/2334080|PL|139|2294|2022|Desonera de tributos federais as peças, partes, acessórios e componentes utilizados na fabricação de veículos ou equipamentos de transporte ferroviário.|2022-08-15T18:39|https://dadosabertos.camara.leg.br/api/v2/orgaos/2016|{'dataHora': '2022-12-01T00:00', 'sequencia': 28, 'siglaOrgao': 'CCP', 'uriOrgao': 'https://dadosabertos.camara.leg.br/api/v2/orgaos/186', 'uriUltimoRelator': 'https://dadosabertos.camara.leg.br/api/v2/deputados/204539', 'regime': 'Ordinário (Art. 151, III, RICD)', 'descricaoTramitacao': 'Publicação de Proposição', 'codTipoTramitacao': '604', 'descricaoSituacao': 'Aguardando Designação de Relator', 'codSituacao': 907, 'despacho': 'Encaminhada à publicação. Parecer da Comissão de Viação e Transportes Publicado em avulso e no DCD de 02/12/2022, Letra A.', 'url': None, 'ambito': 'Regimental', 'apreciacao': 'Proposição Sujeita à Apreciação Conclusiva pelas Comissões - Art. 24 II'}|https://dadosabertos.camara.leg.br/api/v2/proposicoes/2334080/autores|Projeto de Lei||Exoneração tributária, tributo federal, aquisição, importação, trem, locomotiva, vagão, carga, passageiro, peças, parte, equipamento, componente, fabricação, veículo ferroviário.||||https://www.camara.leg.br/proposicoesWeb/prop_mostrarintegra?codteor=2203179|||
2334085|https://dadosabertos.camara.leg.br/api/v2/proposicoes/2334085|PL|139|2295|2022|Acrescenta dispositivo à Lei nº 8.935, de 18 de novembro de 1994, que regulamenta o art. 236 da Constituição Federal, dispondo sobre serviços notariais e de registro.|2022-08-16T10:21||{'dataHora': '2022-08-26T00:00', 'sequencia': 17, 'siglaOrgao': 'CCJC', 'uriOrgao': 'https://dadosabertos.camara.leg.br/api/v2/orgaos/2003', 'uriUltimoRelator': None, 'regime': 'Ordinário (Art. 151, III, RICD)', 'descricaoTramitacao': 'Designação de Relator', 'codTipoTramitacao': '320', 'descricaoSituacao': 'Tramitando em Conjunto', 'codSituacao': 925, 'despacho': 'Designado Relator, Dep. Darci de Matos (PSD-SC)', 'url': None, 'ambito': 'Protocolar', 'apreciacao': 'Proposição Sujeita à Apreciação Conclusiva pelas Comissões - Art. 24 II'}|https://dadosabertos.camara.leg.br/api/v2/proposicoes/2334085/autores|Projeto de Lei||Alteração, Lei dos Cartórios, inexigibilidade, atualização, Certidão de Óbito.|https://dadosabertos.camara.leg.br/api/v2/proposicoes/2224255|||https://www.camara.leg.br/proposicoesWeb/prop_mostrarintegra?codteor=2203230|||
2334086|https://dadosabertos.camara.leg.br/api/v2/proposicoes/2334086|PL|139|2296|2022|Altera a Lei nº 8.069, de 1990, Estatuto da Criança e do Adolescente, para dispor sobre áreas para embarque e desembarque e vagas para veículos especialmente destinados à condução coletiva de escolares.|2022-08-16T10:52||{'dataHora': '2022-08-25T18:24', 'sequencia': 15, 'siglaOrgao': 'CSAUDE', 'uriOrgao': 'https://dadosabertos.camara.leg.br/api/v2/orgaos/2014', 'uriUltimoRelator': None, 'regime': 'Ordinário (Art. 151, III, RICD)', 'descricaoTramitacao': 'Recebimento', 'codTipoTramitacao': '500', 'descricaoSituacao': 'Aguardando Designação de Relator', 'codSituacao': 907, 'despacho': 'Recebimento pela CSSF.', 'url': None, 'ambito': 'Regimental', 'apreciacao': 'Proposição Sujeita à Apreciação Conclusiva pelas Comissões - Art. 24 II'}|https://dadosabertos.camara.leg.br/api/v2/proposicoes/2334086/autores|Projeto de Lei||Alteração, Estatuto da Criança e do Adolescente (ECA), via pública, proximidade, escola, reserva, local, embarque, desembarque, vaga, veículo, destinação, transporte escolar.||||https://www.camara.leg.br/proposicoesWeb/prop_mostrarintegra?codteor=2203233|||
2334087|https://dadosabertos.camara.leg.br/api/v2/proposicoes/2334087|PL|139|2297|2022|Altera a Lei nº 9.503, de 1997, Código de Trânsito Brasileiro, para estabelecer o conceito de transporte escolar.|2022-08-16T10:56|https://dadosabertos.camara.leg.br/api/v2/orgaos/2016|{'dataHora': '2023-03-30T00:00', 'sequencia': 21, 'siglaOrgao': 'CVT', 'uriOrgao': 'https://dadosabertos.camara.leg.br/api/v2/orgaos/2016', 'uriUltimoRelator': 'https://dadosabertos.camara.leg.br/api/v2/deputados/74299', 'regime': 'Ordinário (Art. 151, III, RICD)', 'descricaoTramitacao': 'Abertura de Prazo', 'codTipoTramitacao': '350', 'descricaoSituacao': 'Aguardando Parecer', 'codSituacao': 915, 'despacho': 'Reabertura do Prazo para Emendas ao Projeto - Art. 166 do RICD (5 sessões a partir de 31/03/2023)', 'url': None, 'ambito': 'Regimental', 'apreciacao': 'Proposição Sujeita à Apreciação Conclusiva pelas Comissões - Art. 24 II'}|https://dadosabertos.camara.leg.br/api/v2/proposicoes/2334087/autores|Projeto de Lei||Alteração, Código de Trânsito Brasileiro, definição, transporte escolar, serviços de transporte, transporte privado coletivo, autorização, autoridade, local, Perímetro urbano, área rural, estudante, matrícula, Rede pública de ensino, Rede particular de ensino, destinação, deslocamento, residência, local diverso, atividade, escola.||||https://www.camara.leg.br/proposicoesWeb/prop_mostrarintegra?codteor=2203241|||
2334088|https://dadosabertos.camara.leg.br/api/v2/proposicoes/2334088|PL|139|2298|2022|Institui o piso salarial nacional dos guardas-municipais.|2022-08-16T11:30|https://dadosabertos.camara.leg.br/api/v2/orgaos/5503|{'dataHora': '2023-03-29T21:38', 'sequencia': 23, 'siglaOrgao': 'CSPCCO', 'uriOrgao': 'https://dadosabertos.camara.leg.br/api/v2/orgaos/5503', 'uriUltimoRelator': 'https://dadosabertos.camara.leg.br/api/v2/deputados/220552', 'regime': 'Ordinário (Art. 151, III, RICD)', 'descricaoTramitacao': 'Encerramento de Prazo', 'codTipoTramitacao': '600', 'descricaoSituacao': 'Aguardando Parecer', 'codSituacao': 915, 'despacho': 'Encerrado o prazo de 5 sessões para apresentação de emendas ao projeto (de 21/03/2023 a 29/03/2023). Não foram apresentadas emendas.', 'url': None, 'ambito': 'Regimental', 'apreciacao': 'Proposição Sujeita à Apreciação Conclusiva pelas Comissões - Art. 24 II'}|https://dadosabertos.camara.leg.br/api/v2/proposicoes/2334088/autores|Projeto de Lei||Criação, piso salarial, Guarda municipal, reajuste, anual, Índice Nacional de Preços ao Consumidor (INPC).||||https://www.camara.leg.br/proposicoesWeb/prop_mostrarintegra?codteor=2203244|||
2334089|https://dadosabertos.camara.leg.br/api/v2/proposicoes/2334089|PL|139|2299|2022|Altera o art. 9º da Lei nº 10.826, de 22 de dezembro de 2003 – Estatuto do Desarmamento, visando a reunir em um só documento o registro de arma de fogo e a autorização de porte e de transporte de arma de fogo para a categoria colecionadores, atiradores e caçadores.|2022-08-16T11:34||{'dataHora': '2022-08-25T15:49', 'sequencia': 14, 'siglaOrgao': 'CCP', 'uriOrgao': 'https://dadosabertos.camara.leg.br/api/v2/orgaos/186', 'uriUltimoRelator': None, 'regime': 'Ordinário (Art. 151, III, RICD)', 'descricaoTramitacao': 'Apensação', 'codTipoTramitacao': '106', 'descricaoSituacao': 'Tramitando em Conjunto', 'codSituacao': 925, 'despacho': 'Apensação desta proposição ao PL-4307/2021.', 'url': None, 'ambito': 'Protocolar', 'apreciacao': 'Proposição Sujeita à Apreciação do Plenário'}|https://dadosabertos.camara.leg.br/api/v2/proposicoes/2334089/autores|Projeto de Lei||Alteração, Estatuto do Desarmamento, reunião, documento, Certificado de Registro de Arma de Fogo, autorização para o porte de arma de fogo, transporte, arma de fogo, CAC (Caçador, Atirador e Colecionador).|https://dadosabertos.camara.leg.br/api/v2/proposicoes/2310501|||https://www.camara.leg.br/proposicoesWeb/prop_mostrarintegra?codteor=2203245|||
2334093|https://dadosabertos.camara.leg.br/api/v2/proposicoes/2334093|PL|139|2301|2022|Concede ao município de Amparo, situado no Estado de São Paulo, o título de Capital Nacional do Café.|2022-08-16T12:15|https://dadosabertos.camara.leg.br/api/v2/orgaos/2001|{'dataHora': '2023-03-23T00:00', 'sequencia': 21, 'siglaOrgao': 'CAPADR', 'uriOrgao': 'https://dadosabertos.camara.leg.br/api/v2/orgaos/2001', 'uriUltimoRelator': 'https://dadosabertos.camara.leg.br/api/v2/deputados/178871', 'regime': 'Ordinário (Art. 151, III, RICD)', 'descricaoTramitacao': 'Abertura de Prazo', 'codTipoTramitacao': '350', 'descricaoSituacao': 'Aguardando Parecer', 'codSituacao': 915, 'despacho': 'Reabertura do Prazo para Emendas ao Projeto - Art. 166 do RICD (5 sessões a partir de 24/03/2023)', 'url': None, 'ambito': 'Regimental', 'apreciacao': 'Proposição Sujeita à Apreciação Conclusiva pelas Comissões - Art. 24 II'}|https://dadosabertos.camara.leg.br/api/v2/proposicoes/2334093/autores|Projeto de Lei||Título de capital nacional, Capital Nacional do Café, Amparo (SP), São Paulo (ente federado), Título de topônimo.||||https://www.camara.leg.br/proposicoesWeb/prop_mostrarintegra?codteor=2203258|||
2334094|https://dadosabertos.camara.leg.br/api/v2/proposicoes/2334094|PL|139|2302|2022|Concede ao município de Jaú, situado no Estado de São Paulo, o título de Capital Nacional do Sapato.|2022-08-16T12:15||{'dataHora': '2022-11-29T14:11', 'sequencia': 16, 'siglaOrgao': 'CCULT', 'uriOrgao': 'https://dadosabertos.camara.leg.br/api/v2/orgaos/536996', 'uriUltimoRelator': None, 'regime': 'Ordinário (Art. 151, III, RICD)', 'descricaoTramitacao': 'Apensação', 'codTipoTramitacao': '106', 'descricaoSituacao': 'Tramitando em Conjunto', 'codSituacao': 925, 'despacho': 'Apensação desta proposição ao PL 8759/2017.', 'url': None, 'ambito': 'Protocolar', 'apreciacao': 'Proposição Sujeita à Apreciação Conclusiva pelas Comissões - Art. 24 II'}|https://dadosabertos.camara.leg.br/api/v2/proposicoes/2334094/autores|Projeto de Lei||Título de capital nacional, Capital Nacional do Sapato, Jaú (SP), São Paulo (Estado), Título de topônimo.|https://dadosabertos.camara.leg.br/api/v2/proposicoes/2153842|||https://www.camara.leg.br/proposicoesWeb/prop_mostrarintegra?codteor=2203259|||
2334099|https://dadosabertos.camara.leg.br/api/v2/proposicoes/2334099|PL|139|2304|2022|Altera os arts. 155, 157 e 180 do Decreto-Lei nº 2.848, de 7 de dezembro de 1940 – Código Penal -, para apenar de forma mais grave os crimes de furto, roubo ou receptação de instalações de infraestrutura ou equipamentos que comprometam serviços públicos essenciais.|2022-08-16T13:32||{'dataHora': '2022-08-26T00:00', 'sequencia': 17, 'siglaOrgao': 'CCJC', 'uriOrgao': 'https://dadosabertos.camara.leg.br/api/v2/orgaos/2003', 'uriUltimoRelator': None, 'regime': 'Ordinário (Art. 151, III, RICD)', 'descricaoTramitacao': 'Designação de Relator', 'codTipoTramitacao': '320', 'descricaoSituacao': 'Tramitando em Conjunto', 'codSituacao': 925, 'despacho': 'Designado Relator, Dep. Felipe Francischini (PSL-PR)', 'url': None, 'ambito': 'Protocolar', 'apreciacao': 'Proposição Sujeita à Apreciação do Plenário'}|https://dadosabertos.camara.leg.br/api/v2/proposicoes/2334099/autores|Projeto de Lei||Alteração, Código Penal, aumento da pena, crime, furto, roubo, receptação, equipamento, infraestrutura, instalação, comprometimento, comunicação, telefone, conexão. Internet, fornecimento, energia elétrica, água, órgão público, prestação, serviços essenciais, saúde, educação, transporte, segurança.|https://dadosabertos.camara.leg.br/api/v2/proposicoes/2092056|||https://www.camara.leg.br/proposicoesWeb/prop_mostrarintegra?codteor=2203270|||
2334102|https://dadosabertos.camara.leg.br/api/v2/proposicoes/2334102|PL|139|2305|2022|Altera a Lei nº 12.608, de 10 de abril de 2012, que “institui a Política Nacional de Proteção e Defesa Civil-PNPDEC”, a fim de incluir as entidades privadas sem fins lucrativos que utilizam veículos fora de estrada para fins desportivos (“jipeiros”) como agentes de proteção e defesa civil.|2022-08-16T14:51||{'dataHora': '2022-08-30T14:44', 'sequencia': 16, 'siglaOrgao': 'CINDRE', 'uriOrgao': 'https://dadosabertos.camara.leg.br/api/v2/orgaos/2017', 'uriUltimoRelator': None, 'regime': 'Ordinário (Art. 151, III, RICD)', 'descricaoTramitacao': 'Apensação', 'codTipoTramitacao': '106', 'descricaoSituacao': 'Tramitando em Conjunto', 'codSituacao': 925, 'despacho': 'Apensação desta proposição ao PL 1219/2022.', 'url': None, 'ambito': 'Protocolar', 'apreciacao': 'Proposição Sujeita à Apreciação Conclusiva pelas Comissões - Art. 24 II'}|https://dadosabertos.camara.leg.br/api/v2/proposicoes/2334102/autores|Projeto de Lei||Alteração, Lei Federal, inclusão, Política Nacional de Proteção e Defesa Civil (PNPDEC), Entidade sem fins lucrativos, utilização, veículo, finalidade, esporte, jipeiro, agente de defesa civil.|https://dadosabertos.camara.leg.br/api/v2/proposicoes/2322742|||https://www.camara.leg.br/proposicoesWeb/prop_mostrarintegra?codteor=2203297|||
2334106|https://dadosabertos.camara.leg.br/api/v2/proposicoes/2334106|PL|139|2306|2022|Altera a Lei nº 9.249, de 26 de dezembro de 1995, que trata sobre o imposto de renda das pessoas jurídicas, e a Lei nº 9.250, de 26 de dezembro de 1995, que trata do imposto de renda das pessoas físicas, especificando a destinação de recursos às entidades filantrópicas.|2022-08-16T16:21||{'dataHora': '2022-08-25T00:00', 'sequencia': 16, 'siglaOrgao': 'CCP', 'uriOrgao': 'https://dadosabertos.camara.leg.br/api/v2/orgaos/186', 'uriUltimoRelator': None, 'regime': 'Ordinário (Art. 151, III, RICD)', 'descricaoTramitacao': 'Publicação de Proposição', 'codTipoTramitacao': '604', 'descricaoSituacao': 'Tramitando em Conjunto', 'codSituacao': 925, 'despacho': 'Encaminhada à publicação. Publicação Inicial em avulso e no DCD de 26/08/2022 PAG 59', 'url': None, 'ambito': 'Regimental', 'apreciacao': 'Proposição Sujeita à Apreciação Conclusiva pelas Comissões - Art. 24 II'}|https://dadosabertos.camara.leg.br/api/v2/proposicoes/2334106/autores|Projeto de Lei||Alteração, Legislação Tributária Federal, dedução, Imposto de Renda das Pessoas Jurídicas (IRPJ), doação,   Entidade beneficente, prestação de serviços, gratuidade, benefício, empregado, pessoa jurídica, dependente, benefício, comunidade, atuação, assistência social, saúde, educação. _Alteração, Lei Federal, dedução, Imposto sobre a Renda da Pessoa Física (IRPF), contribuição, doação, Entidade beneficente, atuação, assistência social, saúde, educação.|https://dadosabertos.camara.leg.br/api/v2/proposicoes/2213914|||https://www.camara.leg.br/proposicoesWeb/prop_mostrarintegra?codteor=2203316|||
2334109|https://dadosabertos.camara.leg.br/api/v2/proposicoes/2334109|PL|139|2307|2022|Dispõe sobre o transporte gratuito de mesários e jurados no exercício do múnus público, bem como, de testemunha e vítima oficialmente intimadas para comparecer em unidade jurisdicional ou de polícia judiciária.|2022-08-16T16:42|https://dadosabertos.camara.leg.br/api/v2/orgaos/2016|{'dataHora': '2023-01-31T00:00', 'sequencia': 19, 'siglaOrgao': 'CVT', 'uriOrgao': 'https://dadosabertos.camara.leg.br/api/v2/orgaos/2016', 'uriUltimoRelator': 'https://dadosabertos.camara.leg.br/api/v2/deputados/204456', 'regime': 'Ordinário (Art. 151, III, RICD)', 'descricaoTramitacao': 'Saída de Relator da Comissão - Sem Parecer Apresentado', 'codTipoTramitacao': '1250', 'descricaoSituacao': 'Aguardando Designação de Relator', 'codSituacao': 907, 'despacho': '(Fim de Legislatura) O Relator, Dep. Gutemberg Reis, deixou de ser membro da Comissão', 'url': None, 'ambito': 'Regimental', 'apreciacao': 'Proposição Sujeita à Apreciação Conclusiva pelas Comissões - Art. 24 II'}|https://dadosabertos.camara.leg.br/api/v2/proposicoes/2334109/autores|Projeto de Lei||Concessionário (administração pública), permissionário (administração pública), transporte público, oferecimento, transporte gratuito, mesário eleitoral, jurado do tribunal do júri, exercício profissional, testemunha, vítima, comparecimento, unidade, organização judiciária, Polícia judiciária.||||https://www.camara.leg.br/proposicoesWeb/prop_mostrarintegra?codteor=2203319|||
2334110|https://dadosabertos.camara.leg.br/api/v2/proposicoes/2334110|PL|139|2308|2022|Institui a Semana Nacional de incentivo à doação de órgãos.|2022-08-16T16:42||{'dataHora': '2022-08-25T00:00', 'sequencia': 14, 'siglaOrgao': 'CCP', 'uriOrgao': 'https://dadosabertos.camara.leg.br/api/v2/orgaos/186', 'uriUltimoRelator': None, 'regime': 'Prioridade (Art. 151, II, RICD)', 'descricaoTramitacao': 'Publicação de Proposição', 'codTipoTramitacao': '604', 'descricaoSituacao': 'Tramitando em Conjunto', 'codSituacao': 925, 'despacho': 'Encaminhada à publicação. Publicação Inicial em avulso e no DCD de 26/08/2022 PAG 67', 'url': None, 'ambito': 'Regimental', 'apreciacao': 'Proposição Sujeita à Apreciação do Plenário'}|https://dadosabertos.camara.leg.br/api/v2/proposicoes/2334110/autores|Projeto de Lei||Criação, Semana Nacional de Incentivo à Doação de Órgãos, comemoração, setembro, diretrizes, incentivo, Doação de órgão ou tecido.|https://dadosabertos.camara.leg.br/api/v2/proposicoes/2182264|||https://www.camara.leg.br/proposicoesWeb/prop_mostrarintegra?codteor=2203320|||
2334111|https://dadosabertos.camara.leg.br/api/v2/proposicoes/2334111|PL|139|2309|2022|Altera a Lei nº 10.741, de 1º de outubro de 2003, que dispõe sobre o Estatuto da Pessoa Idosa e dá outras providências, a fim de incluir mais linhas de ação na política de atendimento à pessoa idosa.|2022-08-16T16:42||{'dataHora': '2022-08-26T00:00', 'sequencia': 17, 'siglaOrgao': 'CCJC', 'uriOrgao': 'https://dadosabertos.camara.leg.br/api/v2/orgaos/2003', 'uriUltimoRelator': None, 'regime': 'Prioridade (Art. 151, II, RICD)', 'descricaoTramitacao': 'Designação de Relator', 'codTipoTramitacao': '320', 'descricaoSituacao': 'Tramitando em Conjunto', 'codSituacao': 925, 'despacho': 'Designado Relator, Dep. Tadeu Alencar (PSB-PE)', 'url': None, 'ambito': 'Protocolar', 'apreciacao': 'Proposição Sujeita à Apreciação do Plenário'}|https://dadosabertos.camara.leg.br/api/v2/proposicoes/2334111/autores|Projeto de Lei||Alteração, Estatuto do Idoso, inclusão, política pública, atendimento, idoso, mobilização, opinião pública, divulgação, campanha educativa, participação, diversidade, segmento, sociedade. _Abertura, Delegacia especializada, prevenção, repressão, ilícito, prática, contra, idoso.|https://dadosabertos.camara.leg.br/api/v2/proposicoes/2192992|||https://www.camara.leg.br/proposicoesWeb/prop_mostrarintegra?codteor=2203321|||
2334114|https://dadosabertos.camara.leg.br/api/v2/proposicoes/2334114|PL|139|2310|2022|Dispõe sobre as ações de Inteligência exercidas pelas instituições previstas nos incisos II, V e VI, do caput do art. 144 da Constituição Federal, destinadas à busca, produção e tratamento de informações necessárias à prevenção da criminalidade e violência, a preservação da ordem pública e a incolumidade das pessoas e do patrimônio.|2022-08-16T17:14|https://dadosabertos.camara.leg.br/api/v2/orgaos/5503|{'dataHora': '2023-03-31T00:00', 'sequencia': 41, 'siglaOrgao': 'CCJC', 'uriOrgao': 'https://dadosabertos.camara.leg.br/api/v2/orgaos/2003', 'uriUltimoRelator': 'https://dadosabertos.camara.leg.br/api/v2/deputados/98057', 'regime': 'Ordinário (Art. 151, III, RICD)', 'descricaoTramitacao': 'Abertura de Prazo', 'codTipoTramitacao': '350', 'descricaoSituacao': 'Aguardando Parecer', 'codSituacao': 915, 'despacho': 'Reabertura do Prazo para Emendas ao Projeto - Art. 166 do RICD (5 sessões a partir de 03/04/2023)', 'url': None, 'ambito': 'Regimental', 'apreciacao': 'Proposição Sujeita à Apreciação Conclusiva pelas Comissões - Art. 24 II'}|https://dadosabertos.camara.leg.br/api/v2/proposicoes/2334114/autores|Projeto de Lei||Disciplinamento, atuação, Inteligência de segurança pública, Polícia rodoviária federal, Polícia militar, Corpo de bombeiros militar, Polícia penal federal, Polícia penal estadual, Polícia penal distrital, pesquisa, produção, tratamento da informação, necessidade, prevenção, criminalidade, violência, preservação, ordem pública, incolumidade pública, pessoa, patrimônio público.||||https://www.camara.leg.br/proposicoesWeb/prop_mostrarintegra?codteor=2203324|||
