id|uri|siglaTipo|codTipo|numero|ano|ementa|dataApresentacao|uriOrgaoNumerador|statusProposicao|uriAutores|descricaoTipo|ementaDetalhada|keywords|uriPropPrincipal|uriPropAnterior|uriPropPosterior|urlInteiroTeor|urnFinal|texto|justificativa
2333984|https://dadosabertos.camara.leg.br/api/v2/proposicoes/2333984|PL|139|2270|2022|Institui a Semana Nacional de Enfrentamento a Erotização Infantil|2022-08-12T09:02||{'dataHora': '2022-08-17T00:00', 'sequencia': 15, 'siglaOrgao': 'CCP', 'uriOrgao': 'https://dadosabertos.camara.leg.br/api/v2/orgaos/186', 'uriUltimoRelator': None, 'regime': 'Ordinário (Art. 151, III, RICD)', 'descricaoTramitacao': 'Publicação de Proposição', 'codTipoTramitacao': '604', 'descricaoSituacao': 'Aguardando Designação de Relator', 'codSituacao': 907, 'despacho': 'Encaminhada à publicação. Publicação Inicial em avulso e no DCD de 18/08/2022 PAG 87', 'url': None, 'ambito': 'Regimental', 'apreciacao': 'Proposição Sujeita à Apreciação Conclusiva pelas Comissões - Art. 24 II'}|https://dadosabertos.camara.leg.br/api/v2/proposicoes/2333984/autores|Projeto de Lei||Criação, Semana Nacional de Enfrentamento a Erotização Infantil, comemoração, outubro.||||https://www.camara.leg.br/proposicoesWeb/prop_mostrarintegra?codteor=2202815|||
2333985|https://dadosabertos.camara.leg.br/api/v2/proposicoes/2333985|PL|139|2271|2022|Altera a Lei nº 13.021, de 8 de agosto de 2014, para dispor sobre a inscrição dos técnicos de farmácia nos quadros profissionais dos Conselhos Regionais de Farmácia.|2022-08-12T09:23||{'dataHora': '2022-08-29T13:04', 'sequencia': 22, 'siglaOrgao': 'CCP', 'uriOrgao': 'https://dadosabertos.camara.leg.br/api/v2/orgaos/186', 'uriUltimoRelator': None, 'regime': 'Ordinário (Art. 151, III, RICD)', 'descricaoTramitacao': 'Recebimento', 'codTipoTramitacao': '500', 'descricaoSituacao': 'Retirado pelo Autor', 'codSituacao': 950, 'despacho': 'Recebimento pela CCP.', 'url': None, 'ambito': 'Protocolar', 'apreciacao': 'Proposição Sujeita à Apreciação Conclusiva pelas Comissões - Art. 24 II'}|https://dadosabertos.camara.leg.br/api/v2/proposicoes/2333985/autores|Projeto de Lei||Alteração, Lei Federal, âmbito, assistência farmacêutica, farmácia, funcionamento, obrigatoriedade, presença, farmacêutico, técnico em farmácia, inscrição, Conselho Regional de Farmácia (CRF). _Proprietário, farmácia, proibição, desautorização, orientação técnica, emissão, farmacêutico, técnico em farmácia, _Atribuição, farmacêutico, técnico em farmácia.||||https://www.camara.leg.br/proposicoesWeb/prop_mostrarintegra?codteor=2202842|||
2333987|https://dadosabertos.camara.leg.br/api/v2/proposicoes/2333987|PL|139|2272|2022|Dispõe sobre os incentivos à mobilidade elétrica no Brasil.|2022-08-12T11:01||{'dataHora': '2022-08-26T00:00', 'sequencia': 17, 'siglaOrgao': 'CDE', 'uriOrgao': 'https://dadosabertos.camara.leg.br/api/v2/orgaos/2008', 'uriUltimoRelator': None, 'regime': 'Ordinário (Art. 151, III, RICD)', 'descricaoTramitacao': 'Devolução ao Relator', 'codTipoTramitacao': '170', 'descricaoSituacao': 'Tramitando em Conjunto', 'codSituacao': 925, 'despacho': 'Devolvido ao Relator, Dep. Guiga Peixoto (PSC-SP)', 'url': None, 'ambito': 'Protocolar', 'apreciacao': 'Proposição Sujeita à Apreciação Conclusiva pelas Comissões - Art. 24 II'}|https://dadosabertos.camara.leg.br/api/v2/proposicoes/2333987/autores|Projeto de Lei||Alteração, Lei do Petróleo, política pública, aproveitamento, fonte de energia, finalidade, fomento, pesquisa e desenvolvimento, geração, energia elétrica, fonte renovável de energia. _Incentivo, desenvolvimento,  Eletromobilidade. _Alteração, Lei Federal, empresa, habilitação, Programa Rota 2030 - Mobilidade e Logística, aplicação, percentagem, benefício fiscal, obtenção, renúncia fiscal, desenvolvimento, tecnologia, veículo elétrico, geração, energia elétrica, procedência, Etanol. _Prazo, aplicação, recursos, pesquisa e desenvolvimento.|https://dadosabertos.camara.leg.br/api/v2/proposicoes/2317613|||https://www.camara.leg.br/proposicoesWeb/prop_mostrarintegra?codteor=2202863|||
2333988|https://dadosabertos.camara.leg.br/api/v2/proposicoes/2333988|PL|139|2273|2022|Aumenta as penas dos crimes de violência política.|2022-08-12T11:02||{'dataHora': '2022-08-18T12:05', 'sequencia': 15, 'siglaOrgao': 'CTRAB', 'uriOrgao': 'https://dadosabertos.camara.leg.br/api/v2/orgaos/2015', 'uriUltimoRelator': None, 'regime': 'Ordinário (Art. 151, III, RICD)', 'descricaoTramitacao': 'Recebimento', 'codTipoTramitacao': '500', 'descricaoSituacao': 'Tramitando em Conjunto', 'codSituacao': 925, 'despacho': 'Recebimento pela CTASP, apensado ao PL-2268/2022', 'url': None, 'ambito': 'Regimental', 'apreciacao': 'Proposição Sujeita à Apreciação Conclusiva pelas Comissões - Art. 24 II'}|https://dadosabertos.camara.leg.br/api/v2/proposicoes/2333988/autores|Projeto de Lei|Altera o Decreto-Lei nº 2.848 de 1940 e a Lei nº 4.737 de 1965.|Alteração, Código Penal, Código Eleitoral (1965), Crime contra o funcionamento das instituições democráticas no processo eleitoral, violência política, aumento da pena.|https://dadosabertos.camara.leg.br/api/v2/proposicoes/2333978|||https://www.camara.leg.br/proposicoesWeb/prop_mostrarintegra?codteor=2202865|||
2333989|https://dadosabertos.camara.leg.br/api/v2/proposicoes/2333989|PL|139|2274|2022|Altera a Lei nº 11.482, de 31 de maio de 2007, a Lei nº 7.713, de 22 de dezembro de 1988, e a Lei nº 9.250, de 26 de dezembro de 1995, para modificar as alíquotas e as faixas de tributação constantes na tabela progressiva do Imposto sobre a Renda das Pessoas Físicas; para fixar índice e estabelecer normas gerais de correção monetária anual da tabela progressiva e das deduções aplicáveis à base de cálculo do tributo, para estender as parcelas dedutíveis da base tributável e para definir percentual mínimo obrigatório de recebimento pela União de direitos creditórios em pagamento do imposto devido por meio de escritura pública de cessão, na forma que especifica.|2022-08-12T11:30|https://dadosabertos.camara.leg.br/api/v2/orgaos/4|"{'dataHora': '2022-08-24T00:00', 'sequencia': 18, 'siglaOrgao': 'MESA', 'uriOrgao': 'https://dadosabertos.camara.leg.br/api/v2/orgaos/4', 'uriUltimoRelator': None, 'regime': 'Prioridade (Art. 151, II, RICD)', 'descricaoTramitacao': 'Notificação de Despacho', 'codTipoTramitacao': '203', 'descricaoSituacao': 'Tramitando em Conjunto', 'codSituacao': 925, 'despacho': 'Indeferido o Requerimento n. 1.329/2022, conforme despacho do seguinte teor: ""Indefiro o Requerimento n. 1.329/2022, nos termos do artigo 142 do Regimento Interno da Câmara dos Deputados, porquanto os Projetos de Lei n. 2.429/2021 e n. 2.274/2022 tratam de matérias correlatas. Publique-se. Oficie-se."".', 'url': None, 'ambito': 'Regimental', 'apreciacao': 'Proposição Sujeita à Apreciação do Plenário'}"|https://dadosabertos.camara.leg.br/api/v2/proposicoes/2333989/autores|Projeto de Lei||Alteração, lei federal, alíquota, tabela progressiva, Imposto sobre a Renda da Pessoa Física (IRPF), correção monetária, Índice Nacional de Preços ao Consumidor Amplo (IPCA), tributação. _Alteração, Legislação Tributária Federal, atualização, valor, isenção tributária, Imposto sobre a Renda e Proventos de Qualquer Natureza (IR), provento (remuneração), aposentadoria, critério, correção monetária, Índice Nacional de Preços ao Consumidor Amplo (IPCA). _Alteração, Legislação Tributária Federal, atualização, valor, dedução, base de cálculo, Imposto sobre a Renda da Pessoa Física (IRPF), gasto, dependente, parcela isenta, aposentadoria, pensão, idoso. _Dedução, Imposto sobre a Renda da Pessoa Física (IRPF), despesa, plano de saúde, medicamento, curso (educação), língua estrangeira, esporte olímpico, pagamento, aluguel, contribuição previdenciária patronal, empregador doméstico, dívida tributária, dívida, financiamento habitacional, empréstimo bancário. _Atualização, valor, desconto simplificado. _Alteração, Lei do Ajuste Tributário, diretrizes, compensação tributária.|https://dadosabertos.camara.leg.br/api/v2/proposicoes/2289523|||https://www.camara.leg.br/proposicoesWeb/prop_mostrarintegra?codteor=2202866|||
2334000|https://dadosabertos.camara.leg.br/api/v2/proposicoes/2334000|PL|139|2276|2022|OBRIGA OS ESTABELECIMENTOS A PRESTAREM A INFORMAÇÃO ADEQUADA AO CONSUMIDOR EM RELAÇÃO AOS PRODUTOS ASSEMELHADOS .|2022-08-12T15:48||{'dataHora': '2022-08-26T00:00', 'sequencia': 18, 'siglaOrgao': 'CDE', 'uriOrgao': 'https://dadosabertos.camara.leg.br/api/v2/orgaos/2008', 'uriUltimoRelator': None, 'regime': 'Ordinário (Art. 151, III, RICD)', 'descricaoTramitacao': 'Designação de Relator', 'codTipoTramitacao': '320', 'descricaoSituacao': 'Tramitando em Conjunto', 'codSituacao': 925, 'despacho': 'Designado Relator, Dep. Glaustin da Fokus (PSC-GO)', 'url': None, 'ambito': 'Protocolar', 'apreciacao': 'Proposição Sujeita à Apreciação Conclusiva pelas Comissões - Art. 24 II'}|https://dadosabertos.camara.leg.br/api/v2/proposicoes/2334000/autores|Projeto de Lei||Estabelecimento comercial, mercado, obrigatoriedade, informação ao consumidor, alimento, produto análogo, defesa do consumidor.|https://dadosabertos.camara.leg.br/api/v2/proposicoes/2270573|||https://www.camara.leg.br/proposicoesWeb/prop_mostrarintegra?codteor=2202940|||
2334001|https://dadosabertos.camara.leg.br/api/v2/proposicoes/2334001|PL|139|2277|2022|Acrescenta parágrafo ao art. 41 da Lei nº 10.741, de 1º de outubro de 2003, que dispõe sobre o Estatuto do Idoso e dá outras providências.|2022-08-12T15:50||{'dataHora': '2022-08-17T00:00', 'sequencia': 18, 'siglaOrgao': 'CCP', 'uriOrgao': 'https://dadosabertos.camara.leg.br/api/v2/orgaos/186', 'uriUltimoRelator': None, 'regime': 'Ordinário (Art. 151, III, RICD)', 'descricaoTramitacao': 'Publicação de Proposição', 'codTipoTramitacao': '604', 'descricaoSituacao': 'Tramitando em Conjunto', 'codSituacao': 925, 'despacho': 'Encaminhada à publicação. Publicação Inicial em avulso e no DCD de 18/08/2022 PAG 116', 'url': None, 'ambito': 'Regimental', 'apreciacao': 'Proposição Sujeita à Apreciação do Plenário'}|https://dadosabertos.camara.leg.br/api/v2/proposicoes/2334001/autores|Projeto de Lei||Alteração, Estatuto da Pessoa Idosa, direitos do idoso, desconto, estacionamento.|https://dadosabertos.camara.leg.br/api/v2/proposicoes/591401|||https://www.camara.leg.br/proposicoesWeb/prop_mostrarintegra?codteor=2202941|||
2334003|https://dadosabertos.camara.leg.br/api/v2/proposicoes/2334003|PL|139|2278|2022|"DISPÕE SOBRE A ATIVIDADE DE BOMBEIROS CIVIS E FIXA CRITÉRIOS MÍNIMOS DE SEGURANÇA PARA ESTABELECIMENTOS OU EVENTOS DE GRANDE CONCENTRAÇÃO PÚBLICA EM ÂMBITO NACIONAL E DÁ OUTRAS
PROVIDÊNCIAS."|2022-08-12T15:50||{'dataHora': '2022-08-31T08:17', 'sequencia': 17, 'siglaOrgao': 'CDU', 'uriOrgao': 'https://dadosabertos.camara.leg.br/api/v2/orgaos/2006', 'uriUltimoRelator': None, 'regime': 'Ordinário (Art. 151, III, RICD)', 'descricaoTramitacao': 'Apensação', 'codTipoTramitacao': '106', 'descricaoSituacao': 'Tramitando em Conjunto', 'codSituacao': 925, 'despacho': 'Apensação desta proposição ao PL 3667/2021.', 'url': None, 'ambito': 'Protocolar', 'apreciacao': 'Proposição Sujeita à Apreciação Conclusiva pelas Comissões - Art. 24 II'}|https://dadosabertos.camara.leg.br/api/v2/proposicoes/2334003/autores|Projeto de Lei||Diretrizes, segurança, funcionamento, estabelecimento comercial, shopping center, casa de espetáculo, mercado, evento, reunião pública. _Atuação, bombeiro civil, segurança, incêndio, brigada de incêndio.|https://dadosabertos.camara.leg.br/api/v2/proposicoes/2303425|||https://www.camara.leg.br/proposicoesWeb/prop_mostrarintegra?codteor=2202943|||
2334004|https://dadosabertos.camara.leg.br/api/v2/proposicoes/2334004|PL|139|2279|2022|Dispõe sobre a instituição na base de dados da Receita Federal do Brasil, do cadastro compulsório do responsável técnico contábil, nos termos que dispõe.|2022-08-12T17:50|https://dadosabertos.camara.leg.br/api/v2/orgaos/2008|{'dataHora': '2023-03-17T17:13', 'sequencia': 31, 'siglaOrgao': 'CICS', 'uriOrgao': 'https://dadosabertos.camara.leg.br/api/v2/orgaos/539386', 'uriUltimoRelator': 'https://dadosabertos.camara.leg.br/api/v2/deputados/204573', 'regime': 'Ordinário (Art. 151, III, RICD)', 'descricaoTramitacao': 'Recebimento', 'codTipoTramitacao': '500', 'descricaoSituacao': 'Aguardando Designação de Relator', 'codSituacao': 907, 'despacho': 'Recebimento pela CICS.', 'url': None, 'ambito': 'Regimental', 'apreciacao': 'Proposição Sujeita à Apreciação Conclusiva pelas Comissões - Art. 24 II'}|https://dadosabertos.camara.leg.br/api/v2/proposicoes/2334004/autores|Projeto de Lei||Criação, cadastro, profissional, contabilidade, responsável técnico, contribuinte, pessoa jurídica, âmbito, Secretaria Especial da Receita Federal do Brasil. _Dados, cadastro, responsável técnico, pessoa física, pessoa jurídica, realização, meio eletrônico, autodeclaração. _ Secretaria Especial da Receita Federal do Brasil, solitaçâo, Conselho Federal de Contabilidade (CFC), apoio logístico, divulgação, cadastro, troca, informação.||||https://www.camara.leg.br/proposicoesWeb/prop_mostrarintegra?codteor=2203039|||
2334005|https://dadosabertos.camara.leg.br/api/v2/proposicoes/2334005|PL|139|2280|2022|Proíbe a concessão de homenagens a pessoas que tenham sido condenadas por atos de improbidade ou crime de corrupção, e dá outras providências.|2022-08-15T10:22||{'dataHora': '2022-11-17T00:00', 'sequencia': 19, 'siglaOrgao': 'CCULT', 'uriOrgao': 'https://dadosabertos.camara.leg.br/api/v2/orgaos/536996', 'uriUltimoRelator': None, 'regime': 'Ordinário (Art. 151, III, RICD)', 'descricaoTramitacao': 'Devolução ao Relator', 'codTipoTramitacao': '170', 'descricaoSituacao': 'Tramitando em Conjunto', 'codSituacao': 925, 'despacho': 'Devolvida à Relatora, Dep. Alice Portugal (PCdoB-BA)', 'url': None, 'ambito': 'Protocolar', 'apreciacao': 'Proposição Sujeita à Apreciação Conclusiva pelas Comissões - Art. 24 II'}|https://dadosabertos.camara.leg.br/api/v2/proposicoes/2334005/autores|Projeto de Lei||Proibição, âmbito, Administração pública, concessão, homenagem, pessoa, condenado, Improbidade administrativa, crime, corrupção, Crime contra a humanidade, tortura, exploração, trabalho escravo, violação, direitos humanos, maus-tratos, animal. _ Logradouro público, edifício público, nomeação, desacordo, lei, prazo, retificação.|https://dadosabertos.camara.leg.br/api/v2/proposicoes/2200626|||https://www.camara.leg.br/proposicoesWeb/prop_mostrarintegra?codteor=2203046|||
2334006|https://dadosabertos.camara.leg.br/api/v2/proposicoes/2334006|PL|139|2281|2022|Estabelece diretrizes para as exposições justificativas de aberturas de créditos suplementares e especiais pelo Poder Executivo.|2022-08-15T10:27||{'dataHora': '2022-10-04T00:00', 'sequencia': 12, 'siglaOrgao': 'CCP', 'uriOrgao': 'https://dadosabertos.camara.leg.br/api/v2/orgaos/186', 'uriUltimoRelator': None, 'regime': '.', 'descricaoTramitacao': 'Publicação de Proposição', 'codTipoTramitacao': '604', 'descricaoSituacao': 'Devolvida ao Autor', 'codSituacao': 1120, 'despacho': 'Encaminhada à publicação. Publicação Inicial no DCD de 05/10/2022 PAG 61', 'url': 'https://www.camara.leg.br/proposicoesWeb/prop_mostrarintegra?codteor=2236576', 'ambito': 'Regimental', 'apreciacao': 'Indefinida'}|https://dadosabertos.camara.leg.br/api/v2/proposicoes/2334006/autores|Projeto de Lei||Diretrizes, exposição de motivos, justificativa, decreto, abertura, crédito suplementar, crédito especial.||||https://www.camara.leg.br/proposicoesWeb/prop_mostrarintegra?codteor=2203048|||
2334007|https://dadosabertos.camara.leg.br/api/v2/proposicoes/2334007|PL|139|2282|2022|Estabelece o descarte correto de máscara de proteção individual e equipamentos de proteção individual - EPI e dá outras providências.|2022-08-15T10:29|https://dadosabertos.camara.leg.br/api/v2/orgaos/6174|{'dataHora': '2023-01-31T00:00', 'sequencia': 21, 'siglaOrgao': 'CMADS', 'uriOrgao': 'https://dadosabertos.camara.leg.br/api/v2/orgaos/6174', 'uriUltimoRelator': 'https://dadosabertos.camara.leg.br/api/v2/deputados/178962', 'regime': 'Ordinário (Art. 151, III, RICD)', 'descricaoTramitacao': 'Saída de Relator da Comissão - Sem Parecer Apresentado', 'codTipoTramitacao': '1250', 'descricaoSituacao': 'Aguardando Designação de Relator', 'codSituacao': 907, 'despacho': '(Fim de Legislatura) O Relator, Dep. Carlos Gomes, deixou de ser membro da Comissão', 'url': None, 'ambito': 'Regimental', 'apreciacao': 'Proposição Sujeita à Apreciação Conclusiva pelas Comissões - Art. 24 II'}|https://dadosabertos.camara.leg.br/api/v2/proposicoes/2334007/autores|Projeto de Lei||Norma geral, descarte correto, máscara de proteção, equipamento de proteção individual, Via pública, logradouro público, recipiente transportável, lixo doméstico, lixo comercial, proteção, meio ambiente, animal.||||https://www.camara.leg.br/proposicoesWeb/prop_mostrarintegra?codteor=2203049|||
2334008|https://dadosabertos.camara.leg.br/api/v2/proposicoes/2334008|PL|139|2283|2022|"Dispõe que maternidades, casas de parto e estabelecimentos hospitalares congêneres, da rede pública e privada de todo o território nacional ficam obrigados a permitir a
presença de doulas durante todo o período prénatal, trabalho de parto, parto e pós-parto
imediato, sempre que solicitado pela parturiente."|2022-08-15T10:31||{'dataHora': '2022-08-30T00:00', 'sequencia': 17, 'siglaOrgao': 'CE', 'uriOrgao': 'https://dadosabertos.camara.leg.br/api/v2/orgaos/2009', 'uriUltimoRelator': None, 'regime': 'Urgência (Art. 155, RICD)', 'descricaoTramitacao': 'Designação de Relator', 'codTipoTramitacao': '320', 'descricaoSituacao': 'Tramitando em Conjunto', 'codSituacao': 925, 'despacho': 'Designado Relator, Dep. Diego Garcia (REPUBLIC-PR)', 'url': None, 'ambito': 'Protocolar', 'apreciacao': 'Proposição Sujeita à Apreciação Conclusiva pelas Comissões - Art. 24 II'}|https://dadosabertos.camara.leg.br/api/v2/proposicoes/2334008/autores|Projeto de Lei||Maternidade, hospital, casa, parto, autorização, solicitação, parturiente, presença, doula, período, trabalho de parto, parto, puerpério. _Exercício profissional, doula, instrumento de trabalho. _Proibição, doula, realização, procedimento médico, ausência, remuneração. _Unidade de saúde, proibição, cobrança, adicional, presença, doula.|https://dadosabertos.camara.leg.br/api/v2/proposicoes/2191124|||https://www.camara.leg.br/proposicoesWeb/prop_mostrarintegra?codteor=2203050|||
2334032|https://dadosabertos.camara.leg.br/api/v2/proposicoes/2334032|PL|139|2287|2022|ALTERA A REDAÇÃO § 2º DA DO CTB PARA DESVINCULAR O PAGAMENTO DE MULTAS, TRIBUTOS E OUTROS ENCARGOS DO PAGAMENTO DO LICENCIAMENTO DOS VEÍCULOS.|2022-08-15T12:39||{'dataHora': '2022-08-17T00:00', 'sequencia': 17, 'siglaOrgao': 'CCP', 'uriOrgao': 'https://dadosabertos.camara.leg.br/api/v2/orgaos/186', 'uriUltimoRelator': None, 'regime': 'Ordinário (Art. 151, III, RICD)', 'descricaoTramitacao': 'Publicação de Proposição', 'codTipoTramitacao': '604', 'descricaoSituacao': 'Tramitando em Conjunto', 'codSituacao': 925, 'despacho': 'Encaminhada à publicação. Publicação Inicial em avulso e no DCD de 18/08/2022 PAG 142', 'url': None, 'ambito': 'Regimental', 'apreciacao': 'Proposição Sujeita à Apreciação Conclusiva pelas Comissões - Art. 24 II'}|https://dadosabertos.camara.leg.br/api/v2/proposicoes/2334032/autores|Projeto de Lei||Alteração, Código de Trânsito Brasileiro, desvinculação, pagamento, multa de trânsito, tributo, encargo, quitação, taxa, licenciamento anual veicular.|https://dadosabertos.camara.leg.br/api/v2/proposicoes/2236373|||https://www.camara.leg.br/proposicoesWeb/prop_mostrarintegra?codteor=2203082|||
2334034|https://dadosabertos.camara.leg.br/api/v2/proposicoes/2334034|PL|139|2288|2022|Institui o Programa Nacional Amigo dos Animais e cria o Selo Nacional Pet Friendly.|2022-08-15T13:27||{'dataHora': '2022-08-25T15:52', 'sequencia': 14, 'siglaOrgao': 'CCP', 'uriOrgao': 'https://dadosabertos.camara.leg.br/api/v2/orgaos/186', 'uriUltimoRelator': None, 'regime': 'Ordinário (Art. 151, III, RICD)', 'descricaoTramitacao': 'Apensação', 'codTipoTramitacao': '106', 'descricaoSituacao': 'Tramitando em Conjunto', 'codSituacao': 925, 'despacho': 'Apensação desta proposição ao PL-1457/2019.', 'url': None, 'ambito': 'Protocolar', 'apreciacao': 'Proposição Sujeita à Apreciação do Plenário'}|https://dadosabertos.camara.leg.br/api/v2/proposicoes/2334034/autores|Projeto de Lei||Criação, Programa Nacional Amigo dos Animais, finalidade, garantia, certificação, estabelecimento comercial, cumprimento, requisito, entrada, circulação, permanência, animal domesticado, acompanhamento, tutor, princípios, diretrizes. _Adesão, Programa Nacional Amigo dos Animais, categoria, estabelecimento comercial. _Criação, âmbito, Programa Nacional Amigo dos Animais, Selo Nacional Pet Friendly, concessão, estabelecimento comercial, cumprimento, requisito, adesão, programa (administração).|https://dadosabertos.camara.leg.br/api/v2/proposicoes/2193825|||https://www.camara.leg.br/proposicoesWeb/prop_mostrarintegra?codteor=2203088|||
2334038|https://dadosabertos.camara.leg.br/api/v2/proposicoes/2334038|PL|139|2289|2022|Altera a Lei nº 9.537, de 11 de dezembro de 1997, para dispensar a regularização do registro da embarcação nos casos de instalação de proteção do motor, eixo e partes móveis, quando executadas ou patrocinadas pelo poder público.|2022-08-15T14:09|https://dadosabertos.camara.leg.br/api/v2/orgaos/2016|{'dataHora': '2023-03-30T00:00', 'sequencia': 21, 'siglaOrgao': 'CVT', 'uriOrgao': 'https://dadosabertos.camara.leg.br/api/v2/orgaos/2016', 'uriUltimoRelator': 'https://dadosabertos.camara.leg.br/api/v2/deputados/160548', 'regime': 'Ordinário (Art. 151, III, RICD)', 'descricaoTramitacao': 'Abertura de Prazo', 'codTipoTramitacao': '350', 'descricaoSituacao': 'Aguardando Parecer', 'codSituacao': 915, 'despacho': 'Reabertura do Prazo para Emendas ao Projeto - Art. 166 do RICD (5 sessões a partir de 31/03/2023)', 'url': None, 'ambito': 'Regimental', 'apreciacao': 'Proposição Sujeita à Apreciação Conclusiva pelas Comissões - Art. 24 II'}|https://dadosabertos.camara.leg.br/api/v2/proposicoes/2334038/autores|Projeto de Lei||Alteração, Lei de Segurança do Tráfego Aquaviário, dispensa, regularização, registro, embarcação, hipótese, instalação, proteção, motor, eixo de embarcação, dispositivo móvel, patrocínio, poder público.||||https://www.camara.leg.br/proposicoesWeb/prop_mostrarintegra?codteor=2203097|||
2334039|https://dadosabertos.camara.leg.br/api/v2/proposicoes/2334039|PL|139|2290|2022|Dispõe sobre a instalação de sistemas individualizados de geração de energia elétrica a partir de fontes renováveis e de aquecimento solar de água em moradias incluídas em programas governamentais de habitação popular e dá outras providências|2022-08-15T14:12||{'dataHora': '2022-10-11T16:53', 'sequencia': 16, 'siglaOrgao': 'CMADS', 'uriOrgao': 'https://dadosabertos.camara.leg.br/api/v2/orgaos/6174', 'uriUltimoRelator': None, 'regime': 'Prioridade (Art. 151, II, RICD)', 'descricaoTramitacao': 'Apensação', 'codTipoTramitacao': '106', 'descricaoSituacao': 'Tramitando em Conjunto', 'codSituacao': 925, 'despacho': 'Apensação desta proposição ao PL 1482/2021.', 'url': None, 'ambito': 'Protocolar', 'apreciacao': 'Proposição Sujeita à Apreciação do Plenário'}|https://dadosabertos.camara.leg.br/api/v2/proposicoes/2334039/autores|Projeto de Lei||Alteração, Lei do Sistema Nacional de Habitação de Interesse Social, Lei do Programa Minha Casa, Minha Vida, Lei Federal, Programa Casa Verde e Amarela, instalação, sistema de aquecimento solar, água, individualização, geração de energia elétrica, fonte renovável de energia, habitação de interesse social, financiamento, Fundo Nacional de Habitação de Interesse Social (FNHIS). _Concessionária de serviço de energia elétrica, gratuidade, assistência técnica, instalação, sistema individual de geração de energia elétrica, fonte renovável de energia, sistema de aquecimento solar, água, habitação.|https://dadosabertos.camara.leg.br/api/v2/proposicoes/2278698|||https://www.camara.leg.br/proposicoesWeb/prop_mostrarintegra?codteor=2203098|||
