id|uri|siglaTipo|codTipo|numero|ano|ementa|dataApresentacao|uriOrgaoNumerador|statusProposicao|uriAutores|descricaoTipo|ementaDetalhada|keywords|uriPropPrincipal|uriPropAnterior|uriPropPosterior|urlInteiroTeor|urnFinal|texto|justificativa
2322589|https://dadosabertos.camara.leg.br/api/v2/proposicoes/2322589|PL|139|1197|2022|Institui a Lei da Liberdade Religiosa.|2022-05-11T12:41||{'dataHora': '2022-05-18T00:00', 'sequencia': 14, 'siglaOrgao': 'CCP', 'uriOrgao': 'https://dadosabertos.camara.leg.br/api/v2/orgaos/186', 'uriUltimoRelator': None, 'regime': 'Prioridade (Art. 151, II, RICD)', 'descricaoTramitacao': 'Publicação de Proposição', 'codTipoTramitacao': '604', 'descricaoSituacao': 'Tramitando em Conjunto', 'codSituacao': 925, 'despacho': 'Encaminhada à publicação. Publicação Inicial em avulso e no DCD de 19/05/2022 PAG 611', 'url': 'https://www.camara.leg.br/proposicoesWeb/prop_mostrarintegra?codteor=2204208', 'ambito': 'Regimental', 'apreciacao': 'Proposição Sujeita à Apreciação do Plenário'}|https://dadosabertos.camara.leg.br/api/v2/proposicoes/2322589/autores|Projeto de Lei|Altera o Decreto-Lei nº 5.452 de 1943.|"Criação, Lei da Liberdade Religiosa, Direito constitucional, Liberdade de religião, Princípio do Estado laico, combate, intolerância religiosa,  Organização religiosa, Liberdade de culto.
_ Alteração, Consolidação das Leis do Trabalho (CLT), critério, empregado, Objeção de consciência, motivação religiosa."|https://dadosabertos.camara.leg.br/api/v2/proposicoes/2076943|||https://www.camara.leg.br/proposicoesWeb/prop_mostrarintegra?codteor=2167796|||
2322607|https://dadosabertos.camara.leg.br/api/v2/proposicoes/2322607|PL|139|1199|2022|Confere o título de Capital Nacional das Águas à cidade do Rio Grande, no Estado do Rio Grande do Sul.|2022-05-11T13:30|https://dadosabertos.camara.leg.br/api/v2/orgaos/6174|{'dataHora': '2022-12-02T08:01', 'sequencia': 26, 'siglaOrgao': 'CCJC', 'uriOrgao': 'https://dadosabertos.camara.leg.br/api/v2/orgaos/2003', 'uriUltimoRelator': 'https://dadosabertos.camara.leg.br/api/v2/deputados/178963', 'regime': 'Ordinário (Art. 151, III, RICD)', 'descricaoTramitacao': 'Recebimento', 'codTipoTramitacao': '500', 'descricaoSituacao': 'Aguardando Designação de Relator', 'codSituacao': 907, 'despacho': 'Recebimento pela CCJC.', 'url': None, 'ambito': 'Regimental', 'apreciacao': 'Proposição Sujeita à Apreciação Conclusiva pelas Comissões - Art. 24 II'}|https://dadosabertos.camara.leg.br/api/v2/proposicoes/2322607/autores|Projeto de Lei||Título de Capital Nacional, Capital Nacional das Águas, Rio Grande (RS), Rio Grande do Sul, Título de topônimo.||||https://www.camara.leg.br/proposicoesWeb/prop_mostrarintegra?codteor=2167899|||
2322608|https://dadosabertos.camara.leg.br/api/v2/proposicoes/2322608|PL|139|1200|2022|"Dispõe sobre a renegociação de débitos dos
contratos do Fundo de Financiamento Estudantil
(FIES), firmados até 2017."|2022-05-11T13:45||{'dataHora': '2022-05-18T00:00', 'sequencia': 15, 'siglaOrgao': 'CCP', 'uriOrgao': 'https://dadosabertos.camara.leg.br/api/v2/orgaos/186', 'uriUltimoRelator': None, 'regime': 'Ordinário (Art. 151, III, RICD)', 'descricaoTramitacao': 'Publicação de Proposição', 'codTipoTramitacao': '604', 'descricaoSituacao': 'Aguardando Designação de Relator', 'codSituacao': 907, 'despacho': 'Encaminhada à publicação. Publicação Inicial em avulso e no DCD de 19/05/2022 PAG 653', 'url': None, 'ambito': 'Regimental', 'apreciacao': 'Proposição Sujeita à Apreciação Conclusiva pelas Comissões - Art. 24 II'}|https://dadosabertos.camara.leg.br/api/v2/proposicoes/2322608/autores|Projeto de Lei||Renegociação, dívida vincenda, contrato, Fundo de Financiamento Estudantil (Fies).||||https://www.camara.leg.br/proposicoesWeb/prop_mostrarintegra?codteor=2167904|||
2322611|https://dadosabertos.camara.leg.br/api/v2/proposicoes/2322611|PL|139|1201|2022|Inclui o art. 18-A ao Decreto-Lei nº 667, de 2 de julho de 1969, para regulamentar a movimentação por conveniência da disciplina, para as polícias militares e os corpos de bombeiros militares dos Estados, dos Territórios e do Distrito Federal.|2022-05-11T13:50|https://dadosabertos.camara.leg.br/api/v2/orgaos/5503|{'dataHora': '2022-12-22T13:28', 'sequencia': 31, 'siglaOrgao': 'CCJC', 'uriOrgao': 'https://dadosabertos.camara.leg.br/api/v2/orgaos/2003', 'uriUltimoRelator': 'https://dadosabertos.camara.leg.br/api/v2/deputados/177282', 'regime': 'Ordinário (Art. 151, III, RICD)', 'descricaoTramitacao': 'Recebimento', 'codTipoTramitacao': '500', 'descricaoSituacao': 'Aguardando Designação de Relator', 'codSituacao': 907, 'despacho': 'Recebimento pela CCJC.', 'url': None, 'ambito': 'Regimental', 'apreciacao': 'Proposição Sujeita à Apreciação Conclusiva pelas Comissões - Art. 24 II'}|https://dadosabertos.camara.leg.br/api/v2/proposicoes/2322611/autores|Projeto de Lei||Alteração, Lei de Reorganização da Polícia Militar e do Corpo de Bombeiros Militar, critério, movimentação, afastamento, militar, Oficial da Polícia Militar, Oficial do Corpo de Bombeiros, Praça da Polícia Militar, Praça do Corpo de Bombeiros, princípio da ampla defesa, devido processo legal, disciplina militar.||||https://www.camara.leg.br/proposicoesWeb/prop_mostrarintegra?codteor=2167911|||
2322614|https://dadosabertos.camara.leg.br/api/v2/proposicoes/2322614|PL|139|1202|2022|Estabelece conceito e diretrizes da Comunicação Pública, dispõe sobre a organização dos Serviços de Comunicação Pública nos poderes das esferas federal, estadual, distrital e municipal, nos órgãos autônomos, empresas públicas e entidades conveniadas, e dá outras providências.|2022-05-11T14:07|https://dadosabertos.camara.leg.br/api/v2/orgaos/2002|{'dataHora': '2023-03-30T00:00', 'sequencia': 25, 'siglaOrgao': 'CCOM', 'uriOrgao': 'https://dadosabertos.camara.leg.br/api/v2/orgaos/539385', 'uriUltimoRelator': 'https://dadosabertos.camara.leg.br/api/v2/deputados/74784', 'regime': 'Prioridade (Art. 151, II, RICD)', 'descricaoTramitacao': 'Designação de Relator', 'codTipoTramitacao': '320', 'descricaoSituacao': 'Aguardando Parecer', 'codSituacao': 915, 'despacho': 'Designada Relatora, Dep. Luiza Erundina (PSOL-SP)', 'url': None, 'ambito': 'Regimental', 'apreciacao': 'Proposição Sujeita à Apreciação Conclusiva pelas Comissões - Art. 24 II'}|https://dadosabertos.camara.leg.br/api/v2/proposicoes/2322614/autores|Projeto de Lei||Diretrizes, Comunicação pública, Administração pública, gestão, Serviço de comunicação pública, televisão, rádio, Portal (Internet), Plataforma digital, Perfil institucional, Serviço de atendimento e informação, Ouvidoria pública, Comunicação institucional. _ Criação, Conselho de Comunicação Pública, acompanhamento, Política de Comunicação Pública, Interlocução, Administração Pública, cidadão.||||https://www.camara.leg.br/proposicoesWeb/prop_mostrarintegra?codteor=2167919|||
2322659|https://dadosabertos.camara.leg.br/api/v2/proposicoes/2322659|PL|139|1203|2022|Autoriza o Poder Executivo a criação da Universidade Federal de Teófilo Otoni (UFTO), com sede no Município de Teófilo Otoni – MG.|2022-05-11T15:44||"{'dataHora': '2023-03-27T18:53', 'sequencia': 16, 'siglaOrgao': 'MESA', 'uriOrgao': 'https://dadosabertos.camara.leg.br/api/v2/orgaos/4', 'uriUltimoRelator': None, 'regime': 'Ordinário (Art. 151, III, RICD)', 'descricaoTramitacao': 'Distribuição', 'codTipoTramitacao': '110', 'descricaoSituacao': 'Aguardando Designação de Relator', 'codSituacao': 907, 'despacho': 'Decisão da Presidência  de 27/03/2023, conforme o seguinte teor: ""Tendo em vista a edição da Resolução da Câmara dos Deputados n. 1/2023 [...], criando a Comissão de Trabalho e a Comissão de Administração e Serviço Público, revejo o despacho de distribuição aposto...""...""para o fim de determinar sua redistribuição à Comissão de Admistração e Serviço Público, em substituição à Comissão de Trabalho, de Administração e Serviço Público, extinta pela mesma Resolução."".', 'url': 'https://www.camara.leg.br/proposicoesWeb/prop_mostrarintegra?codteor=2250039', 'ambito': 'Regimental', 'apreciacao': 'Proposição Sujeita à Apreciação Conclusiva pelas Comissões - Art. 24 II'}"|https://dadosabertos.camara.leg.br/api/v2/proposicoes/2322659/autores|Projeto de Lei||Criação, Universidade Federal de Teófilo Otoni (UFTO), localização, Teófilo Otoni (MG), Minas Gerais, educação superior, desenvolvimento, pesquisa, extensão universitária, estrutura organizacional, dotação orçamentária.||||https://www.camara.leg.br/proposicoesWeb/prop_mostrarintegra?codteor=2168062|||
2322691|https://dadosabertos.camara.leg.br/api/v2/proposicoes/2322691|PL|139|1206|2022|Declara o Käsekuchen bolo tradicional da cultura germânica do município de Panambi/RS como Patrimônio Cultural Imaterial do Brasil.|2022-05-11T16:51|https://dadosabertos.camara.leg.br/api/v2/orgaos/536996|{'dataHora': '2022-11-21T13:43', 'sequencia': 29, 'siglaOrgao': 'CCJC', 'uriOrgao': 'https://dadosabertos.camara.leg.br/api/v2/orgaos/2003', 'uriUltimoRelator': 'https://dadosabertos.camara.leg.br/api/v2/deputados/74398', 'regime': 'Ordinário (Art. 151, III, RICD)', 'descricaoTramitacao': 'Recebimento', 'codTipoTramitacao': '500', 'descricaoSituacao': 'Aguardando Designação de Relator', 'codSituacao': 907, 'despacho': 'Recebimento pela CCJC.', 'url': None, 'ambito': 'Regimental', 'apreciacao': 'Proposição Sujeita à Apreciação Conclusiva pelas Comissões - Art. 24 II'}|https://dadosabertos.camara.leg.br/api/v2/proposicoes/2322691/autores|Projeto de Lei||Declaração, Käsekuchen, bolo de queijo alemão, cultura germânica, Panambi (RS), Rio Grande do Sul, patrimônio cultural, patrimônio material.||||https://www.camara.leg.br/proposicoesWeb/prop_mostrarintegra?codteor=2168146|||
2322720|https://dadosabertos.camara.leg.br/api/v2/proposicoes/2322720|PL|139|1213|2022|Altera a Lei nº 14.149, de 5 de maio de 2021, para dispor sobre a aplicação obrigatória do Formulário Nacional de Avaliação de Risco no âmbito das Polícias Civis dos Estados e do Distrito Federal.|2022-05-11T17:34|https://dadosabertos.camara.leg.br/api/v2/orgaos/4|{'dataHora': '2023-03-27T00:00', 'sequencia': 18, 'siglaOrgao': 'CMULHER', 'uriOrgao': 'https://dadosabertos.camara.leg.br/api/v2/orgaos/537870', 'uriUltimoRelator': 'https://dadosabertos.camara.leg.br/api/v2/deputados/220695', 'regime': 'Ordinário (Art. 151, III, RICD)', 'descricaoTramitacao': 'Abertura de Prazo', 'codTipoTramitacao': '350', 'descricaoSituacao': 'Aguardando Parecer', 'codSituacao': 915, 'despacho': 'Prazo para Emendas ao Projeto (5 sessões a partir de 28/03/2023)', 'url': None, 'ambito': 'Regimental', 'apreciacao': 'Proposição Sujeita à Apreciação Conclusiva pelas Comissões - Art. 24 II'}|https://dadosabertos.camara.leg.br/api/v2/proposicoes/2322720/autores|Projeto de Lei||Alteração, Lei Federal, obrigatoriedade, Preferência, Polícia Civil, aplicação, Formulário Nacional de Avaliação de Risco, registro, Ocorrência policial, mulher, vítima, violência doméstica.||||https://www.camara.leg.br/proposicoesWeb/prop_mostrarintegra?codteor=2168219|||
2322721|https://dadosabertos.camara.leg.br/api/v2/proposicoes/2322721|PL|139|1214|2022|Altera a Lei nº 11.340, de 7 de agosto de 2006 (Lei Maria da Penha), para prever a comunicação obrigatória pela autoridade policial sobre o descumprimento das medidas protetivas de urgência ao juiz no prazo de 24 (vinte e quatro) horas e dá outras providências.|2022-05-11T17:35|https://dadosabertos.camara.leg.br/api/v2/orgaos/537870|{'dataHora': '2023-03-27T00:00', 'sequencia': 30, 'siglaOrgao': 'CSPCCO', 'uriOrgao': 'https://dadosabertos.camara.leg.br/api/v2/orgaos/5503', 'uriUltimoRelator': 'https://dadosabertos.camara.leg.br/api/v2/deputados/220625', 'regime': 'Ordinário (Art. 151, III, RICD)', 'descricaoTramitacao': 'Abertura de Prazo', 'codTipoTramitacao': '350', 'descricaoSituacao': 'Aguardando Parecer', 'codSituacao': 915, 'despacho': 'Prazo para Emendas ao Projeto (5 sessões a partir de 28/03/2023)', 'url': None, 'ambito': 'Regimental', 'apreciacao': 'Proposição Sujeita à Apreciação Conclusiva pelas Comissões - Art. 24 II'}|https://dadosabertos.camara.leg.br/api/v2/proposicoes/2322721/autores|Projeto de Lei||Alteração, Lei Maria da Penha, fixação, prazo, autoridade policial, comunicação, juiz, descumprimento, Medida protetiva de urgência, acusado, violência doméstica, vítima mulher.||||https://www.camara.leg.br/proposicoesWeb/prop_mostrarintegra?codteor=2168221|||
2322722|https://dadosabertos.camara.leg.br/api/v2/proposicoes/2322722|PL|139|1215|2022|Dispõe sobre a Estratégia para Saúde Mental nas Escolas (ESME)|2022-05-11T17:40||{'dataHora': '2022-08-15T15:33', 'sequencia': 19, 'siglaOrgao': 'CE', 'uriOrgao': 'https://dadosabertos.camara.leg.br/api/v2/orgaos/2009', 'uriUltimoRelator': None, 'regime': 'Prioridade (Art. 151, II, RICD)', 'descricaoTramitacao': 'Notificação de Apensação', 'codTipoTramitacao': '504', 'descricaoSituacao': 'Tramitando em Conjunto', 'codSituacao': 925, 'despacho': 'Apensação do PL 1596/2022 a esta proposição.', 'url': None, 'ambito': 'Protocolar', 'apreciacao': 'Proposição Sujeita à Apreciação do Plenário'}|https://dadosabertos.camara.leg.br/api/v2/proposicoes/2322722/autores|Projeto de Lei||Ente federado, Estratégia para Saúde Mental nas Escolas (ESME), prevenção, tratamento, saúde mental, escola, diretrizes.|https://dadosabertos.camara.leg.br/api/v2/proposicoes/2314799|||https://www.camara.leg.br/proposicoesWeb/prop_mostrarintegra?codteor=2168223|||
2322728|https://dadosabertos.camara.leg.br/api/v2/proposicoes/2322728|PL|139|1216|2022|Altera a Lei nº 3.689 de 1941 para disciplinar o uso de tornozeleiras eletrônicas.|2022-05-11T18:07||{'dataHora': '2022-05-18T00:00', 'sequencia': 15, 'siglaOrgao': 'CCP', 'uriOrgao': 'https://dadosabertos.camara.leg.br/api/v2/orgaos/186', 'uriUltimoRelator': None, 'regime': 'Ordinário (Art. 151, III, RICD)', 'descricaoTramitacao': 'Publicação de Proposição', 'codTipoTramitacao': '604', 'descricaoSituacao': 'Aguardando Designação de Relator', 'codSituacao': 907, 'despacho': 'Encaminhada à publicação. Publicação Inicial em avulso e no DCD de 19/05/2022 PAG 705', 'url': None, 'ambito': 'Regimental', 'apreciacao': 'Proposição Sujeita à Apreciação Conclusiva pelas Comissões - Art. 24 II'}|https://dadosabertos.camara.leg.br/api/v2/proposicoes/2322728/autores|Projeto de Lei||Alteração, Código de Processo Penal, Medida cautelar, Monitoração eletrônica, acusado, Crime hediondo.||||https://www.camara.leg.br/proposicoesWeb/prop_mostrarintegra?codteor=2168248|||
2322739|https://dadosabertos.camara.leg.br/api/v2/proposicoes/2322739|PL|139|1217|2022|Dispõe sobre a prioridade de matrícula e transferência em instituições públicas de ensino às crianças e aos adolescentes vítimas de violência.|2022-05-11T18:33||{'dataHora': '2022-11-21T22:45', 'sequencia': 19, 'siglaOrgao': 'CSAUDE', 'uriOrgao': 'https://dadosabertos.camara.leg.br/api/v2/orgaos/2014', 'uriUltimoRelator': None, 'regime': 'Prioridade (Art. 151, II, RICD)', 'descricaoTramitacao': 'Recebimento', 'codTipoTramitacao': '500', 'descricaoSituacao': 'Tramitando em Conjunto', 'codSituacao': 925, 'despacho': 'Recebimento pela CSSF, apensado ao PL-2225/2021', 'url': None, 'ambito': 'Regimental', 'apreciacao': 'Proposição Sujeita à Apreciação Conclusiva pelas Comissões - Art. 24 II'}|https://dadosabertos.camara.leg.br/api/v2/proposicoes/2322739/autores|Projeto de Lei||Prioridade, matrícula, transferência, escola pública, criança, adolescente, vítima, violência.|https://dadosabertos.camara.leg.br/api/v2/proposicoes/2319813|||https://www.camara.leg.br/proposicoesWeb/prop_mostrarintegra?codteor=2168284|||
2322740|https://dadosabertos.camara.leg.br/api/v2/proposicoes/2322740|PL|139|1218|2022|A altera o inciso I, do art. 10, da Lei nº 9.263, de 12 de janeiro de 1996, que trata do planejamento familiar, para reduzir a exigência do número de filhos vivos, de 2 para 1, na hipótese de esterilização voluntária.|2022-05-11T18:33||{'dataHora': '2022-05-27T00:00', 'sequencia': 13, 'siglaOrgao': 'CCP', 'uriOrgao': 'https://dadosabertos.camara.leg.br/api/v2/orgaos/186', 'uriUltimoRelator': None, 'regime': '.', 'descricaoTramitacao': 'Publicação de Proposição', 'codTipoTramitacao': '604', 'descricaoSituacao': 'Devolvida ao Autor', 'codSituacao': 1120, 'despacho': 'Encaminhada à publicação. Publicação Inicial no DCD de 28/05/2022 PAG 107', 'url': None, 'ambito': 'Regimental', 'apreciacao': 'Indefinida'}|https://dadosabertos.camara.leg.br/api/v2/proposicoes/2322740/autores|Projeto de Lei||Alteração, Lei do Planejamento Familiar, redução, quantidade, filho, requisito, pais, homem, mulher, Esterilização voluntária.||||https://www.camara.leg.br/proposicoesWeb/prop_mostrarintegra?codteor=2168286|||
2322742|https://dadosabertos.camara.leg.br/api/v2/proposicoes/2322742|PL|139|1219|2022|Dispõe sobre as atribuições municipais dos agentes de proteção e defesa civil.|2022-05-11T18:44||{'dataHora': '2023-03-16T17:05', 'sequencia': 19, 'siglaOrgao': 'CINDRE', 'uriOrgao': 'https://dadosabertos.camara.leg.br/api/v2/orgaos/2017', 'uriUltimoRelator': None, 'regime': 'Ordinário (Art. 151, III, RICD)', 'descricaoTramitacao': 'Notificação de Apensação', 'codTipoTramitacao': '504', 'descricaoSituacao': 'Aguardando Designação de Relator', 'codSituacao': 907, 'despacho': 'Apensação do PL 3070/2022 a esta proposição.', 'url': None, 'ambito': 'Protocolar', 'apreciacao': 'Proposição Sujeita à Apreciação Conclusiva pelas Comissões - Art. 24 II'}|https://dadosabertos.camara.leg.br/api/v2/proposicoes/2322742/autores|Projeto de Lei|Altera a Lei nº 12.608 de 2012.|Alteração, Lei Federal, competência, Município, atribuição, Agente de Proteção e Defesa Civil Municipal, prevenção, Aviso de alerta, atenuação, recuperação, Desastre ambiental.||||https://www.camara.leg.br/proposicoesWeb/prop_mostrarintegra?codteor=2168291|||
2322769|https://dadosabertos.camara.leg.br/api/v2/proposicoes/2322769|PL|139|1220|2022|Dispõe sobre adoção de procedimento excepcional para reajustes e revisões de preços de derivados de petróleo e gás natural.|2022-05-11T19:11||{'dataHora': '2022-05-19T00:00', 'sequencia': 17, 'siglaOrgao': 'CDE', 'uriOrgao': 'https://dadosabertos.camara.leg.br/api/v2/orgaos/2008', 'uriUltimoRelator': None, 'regime': 'Ordinário (Art. 151, III, RICD)', 'descricaoTramitacao': 'Designação de Relator', 'codTipoTramitacao': '320', 'descricaoSituacao': 'Tramitando em Conjunto', 'codSituacao': 925, 'despacho': 'Designado Relator, Dep. Guiga Peixoto (PSL-SP)', 'url': None, 'ambito': 'Protocolar', 'apreciacao': 'Proposição Sujeita à Apreciação Conclusiva pelas Comissões - Art. 24 II'}|https://dadosabertos.camara.leg.br/api/v2/proposicoes/2322769/autores|Projeto de Lei|Altera a Lei nº 9.478, de 1997.|Alteração, Lei do Petróleo, critério, reajuste de preços, petróleo, gás natural, combustível.|https://dadosabertos.camara.leg.br/api/v2/proposicoes/2081903|||https://www.camara.leg.br/proposicoesWeb/prop_mostrarintegra?codteor=2168367|||
2322782|https://dadosabertos.camara.leg.br/api/v2/proposicoes/2322782|PL|139|1221|2022|Altera a Lei nº 11.438, de 29 de dezembro de 2006, para promover o esporte feminino.|2022-05-11T19:31||{'dataHora': '2022-05-18T00:00', 'sequencia': 16, 'siglaOrgao': 'CCP', 'uriOrgao': 'https://dadosabertos.camara.leg.br/api/v2/orgaos/186', 'uriUltimoRelator': None, 'regime': 'Ordinário (Art. 151, III, RICD)', 'descricaoTramitacao': 'Publicação de Proposição', 'codTipoTramitacao': '604', 'descricaoSituacao': 'Tramitando em Conjunto', 'codSituacao': 925, 'despacho': 'Encaminhada à publicação. Publicação Inicial em avulso e no DCD de 19/05/2022 PAG 714', 'url': None, 'ambito': 'Regimental', 'apreciacao': 'Proposição Sujeita à Apreciação Conclusiva pelas Comissões - Art. 24 II'}|https://dadosabertos.camara.leg.br/api/v2/proposicoes/2322782/autores|Projeto de Lei||Alteração, Lei de Incentivo ao Esporte, obrigatoriedade, percentual, projeto esportivo, promoção, Esporte feminino. _Ministério do Esporte, divulgação, Sítio oficial (internet), percentual, recursos, destinação,  gênero, atleta, beneficiário.|https://dadosabertos.camara.leg.br/api/v2/proposicoes/2306534|||https://www.camara.leg.br/proposicoesWeb/prop_mostrarintegra?codteor=2168405|||
2322790|https://dadosabertos.camara.leg.br/api/v2/proposicoes/2322790|PL|139|1223|2022|Altera a Lei Nº 9.099, de 26 de setembro de 1995, e dá outras providências.|2022-05-11T20:10||{'dataHora': '2022-05-18T00:00', 'sequencia': 15, 'siglaOrgao': 'CCP', 'uriOrgao': 'https://dadosabertos.camara.leg.br/api/v2/orgaos/186', 'uriUltimoRelator': None, 'regime': 'Ordinário (Art. 151, III, RICD)', 'descricaoTramitacao': 'Publicação de Proposição', 'codTipoTramitacao': '604', 'descricaoSituacao': 'Aguardando Designação de Relator', 'codSituacao': 907, 'despacho': 'Encaminhada à publicação. Publicação Inicial em avulso e no DCD de 19/05/2022 PAG 717', 'url': None, 'ambito': 'Regimental', 'apreciacao': 'Proposição Sujeita à Apreciação Conclusiva pelas Comissões - Art. 24 II'}|https://dadosabertos.camara.leg.br/api/v2/proposicoes/2322790/autores|Projeto de Lei|Trata da interposição de recurso adesivo no âmbito dos Juizados Especiais.|Alteração, Lei dos Juizados Especiais Cíveis e Criminais, recurso judicial, recurso adesivo, Juizado especial.||||https://www.camara.leg.br/proposicoesWeb/prop_mostrarintegra?codteor=2168429|||
2322803|https://dadosabertos.camara.leg.br/api/v2/proposicoes/2322803|PL|139|1224|2022|Dispõe acerca da atividade de armazenamento de energia no âmbito do Sistema Interligado Nacional (SIN).|2022-05-11T20:48|https://dadosabertos.camara.leg.br/api/v2/orgaos/2012|{'dataHora': '2023-01-31T00:00', 'sequencia': 19, 'siglaOrgao': 'CME', 'uriOrgao': 'https://dadosabertos.camara.leg.br/api/v2/orgaos/2012', 'uriUltimoRelator': 'https://dadosabertos.camara.leg.br/api/v2/deputados/204511', 'regime': 'Ordinário (Art. 151, III, RICD)', 'descricaoTramitacao': 'Saída de Relator da Comissão - Sem Parecer Apresentado', 'codTipoTramitacao': '1250', 'descricaoSituacao': 'Aguardando Designação de Relator', 'codSituacao': 907, 'despacho': '(Fim de Legislatura) O Relator, Dep. David Soares, deixou de ser membro da Comissão', 'url': None, 'ambito': 'Regimental', 'apreciacao': 'Proposição Sujeita à Apreciação Conclusiva pelas Comissões - Art. 24 II'}|https://dadosabertos.camara.leg.br/api/v2/proposicoes/2322803/autores|Projeto de Lei||Diretrizes, armazenamento, energia elétrica, Sistema Interligado Nacional (SIN), fonte alternativa de energia, matriz energética.||||https://www.camara.leg.br/proposicoesWeb/prop_mostrarintegra?codteor=2168464|||
2322811|https://dadosabertos.camara.leg.br/api/v2/proposicoes/2322811|PL|139|1225|2022|Institui a Politica nacional de Prevenção e Combate a furtos e roubos de cabos, fios de cobre e congêneres e da outras providências|2022-05-11T21:41||{'dataHora': '2022-07-08T09:00', 'sequencia': 18, 'siglaOrgao': 'CCJC', 'uriOrgao': 'https://dadosabertos.camara.leg.br/api/v2/orgaos/2003', 'uriUltimoRelator': None, 'regime': 'Ordinário (Art. 151, III, RICD)', 'descricaoTramitacao': 'Recebimento', 'codTipoTramitacao': '500', 'descricaoSituacao': 'Tramitando em Conjunto', 'codSituacao': 925, 'despacho': 'Recebimento pela CCJC, apensado ao PL-3410/2021', 'url': None, 'ambito': 'Regimental', 'apreciacao': 'Proposição Sujeita à Apreciação Conclusiva pelas Comissões - Art. 24 II'}|https://dadosabertos.camara.leg.br/api/v2/proposicoes/2322811/autores|Projeto de Lei||Criação, Politica Nacional de Prevenção e Combate a Furtos e Roubos de Cabos, Fios de Cobre e Materiais Congêneres, norma geral, compra, venda, produtos, material reciclável, produto não descartável. _Produto congênere, fio metálico, cobre, gerador de energia, bateria, transformador elétrico, placa. _Pessoa física, pessoa jurídica, comercializaqção, resíduo, sucata, emissão, Nota fiscal, Formulário, entrada, mercadoria.|https://dadosabertos.camara.leg.br/api/v2/proposicoes/2301312|||https://www.camara.leg.br/proposicoesWeb/prop_mostrarintegra?codteor=2168526|||
2322830|https://dadosabertos.camara.leg.br/api/v2/proposicoes/2322830|PL|139|1226|2022|Altera o art. 161 do Decreto-lei nº 2.848, de 7 de dezembro de 1940, e dá outras providências.|2022-05-12T09:58||{'dataHora': '2022-05-18T00:00', 'sequencia': 17, 'siglaOrgao': 'CCP', 'uriOrgao': 'https://dadosabertos.camara.leg.br/api/v2/orgaos/186', 'uriUltimoRelator': None, 'regime': 'Ordinário (Art. 151, III, RICD)', 'descricaoTramitacao': 'Publicação de Proposição', 'codTipoTramitacao': '604', 'descricaoSituacao': 'Tramitando em Conjunto', 'codSituacao': 925, 'despacho': 'Encaminhada à publicação. Publicação Inicial em avulso e no DCD de 19/05/2022 PAG 732', 'url': None, 'ambito': 'Regimental', 'apreciacao': 'Proposição Sujeita à Apreciação do Plenário'}|https://dadosabertos.camara.leg.br/api/v2/proposicoes/2322830/autores|Projeto de Lei|Trata dos crimes de alteração de limites e esbulho possessório, e cria o tipo penal de esbulho possessório qualificado.|Alteração, Código Penal, crime contra o patrimônio, usurpação, aumento da pena, crime, alteração de limites (imóvel), usurpação de águas, esbulho possessório, tipicidade penal, esbulho possessório qualificado, ação penal pública incondicionada.|https://dadosabertos.camara.leg.br/api/v2/proposicoes/2230904|||https://www.camara.leg.br/proposicoesWeb/prop_mostrarintegra?codteor=2168607|||
