id|uri|siglaTipo|codTipo|numero|ano|ementa|dataApresentacao|uriOrgaoNumerador|statusProposicao|uriAutores|descricaoTipo|ementaDetalhada|keywords|uriPropPrincipal|uriPropAnterior|uriPropPosterior|urlInteiroTeor|urnFinal|texto|justificativa
2335528|https://dadosabertos.camara.leg.br/api/v2/proposicoes/2335528|PL|139|2594|2022|Altera a Lei n° 6.880, de 5 de 9 de dezembro de 1980, e o Decreto-lei nº 667, de 2 de julho de 1969, para dispor sobre a manutenção do posto ou graduação, prerrogativas, direitos e deveres inerentes à condição de inativo, incluídos os direitos financeiros cumulados com os vencimentos do novo cargo, emprego ou função pública, do militar que, após ter sido transferido para a inatividade remunerada, tomou posse em cargo, emprego ou função pública permanente, na forma do inciso II do § 3º do art. 142 da Constituição Federal.|2022-10-13T09:11||{'dataHora': '2022-11-16T00:00', 'sequencia': 12, 'siglaOrgao': 'CCP', 'uriOrgao': 'https://dadosabertos.camara.leg.br/api/v2/orgaos/186', 'uriUltimoRelator': None, 'regime': '.', 'descricaoTramitacao': 'Publicação de Proposição', 'codTipoTramitacao': '604', 'descricaoSituacao': 'Devolvida ao Autor', 'codSituacao': 1120, 'despacho': 'Encaminhada à publicação. Publicação Inicial no DCD de 17/11/2022 PAG 30', 'url': None, 'ambito': 'Regimental', 'apreciacao': 'Indefinida'}|https://dadosabertos.camara.leg.br/api/v2/proposicoes/2335528/autores|Projeto de Lei||Alteração, Estatuto dos Militares, Lei de Reorganização da Polícia Militar e do Corpo de Bombeiros Militar, militar da reserva, acumulação de proventos, vencimentos, cargo público, emprego público, função pública.||||https://www.camara.leg.br/proposicoesWeb/prop_mostrarintegra?codteor=2209446|||
2335554|https://dadosabertos.camara.leg.br/api/v2/proposicoes/2335554|PL|139|2596|2022|Regulamenta o uso da técnica de fertilização in vitro.|2022-10-13T11:37|https://dadosabertos.camara.leg.br/api/v2/orgaos/4|{'dataHora': '2022-10-26T00:00', 'sequencia': 8, 'siglaOrgao': 'CCP', 'uriOrgao': 'https://dadosabertos.camara.leg.br/api/v2/orgaos/186', 'uriUltimoRelator': None, 'regime': '.', 'descricaoTramitacao': 'Publicação de Proposição', 'codTipoTramitacao': '604', 'descricaoSituacao': 'Retirado pelo Autor', 'codSituacao': 950, 'despacho': 'Encaminhada à publicação. Publicação Inicial no DCD de 27/10/2022 PAG 91', 'url': 'https://www.camara.leg.br/proposicoesWeb/prop_mostrarintegra?codteor=2247213', 'ambito': 'Regimental', 'apreciacao': 'Indefinida'}|https://dadosabertos.camara.leg.br/api/v2/proposicoes/2335554/autores|Projeto de Lei||Regulamentação, utilização, fertilização in vitro. _Definição, embrião humano, fertilização in vitro, utilização, ocorrência, infertilidade feminina, prevenção, Doença genética. _Disciplinamento, doação, célula germinativa. _Procedimento, produção, embrião humano. _Proibição, Gravidez de substituição. _Atribuição, beneficiário, condição, paternidade, criança. _Doador, parente, ausência, direitos, vínculo de parentesco. _Serviços de saúde, realização, fertilização in vitro, sujeição, fiscalização, Ministério público, finalidade, preservação, saúde, Integridade física, pessoa, envolvimento. _Consideração, crime, prática, fertilização in vitro, ausência, autorização, participação, procedimento, gravidez de substituição, utilização, célula germinativa, pessoa falecida, realização, pré-seleção, Identidade de gênero, gameta, embrião humano. _Alteração, Lei de Biossegurança (1995), proibição, realização, pesquisa, Clonagem reprodutiva humana, utilização, engenharia genética.||||https://www.camara.leg.br/proposicoesWeb/prop_mostrarintegra?codteor=2209493|||
2335562|https://dadosabertos.camara.leg.br/api/v2/proposicoes/2335562|PL|139|2597|2022|Concessão, adicional de insalubridade, professor, atuação, Sistema carcerário.Concede adicional de insalubridade ao docente, cuja atuação seja junto ao sistema prisional brasileiro.|2022-10-13T13:15||{'dataHora': '2022-11-16T00:00', 'sequencia': 12, 'siglaOrgao': 'CCP', 'uriOrgao': 'https://dadosabertos.camara.leg.br/api/v2/orgaos/186', 'uriUltimoRelator': None, 'regime': '.', 'descricaoTramitacao': 'Publicação de Proposição', 'codTipoTramitacao': '604', 'descricaoSituacao': 'Devolvida ao Autor', 'codSituacao': 1120, 'despacho': 'Encaminhada à publicação. Publicação Inicial no DCD de 17/11/2022 PAG 34', 'url': None, 'ambito': 'Regimental', 'apreciacao': 'Indefinida'}|https://dadosabertos.camara.leg.br/api/v2/proposicoes/2335562/autores|Projeto de Lei||Concessão, adicional de insalubridade, professor, atuação, Sistema carcerário.||||https://www.camara.leg.br/proposicoesWeb/prop_mostrarintegra?codteor=2209513|||
2335577|https://dadosabertos.camara.leg.br/api/v2/proposicoes/2335577|PL|139|2598|2022|Institui o Dia 10 de outubro como Dia Nacional de combate a Ludopatia.|2022-10-13T19:46||"{'dataHora': '2023-03-23T21:57', 'sequencia': 15, 'siglaOrgao': 'MESA', 'uriOrgao': 'https://dadosabertos.camara.leg.br/api/v2/orgaos/4', 'uriUltimoRelator': None, 'regime': 'Ordinário (Art. 151, III, RICD)', 'descricaoTramitacao': 'Distribuição', 'codTipoTramitacao': '110', 'descricaoSituacao': 'Aguardando Designação de Relator', 'codSituacao': 907, 'despacho': 'Decisão da Presidência  de 23/03/2023, conforme o seguinte teor: ""Tendo em vista a edição da Resolução da Câmara dos Deputados n. 1/2023 [...], criando a Comissão de Previdência, Assistência Social, Infância, Adolescência e Família e a Comissão de Saúde, revejo o despacho de distribuição aposto...""...""para o fim de determinar sua redistribuição à Comissão de Saúde, em substituição à Comissão de Seguridade Social e Família, extinta pela mesma Resolução.""', 'url': 'https://www.camara.leg.br/proposicoesWeb/prop_mostrarintegra?codteor=2248699', 'ambito': 'Regimental', 'apreciacao': 'Proposição Sujeita à Apreciação Conclusiva pelas Comissões - Art. 24 II'}"|https://dadosabertos.camara.leg.br/api/v2/proposicoes/2335577/autores|Projeto de Lei||Criação, Dia Nacional de Combate a Ludopatia, comemoração, outubro, esclarecimento, população, característica, doença.||||https://www.camara.leg.br/proposicoesWeb/prop_mostrarintegra?codteor=2209694|||
2335584|https://dadosabertos.camara.leg.br/api/v2/proposicoes/2335584|PL|139|2599|2022|Altera a Lei n° 14.228, de 20 de outubro de 2021, que dispõe sobre a proibição de eutanásia, para assegurar que entidades de proteção animal tenham acesso a dependências físicas de órgãos de controle de zoonoses, canis públicos e estabelecimentos oficiais congêneres; e dá outras providências.|2022-10-14T12:38|https://dadosabertos.camara.leg.br/api/v2/orgaos/6174|{'dataHora': '2023-01-31T00:00', 'sequencia': 20, 'siglaOrgao': 'CMADS', 'uriOrgao': 'https://dadosabertos.camara.leg.br/api/v2/orgaos/6174', 'uriUltimoRelator': 'https://dadosabertos.camara.leg.br/api/v2/deputados/92776', 'regime': 'Ordinário (Art. 151, III, RICD)', 'descricaoTramitacao': 'Saída de Relator da Comissão - Sem Parecer Apresentado', 'codTipoTramitacao': '1250', 'descricaoSituacao': 'Aguardando Designação de Relator', 'codSituacao': 907, 'despacho': '(Fim de Legislatura) O Relator, Dep. Stefano Aguiar, deixou de ser membro da Comissão', 'url': None, 'ambito': 'Regimental', 'apreciacao': 'Proposição Sujeita à Apreciação Conclusiva pelas Comissões - Art. 24 II'}|https://dadosabertos.camara.leg.br/api/v2/proposicoes/2335584/autores|Projeto de Lei||Alteração, Lei Federal, garantia, entidade, proteção, animal, acesso irrestrito, documentação, comprovação, legalidade, eutanásia, dependência física, órgão de controle, zoonose, canil público, imagem, amostra, coleta biológica, sangue.||||https://www.camara.leg.br/proposicoesWeb/prop_mostrarintegra?codteor=2209740|||
2335590|https://dadosabertos.camara.leg.br/api/v2/proposicoes/2335590|PL|139|2600|2022|Disciplina o marketing direto ativo e cria lista pública de consumidores para o fim que menciona.|2022-10-14T13:43||{'dataHora': '2022-11-14T00:00', 'sequencia': 13, 'siglaOrgao': 'CCP', 'uriOrgao': 'https://dadosabertos.camara.leg.br/api/v2/orgaos/186', 'uriUltimoRelator': None, 'regime': 'Prioridade (Art. 151, II, RICD)', 'descricaoTramitacao': 'Publicação de Proposição', 'codTipoTramitacao': '604', 'descricaoSituacao': 'Tramitando em Conjunto', 'codSituacao': 925, 'despacho': 'Encaminhada à publicação. Publicação Inicial em avulso e no DCD de 15/11/2022 PAG 177', 'url': 'https://www.camara.leg.br/proposicoesWeb/prop_mostrarintegra?codteor=2251764', 'ambito': 'Regimental', 'apreciacao': 'Proposição Sujeita à Apreciação do Plenário'}|https://dadosabertos.camara.leg.br/api/v2/proposicoes/2335590/autores|Projeto de Lei||Criação, cadastro, consumidor, lista antimarketing, diretrizes, proibição, empresa, telemarketing ativo.|https://dadosabertos.camara.leg.br/api/v2/proposicoes/2190453|||https://www.camara.leg.br/proposicoesWeb/prop_mostrarintegra?codteor=2209750|||
2335596|https://dadosabertos.camara.leg.br/api/v2/proposicoes/2335596|PL|139|2601|2022|"Institui Diretrizes e implantação do "" Projeto Remição pela Leitura"" no âmbito dos Estabelecimentos Penais das cadeias públicas estaduais e federais."|2022-10-14T13:58||{'dataHora': '2022-11-28T10:09', 'sequencia': 13, 'siglaOrgao': 'CCP', 'uriOrgao': 'https://dadosabertos.camara.leg.br/api/v2/orgaos/186', 'uriUltimoRelator': None, 'regime': 'Prioridade (Art. 151, II, RICD)', 'descricaoTramitacao': 'Apensação', 'codTipoTramitacao': '106', 'descricaoSituacao': 'Tramitando em Conjunto', 'codSituacao': 925, 'despacho': 'Apensação desta proposição ao PL-10529/2018.', 'url': None, 'ambito': 'Protocolar', 'apreciacao': 'Proposição Sujeita à Apreciação do Plenário'}|https://dadosabertos.camara.leg.br/api/v2/proposicoes/2335596/autores|Projeto de Lei||Criação, Projeto Remição pela Leitura, estabelecimento penal, benefício do preso, remição da pena, incentivo, leitura.|https://dadosabertos.camara.leg.br/api/v2/proposicoes/2181009|||https://www.camara.leg.br/proposicoesWeb/prop_mostrarintegra?codteor=2209756|||
2335611|https://dadosabertos.camara.leg.br/api/v2/proposicoes/2335611|PL|139|2602|2022|Institui o Cordão de Girassol como símbolo e instrumento auxiliar na identificação de pessoas com deficiência oculta.|2022-10-17T09:56||{'dataHora': '2023-03-22T00:00', 'sequencia': 18, 'siglaOrgao': 'MESA', 'uriOrgao': 'https://dadosabertos.camara.leg.br/api/v2/orgaos/4', 'uriUltimoRelator': None, 'regime': 'Urgência (Art. 155, RICD)', 'descricaoTramitacao': 'Desapensação', 'codTipoTramitacao': '104', 'descricaoSituacao': 'Arquivada', 'codSituacao': 923, 'despacho': 'Desapensação deste do Projeto de Lei nº 5.486, de 2020, principal, em face da declaração de prejudicialidade deste e do seu consequente arquivamento (Sessão Deliberativa Extraordinária de 22/3/2023 - 13h55 - 31ª Sessão).', 'url': None, 'ambito': 'Regimental', 'apreciacao': 'Proposição Sujeita à Apreciação Conclusiva pelas Comissões - Art. 24 II'}|https://dadosabertos.camara.leg.br/api/v2/proposicoes/2335611/autores|Projeto de Lei||Colar de girassol, símbolo, assistência, identificação, Pessoa com deficiência invisível.||||https://www.camara.leg.br/proposicoesWeb/prop_mostrarintegra?codteor=2209834|||
2335612|https://dadosabertos.camara.leg.br/api/v2/proposicoes/2335612|PL|139|2603|2022|Institui o programa de acompanhamento pré-natal e pós-parto no caso de gestante com Transtorno do Espectro Autista - TEA em âmbito Federal.|2022-10-17T09:59||{'dataHora': '2022-11-14T00:00', 'sequencia': 15, 'siglaOrgao': 'CCP', 'uriOrgao': 'https://dadosabertos.camara.leg.br/api/v2/orgaos/186', 'uriUltimoRelator': None, 'regime': 'Prioridade (Art. 151, II, RICD)', 'descricaoTramitacao': 'Publicação de Proposição', 'codTipoTramitacao': '604', 'descricaoSituacao': 'Tramitando em Conjunto', 'codSituacao': 925, 'despacho': 'Encaminhada à publicação. Publicação Inicial em avulso e no DCD de 15/11/2022 PAG 192', 'url': None, 'ambito': 'Regimental', 'apreciacao': 'Proposição Sujeita à Apreciação do Plenário'}|https://dadosabertos.camara.leg.br/api/v2/proposicoes/2335612/autores|Projeto de Lei||Criação, Programa (administração), acompanhamento, Pré-natal, Puerpério, gestante, Pessoa com transtorno do espectro autista, Sistema Único de Saúde (SUS), diretrizes.|https://dadosabertos.camara.leg.br/api/v2/proposicoes/2329114|||https://www.camara.leg.br/proposicoesWeb/prop_mostrarintegra?codteor=2209836|||
2335613|https://dadosabertos.camara.leg.br/api/v2/proposicoes/2335613|PL|139|2604|2022|Dispõe sobre medidas para assegurar e educar crianças diabéticas.|2022-10-17T10:01||{'dataHora': '2022-11-17T00:00', 'sequencia': 16, 'siglaOrgao': 'CIDOSO', 'uriOrgao': 'https://dadosabertos.camara.leg.br/api/v2/orgaos/537871', 'uriUltimoRelator': None, 'regime': 'Ordinário (Art. 151, III, RICD)', 'descricaoTramitacao': 'Designação de Relator', 'codTipoTramitacao': '320', 'descricaoSituacao': 'Tramitando em Conjunto', 'codSituacao': 925, 'despacho': 'Designado Relator, Dep. Denis Bezerra (PSB-CE)', 'url': None, 'ambito': 'Protocolar', 'apreciacao': 'Proposição Sujeita à Apreciação Conclusiva pelas Comissões - Art. 24 II'}|https://dadosabertos.camara.leg.br/api/v2/proposicoes/2335613/autores|Projeto de Lei||Criação, Programa (administração), proteção, educação, criança, diabetes. _ Distribuição, Medidor glicêmico, Educação alimentar e nutricional.|https://dadosabertos.camara.leg.br/api/v2/proposicoes/2183600|||https://www.camara.leg.br/proposicoesWeb/prop_mostrarintegra?codteor=2209839|||
2335617|https://dadosabertos.camara.leg.br/api/v2/proposicoes/2335617|PL|139|2605|2022|Acrescenta parágrafo 6º ao artigo 33 da Lei nº 9504, de 30 de setembro de 1997 para instituir nova modalidade de punição a institutos de pesquisa.|2022-10-17T10:50||{'dataHora': '2022-10-18T00:00', 'sequencia': 13, 'siglaOrgao': 'CCP', 'uriOrgao': 'https://dadosabertos.camara.leg.br/api/v2/orgaos/186', 'uriUltimoRelator': None, 'regime': 'Urgência (Art. 155, RICD)', 'descricaoTramitacao': 'Publicação de Proposição', 'codTipoTramitacao': '604', 'descricaoSituacao': 'Tramitando em Conjunto', 'codSituacao': 925, 'despacho': 'Encaminhada à publicação. Publicação Inicial em avulso e no DCD de 19/10/2022 PAG 177', 'url': None, 'ambito': 'Regimental', 'apreciacao': 'Proposição Sujeita à Apreciação do Plenário'}|https://dadosabertos.camara.leg.br/api/v2/proposicoes/2335617/autores|Projeto de Lei||Alteração, Lei das Eleições (1997), punição, Instituto de pesquisa, divulgação, Pesquisa eleitoral, descumprimento, requisito, margem de erro.|https://dadosabertos.camara.leg.br/api/v2/proposicoes/2330314|||https://www.camara.leg.br/proposicoesWeb/prop_mostrarintegra?codteor=2209863|||
2335621|https://dadosabertos.camara.leg.br/api/v2/proposicoes/2335621|PL|139|2606|2022|Altera a Lei n° 12.711, de 29 de agosto de 2012, que dispõe sobre o ingresso em universidades federais e em instituições federais de ensino técnico, para estabelecer reservas de vagas para mulheres vítimas de crimes contra a dignidade sexual, de crime de feminicídio tentado e de crime que envolva violência doméstica ou familiar.|2022-10-17T11:58|https://dadosabertos.camara.leg.br/api/v2/orgaos/537870|{'dataHora': '2023-03-31T00:00', 'sequencia': 16, 'siglaOrgao': 'CMULHER', 'uriOrgao': 'https://dadosabertos.camara.leg.br/api/v2/orgaos/537870', 'uriUltimoRelator': 'https://dadosabertos.camara.leg.br/api/v2/deputados/220625', 'regime': 'Ordinário (Art. 151, III, RICD)', 'descricaoTramitacao': 'Abertura de Prazo', 'codTipoTramitacao': '350', 'descricaoSituacao': 'Aguardando Parecer', 'codSituacao': 915, 'despacho': 'Prazo para Emendas ao Projeto (5 sessões a partir de 03/04/2023)', 'url': None, 'ambito': 'Regimental', 'apreciacao': 'Proposição Sujeita à Apreciação Conclusiva pelas Comissões - Art. 24 II'}|https://dadosabertos.camara.leg.br/api/v2/proposicoes/2335621/autores|Projeto de Lei||Alteração, Lei de Cotas de Ingresso nas Universidades, reserva, vaga, Instituição Federal de Ensino Superior (IFES), mulher, vítima, crime contra a dignidade sexual, feminicídio, violência doméstica.||||https://www.camara.leg.br/proposicoesWeb/prop_mostrarintegra?codteor=2209890|||
2335639|https://dadosabertos.camara.leg.br/api/v2/proposicoes/2335639|PL|139|2608|2022|Altera os arts. 10 e 46, do Decreto-Lei nº 3.689, de 3 de outubro de 1941 – Código de Processo Penal, aumentando os prazos para a conclusão do inquérito policial e para o oferecimento da denúncia, quando se tratar de crime hediondo ou equiparado|2022-10-17T16:27||{'dataHora': '2022-11-28T10:11', 'sequencia': 13, 'siglaOrgao': 'CCP', 'uriOrgao': 'https://dadosabertos.camara.leg.br/api/v2/orgaos/186', 'uriUltimoRelator': None, 'regime': 'Especial', 'descricaoTramitacao': 'Apensação', 'codTipoTramitacao': '106', 'descricaoSituacao': 'Tramitando em Conjunto', 'codSituacao': 925, 'despacho': 'Apensação desta proposição ao PL-7457/2017.', 'url': None, 'ambito': 'Protocolar', 'apreciacao': 'Proposição Sujeita à Apreciação do Plenário'}|https://dadosabertos.camara.leg.br/api/v2/proposicoes/2335639/autores|Projeto de Lei||Alteração, Código de Processo Penal, aumento, prazo, conclusão, Inquérito policial, oferecimento, denúncia, prática, crime hediondo, crime equiparado.|https://dadosabertos.camara.leg.br/api/v2/proposicoes/2130411|||https://www.camara.leg.br/proposicoesWeb/prop_mostrarintegra?codteor=2209986|||
2335644|https://dadosabertos.camara.leg.br/api/v2/proposicoes/2335644|PL|139|2610|2022|Cria o Programa Analfabetismo Zero em todo o país e dá outras providências.|2022-10-17T18:59|https://dadosabertos.camara.leg.br/api/v2/orgaos/2009|{'dataHora': '2023-01-31T00:00', 'sequencia': 18, 'siglaOrgao': 'CE', 'uriOrgao': 'https://dadosabertos.camara.leg.br/api/v2/orgaos/2009', 'uriUltimoRelator': 'https://dadosabertos.camara.leg.br/api/v2/deputados/204536', 'regime': 'Ordinário (Art. 151, III, RICD)', 'descricaoTramitacao': 'Saída de Relator da Comissão - Sem Parecer Apresentado', 'codTipoTramitacao': '1250', 'descricaoSituacao': 'Aguardando Designação de Relator', 'codSituacao': 907, 'despacho': '(Fim de Legislatura) O Relator, Dep. Kim Kataguiri, deixou de ser membro da Comissão', 'url': None, 'ambito': 'Regimental', 'apreciacao': 'Proposição Sujeita à Apreciação Conclusiva pelas Comissões - Art. 24 II'}|https://dadosabertos.camara.leg.br/api/v2/proposicoes/2335644/autores|Projeto de Lei||Criação, Programa Analfabetismo Zero, desenvolvimento, especialista em educação, erradicação, analfabetismo, adulto, adolescente, Ministério da Educação, consideração, diferença cultural, desigualdade regional. _Divulgação, mídia, rede social, estímulo, pessoa, necessidade, aprendizagem, recursos, Lei de Diretrizes Orçamentárias (LDO).||||https://www.camara.leg.br/proposicoesWeb/prop_mostrarintegra?codteor=2210029|||
2335645|https://dadosabertos.camara.leg.br/api/v2/proposicoes/2335645|PL|139|2611|2022|Reduz a faixa de Contribuição Previdenciária paga pelo trabalhador junto ao Instituto Nacional de Previdência Social|2022-10-17T18:59||{'dataHora': '2023-03-27T15:48', 'sequencia': 16, 'siglaOrgao': 'CPASF', 'uriOrgao': 'https://dadosabertos.camara.leg.br/api/v2/orgaos/539387', 'uriUltimoRelator': None, 'regime': 'Ordinário (Art. 151, III, RICD)', 'descricaoTramitacao': 'Recebimento', 'codTipoTramitacao': '500', 'descricaoSituacao': 'Tramitando em Conjunto', 'codSituacao': 925, 'despacho': 'Recebimento pela CPASF, apensado ao PL-6560/2013', 'url': None, 'ambito': 'Regimental', 'apreciacao': 'Proposição Sujeita à Apreciação Conclusiva pelas Comissões - Art. 24 II'}|https://dadosabertos.camara.leg.br/api/v2/proposicoes/2335645/autores|Projeto de Lei||Redução, alíquota, contribuição previdenciária, trabalhador, tributação.|https://dadosabertos.camara.leg.br/api/v2/proposicoes/596104|||https://www.camara.leg.br/proposicoesWeb/prop_mostrarintegra?codteor=2210030|||
2335646|https://dadosabertos.camara.leg.br/api/v2/proposicoes/2335646|PL|139|2612|2022|O programa Auxilio Brasil fica prorrogado por tempo indeterminado os benefícios financeiros decorrentes deste programa para as pessoas que já o recebem desde que não haja alteração na condição sócio econômica da mesma.|2022-10-17T18:59||{'dataHora': '2022-11-14T00:00', 'sequencia': 15, 'siglaOrgao': 'CCP', 'uriOrgao': 'https://dadosabertos.camara.leg.br/api/v2/orgaos/186', 'uriUltimoRelator': None, 'regime': 'Ordinário (Art. 151, III, RICD)', 'descricaoTramitacao': 'Publicação de Proposição', 'codTipoTramitacao': '604', 'descricaoSituacao': 'Tramitando em Conjunto', 'codSituacao': 925, 'despacho': 'Encaminhada à publicação. Publicação Inicial em avulso e no DCD de 15/11/2022 PAG 218', 'url': None, 'ambito': 'Regimental', 'apreciacao': 'Proposição Sujeita à Apreciação Conclusiva pelas Comissões - Art. 24 II'}|https://dadosabertos.camara.leg.br/api/v2/proposicoes/2335646/autores|Projeto de Lei||Prorrogação, prazo indeterminado, auxílio financeiro, Programa Auxílio Brasil.|https://dadosabertos.camara.leg.br/api/v2/proposicoes/2334172|||https://www.camara.leg.br/proposicoesWeb/prop_mostrarintegra?codteor=2210031|||
2335647|https://dadosabertos.camara.leg.br/api/v2/proposicoes/2335647|PL|139|2613|2022|Fica instituído o programa de renda mínima para todos os brasileiros que tenham renda inferior ao valor do salário mínimo nacional e dá outras providencias|2022-10-17T18:59||{'dataHora': '2022-11-14T00:00', 'sequencia': 16, 'siglaOrgao': 'CCP', 'uriOrgao': 'https://dadosabertos.camara.leg.br/api/v2/orgaos/186', 'uriUltimoRelator': None, 'regime': 'Ordinário (Art. 151, III, RICD)', 'descricaoTramitacao': 'Publicação de Proposição', 'codTipoTramitacao': '604', 'descricaoSituacao': 'Tramitando em Conjunto', 'codSituacao': 925, 'despacho': 'Encaminhada à publicação. Publicação Inicial em avulso e no DCD de 15/11/2022 PAG 221', 'url': None, 'ambito': 'Regimental', 'apreciacao': 'Proposição Sujeita à Apreciação do Plenário'}|https://dadosabertos.camara.leg.br/api/v2/proposicoes/2335647/autores|Projeto de Lei||Criação, programa (administração), renda básica, pessoa, extrema pobreza, vulnerabilidade social, valor, salário mínimo, utilização, banco de dados, Cadastro Único para Programas Sociais do Governo Federal (CadÚnico).|https://dadosabertos.camara.leg.br/api/v2/proposicoes/2218523|||https://www.camara.leg.br/proposicoesWeb/prop_mostrarintegra?codteor=2210032|||
2335648|https://dadosabertos.camara.leg.br/api/v2/proposicoes/2335648|PL|139|2614|2022|Fica proibida a redução orçamentária, através da Lei de Orçamento Anual, do programa Farmácia Popular e dá outras providências.|2022-10-17T18:59||{'dataHora': '2022-11-16T00:00', 'sequencia': 12, 'siglaOrgao': 'CCP', 'uriOrgao': 'https://dadosabertos.camara.leg.br/api/v2/orgaos/186', 'uriUltimoRelator': None, 'regime': '.', 'descricaoTramitacao': 'Publicação de Proposição', 'codTipoTramitacao': '604', 'descricaoSituacao': 'Devolvida ao Autor', 'codSituacao': 1120, 'despacho': 'Encaminhada à publicação. Publicação Inicial no DCD de 17/11/2022 PAG 36', 'url': None, 'ambito': 'Regimental', 'apreciacao': 'Indefinida'}|https://dadosabertos.camara.leg.br/api/v2/proposicoes/2335648/autores|Projeto de Lei||Proibição, redução, Orçamento, Programa Farmácia Popular do Brasil.||||https://www.camara.leg.br/proposicoesWeb/prop_mostrarintegra?codteor=2210033|||
2335649|https://dadosabertos.camara.leg.br/api/v2/proposicoes/2335649|PL|139|2615|2022|Altera a faixa inicial da base de calculo de cobrança do imposto de renda.|2022-10-17T18:59||{'dataHora': '2022-11-16T09:28', 'sequencia': 15, 'siglaOrgao': 'CFT', 'uriOrgao': 'https://dadosabertos.camara.leg.br/api/v2/orgaos/2010', 'uriUltimoRelator': None, 'regime': 'Prioridade (Art. 151, II, RICD)', 'descricaoTramitacao': 'Apensação', 'codTipoTramitacao': '106', 'descricaoSituacao': 'Tramitando em Conjunto', 'codSituacao': 925, 'despacho': 'Apensação desta proposição ao PL 1244/2022.', 'url': None, 'ambito': 'Protocolar', 'apreciacao': 'Proposição Sujeita à Apreciação do Plenário'}|https://dadosabertos.camara.leg.br/api/v2/proposicoes/2335649/autores|Projeto de Lei||Fixação, base de cálculo, alíquota, Imposto sobre a Renda da Pessoa Física (IRPF), faixa, rendimento, pessoa física, tributação.|https://dadosabertos.camara.leg.br/api/v2/proposicoes/2323075|||https://www.camara.leg.br/proposicoesWeb/prop_mostrarintegra?codteor=2210034|||
