id|uri|siglaTipo|codTipo|numero|ano|ementa|dataApresentacao|uriOrgaoNumerador|statusProposicao|uriAutores|descricaoTipo|ementaDetalhada|keywords|uriPropPrincipal|uriPropAnterior|uriPropPosterior|urlInteiroTeor|urnFinal|texto|justificativa
2323657|https://dadosabertos.camara.leg.br/api/v2/proposicoes/2323657|PL|139|1290|2022|Altera o Decreto-lei n., 5.452, de 01 de maio de 1943 (Consolidação das Leis do Trabalho - CLT) para dispor sobre a atualização dos valores de custas e emolumentos devidos no âmbito da Justiça do Trabalho.|2022-05-18T10:46|https://dadosabertos.camara.leg.br/api/v2/orgaos/2015|"{'dataHora': '2023-03-27T11:58', 'sequencia': 31, 'siglaOrgao': 'MESA', 'uriOrgao': 'https://dadosabertos.camara.leg.br/api/v2/orgaos/4', 'uriUltimoRelator': 'https://dadosabertos.camara.leg.br/api/v2/deputados/160665', 'regime': 'Prioridade (Art. 151, II, RICD)', 'descricaoTramitacao': 'Distribuição', 'codTipoTramitacao': '110', 'descricaoSituacao': 'Aguardando Designação de Relator', 'codSituacao': 907, 'despacho': 'Decisão da Presidência  de 27/03/2023, conforme o seguinte teor: ""Tendo em vista a edição da Resolução da Câmara dos Deputados n. 1/2023 [...], criando a Comissão de Trabalho e a Comissão de Administração e Serviço Público, revejo o despacho de distribuição aposto...""...""para o fim de determinar sua redistribuição à Comissão de Admistração e Serviço Público, em substituição à Comissão de Trabalho, de Administração e Serviço Público, extinta pela mesma Resolução."".', 'url': 'https://www.camara.leg.br/proposicoesWeb/prop_mostrarintegra?codteor=2250039', 'ambito': 'Regimental', 'apreciacao': 'Proposição Sujeita à Apreciação Conclusiva pelas Comissões - Art. 24 II'}"|https://dadosabertos.camara.leg.br/api/v2/proposicoes/2323657/autores|Projeto de Lei||Alteração, Consolidação das Leis do Trabalho (CLT), atualização, valor, custas, Emolumento, Processo trabalhista, Justiça do trabalho, utilização, Índice Nacional de Preços ao Consumidor (INPC).||||https://www.camara.leg.br/proposicoesWeb/prop_mostrarintegra?codteor=2172017|||
2323675|https://dadosabertos.camara.leg.br/api/v2/proposicoes/2323675|PL|139|1292|2022|Institui a pensão especial a ser concedida a dependentes com idade de até 21 (vinte e um) anos, órfãos em razão do crime de feminicídio tipificado no art. 121, § 2º, inciso VI, do Código Penal (Decreto-Lei nº 2.848, de 7 de dezembro de 1940).|2022-05-18T12:27||{'dataHora': '2023-03-27T15:54', 'sequencia': 18, 'siglaOrgao': 'CPASF', 'uriOrgao': 'https://dadosabertos.camara.leg.br/api/v2/orgaos/539387', 'uriUltimoRelator': None, 'regime': 'Prioridade (Art. 151, II, RICD)', 'descricaoTramitacao': 'Recebimento', 'codTipoTramitacao': '500', 'descricaoSituacao': 'Tramitando em Conjunto', 'codSituacao': 925, 'despacho': 'Recebimento pela CPASF, apensado ao PL-3781/2021', 'url': None, 'ambito': 'Regimental', 'apreciacao': 'Proposição Sujeita à Apreciação Conclusiva pelas Comissões - Art. 24 II'}|https://dadosabertos.camara.leg.br/api/v2/proposicoes/2323675/autores|Projeto de Lei||Concessão, pensão especial, dependente, órfão, decorrência, crime, feminicídio, benefício, salário mínimo. _Benefício, ausência, acumulação, Regime Geral de Previdência Social (RGPS), Regime Próprio de Previdência Social (RPPS). _Exclusão, benefício, dependente, condenado, prática, crime.|https://dadosabertos.camara.leg.br/api/v2/proposicoes/2304737|||https://www.camara.leg.br/proposicoesWeb/prop_mostrarintegra?codteor=2172085|||
2323676|https://dadosabertos.camara.leg.br/api/v2/proposicoes/2323676|PL|139|1293|2022|Institui nova circunstância agravante no Código Penal, consistente na prática de delito com o uso de máscara, capacete ou qualquer outro meio que impeça ou dificulte a sua identificação.|2022-05-18T12:27||{'dataHora': '2022-05-30T09:04', 'sequencia': 16, 'siglaOrgao': 'CCJC', 'uriOrgao': 'https://dadosabertos.camara.leg.br/api/v2/orgaos/2003', 'uriUltimoRelator': None, 'regime': 'Ordinário (Art. 151, III, RICD)', 'descricaoTramitacao': 'Apensação', 'codTipoTramitacao': '106', 'descricaoSituacao': 'Tramitando em Conjunto', 'codSituacao': 925, 'despacho': 'Apensação desta proposição ao PL 4549/2019.', 'url': None, 'ambito': 'Protocolar', 'apreciacao': 'Proposição Sujeita à Apreciação do Plenário'}|https://dadosabertos.camara.leg.br/api/v2/proposicoes/2323676/autores|Projeto de Lei||Alteração, Código Penal, circunstância agravante, prática, crime, utilização, máscara de disfarce, capacete de segurança, disfarce, impedimento, identificação.|https://dadosabertos.camara.leg.br/api/v2/proposicoes/2215868|||https://www.camara.leg.br/proposicoesWeb/prop_mostrarintegra?codteor=2172090|||
2323677|https://dadosabertos.camara.leg.br/api/v2/proposicoes/2323677|PL|139|1294|2022|Altera a Lei no 8.072, de 25 de julho de 1990, para incluir no rol de crimes hediondos o roubo circunstanciado pelo uso de arma branca.|2022-05-18T12:27||{'dataHora': '2022-05-30T09:04', 'sequencia': 16, 'siglaOrgao': 'CCJC', 'uriOrgao': 'https://dadosabertos.camara.leg.br/api/v2/orgaos/2003', 'uriUltimoRelator': None, 'regime': 'Prioridade (Art. 151, II, RICD)', 'descricaoTramitacao': 'Apensação', 'codTipoTramitacao': '106', 'descricaoSituacao': 'Tramitando em Conjunto', 'codSituacao': 925, 'despacho': 'Apensação desta proposição ao PL 10145/2018.', 'url': None, 'ambito': 'Protocolar', 'apreciacao': 'Proposição Sujeita à Apreciação do Plenário'}|https://dadosabertos.camara.leg.br/api/v2/proposicoes/2323677/autores|Projeto de Lei||Alteração, Lei dos Crimes Hediondos, crime hediondo, roubo, utilização, arma branca.|https://dadosabertos.camara.leg.br/api/v2/proposicoes/2173559|||https://www.camara.leg.br/proposicoesWeb/prop_mostrarintegra?codteor=2172092|||
2323679|https://dadosabertos.camara.leg.br/api/v2/proposicoes/2323679|PL|139|1295|2022|Código de Mineração. Dá nova redação ao Decreto-lei nº 227, de 28 de fevereiro de 1967.|2022-05-18T12:35|https://dadosabertos.camara.leg.br/api/v2/orgaos/4|"{'dataHora': '2022-08-17T12:48', 'sequencia': 17, 'siglaOrgao': 'MESA', 'uriOrgao': 'https://dadosabertos.camara.leg.br/api/v2/orgaos/4', 'uriUltimoRelator': None, 'regime': 'Urgência (Art. 155, RICD)', 'descricaoTramitacao': 'Apresentação de Requerimento', 'codTipoTramitacao': '194', 'descricaoSituacao': 'Tramitando em Conjunto', 'codSituacao': 925, 'despacho': 'Apresentação do Requerimento de Desapensação n. 1327/2022, pelo Deputado Nereu Crispim (PSD/RS), que ""Requer, com base no artigo 205, caput, e §§ 1º, 2º, 7º e 8º do RICD a desapensação do Projeto de Código de Mineração nº 1295/2022, apensado ao PL nº 5263/2016, a comunicação do fato ao Plenário e sua inclusão na Ordem do Dia"".', 'url': 'https://www.camara.leg.br/proposicoesWeb/prop_mostrarintegra?codteor=2203466', 'ambito': 'Regimental', 'apreciacao': 'Proposição Sujeita à Apreciação do Plenário'}"|https://dadosabertos.camara.leg.br/api/v2/proposicoes/2323679/autores|Projeto de Lei|Altera as Leis nº 6.567 de 1978 e 7.805 de 1989.|"Alteração, Código de Mineração (1967), desburocratização, modernização, Setor mineral, Direito minerário, Pesquisa mineral, empreendimento mineral, extração mineral, lavra mineral, servidão mineral, Agência Nacional de Mineração (ANM), regulamentação, mineração, Terras indígenas.
_Alteração, Lei Federal, competência, Agência Nacional de Mineração (ANM), licenciamento, exploração, aproveitamento, minério.
_Alteração, Lei da Exploração Mineral, número, Permissão de lavra garimpeira, prazo, concessão."|https://dadosabertos.camara.leg.br/api/v2/proposicoes/2084289|||https://www.camara.leg.br/proposicoesWeb/prop_mostrarintegra?codteor=2172098|||
2323683|https://dadosabertos.camara.leg.br/api/v2/proposicoes/2323683|PL|139|1296|2022|Altera o art. 73 da Lei nº 9.605, de 12 de fevereiro de 1998, que dispõe sobre as sanções penais e administrativas derivadas de condutas e atividades lesivas ao meio ambiente – Lei de Crimes Ambientais, para especificar a destinação dos valores arrecadados em pagamento de multas por infração ambiental.|2022-05-18T12:45||{'dataHora': '2022-05-30T10:25', 'sequencia': 18, 'siglaOrgao': 'CFT', 'uriOrgao': 'https://dadosabertos.camara.leg.br/api/v2/orgaos/2010', 'uriUltimoRelator': None, 'regime': 'Prioridade (Art. 151, II, RICD)', 'descricaoTramitacao': 'Apensação', 'codTipoTramitacao': '106', 'descricaoSituacao': 'Tramitando em Conjunto', 'codSituacao': 925, 'despacho': 'Apensação desta proposição ao PL 3931/2015.', 'url': None, 'ambito': 'Protocolar', 'apreciacao': 'Proposição Sujeita à Apreciação do Plenário'}|https://dadosabertos.camara.leg.br/api/v2/proposicoes/2323683/autores|Projeto de Lei||Alteração, Lei dos Crimes Ambientais, valor arrecadado, pagamento, multa, Infração administrativa ambiental, destinação, Fundo Nacional do Meio Ambiente (FNMA), projeto (administração), unidade de conservação, educação ambiental, licenciamento ambiental, abrigo para animal, fiscalização, gestão, conservação, recurso ambiental. _Valor arrecadado, Capitania dos Portos, destinação, Fundo Naval.|https://dadosabertos.camara.leg.br/api/v2/proposicoes/2074454|||https://www.camara.leg.br/proposicoesWeb/prop_mostrarintegra?codteor=2172117|||
2323684|https://dadosabertos.camara.leg.br/api/v2/proposicoes/2323684|PL|139|1297|2022|Institui o Portal Único de Gestão de Resíduos Sólidos, Altera a Lei nº 12.305, de 2 de agosto de 2010 e dá outras providências.|2022-05-18T12:47|https://dadosabertos.camara.leg.br/api/v2/orgaos/6174|{'dataHora': '2023-01-31T00:00', 'sequencia': 19, 'siglaOrgao': 'CMADS', 'uriOrgao': 'https://dadosabertos.camara.leg.br/api/v2/orgaos/6174', 'uriUltimoRelator': 'https://dadosabertos.camara.leg.br/api/v2/deputados/178962', 'regime': 'Ordinário (Art. 151, III, RICD)', 'descricaoTramitacao': 'Saída de Relator da Comissão - Sem Parecer Apresentado', 'codTipoTramitacao': '1250', 'descricaoSituacao': 'Aguardando Designação de Relator', 'codSituacao': 907, 'despacho': '(Fim de Legislatura) O Relator, Dep. Carlos Gomes, deixou de ser membro da Comissão', 'url': None, 'ambito': 'Regimental', 'apreciacao': 'Proposição Sujeita à Apreciação Conclusiva pelas Comissões - Art. 24 II'}|https://dadosabertos.camara.leg.br/api/v2/proposicoes/2323684/autores|Projeto de Lei||Criação, Portal Único de Gestão de Resíduos Sólidos, âmbito, Ministério do Meio Ambiente, centralização, informação, procedimento, concessão, crédito, subsídio, renúncia fiscal, fonte de financiamento, estatística, pesquisa, nota técnica, legislação, plano de gerenciamento, resíduo sólido. _Ministério do Meio Ambiente, realização, parceria mista, instituição financeira, Instituição de pesquisa científica e tecnológica. _Criação, meio eletrônico, negociação, Certificado de Crédito de Reciclagem (Recicla+), comprador, vendedor, comercialização, ativo. _Alteração, Lei de resíduos sólidos, inclusão, Política Nacional de Resíduos Sólidos, Portal Único de Gestão de Resíduos Sólidos.||||https://www.camara.leg.br/proposicoesWeb/prop_mostrarintegra?codteor=2172119|||
2323796|https://dadosabertos.camara.leg.br/api/v2/proposicoes/2323796|PL|139|1298|2022|Altera a Lei nº 8.906, de 4 de julho de 1994, que dispõe sobre o Estatuto da Advocacia e a Ordem dos Advogados do Brasil (OAB), para Institui a Política de Prevenção e Enfretamento do Assédio Moral, do Assédio Sexual e da Discriminação no âmbito da OAB nacional, acrescentando inciso V ao art. 60.|2022-05-18T15:52||{'dataHora': '2022-05-30T09:02', 'sequencia': 15, 'siglaOrgao': 'CCJC', 'uriOrgao': 'https://dadosabertos.camara.leg.br/api/v2/orgaos/2003', 'uriUltimoRelator': None, 'regime': 'Ordinário (Art. 151, III, RICD)', 'descricaoTramitacao': 'Recebimento', 'codTipoTramitacao': '500', 'descricaoSituacao': 'Aguardando Designação de Relator', 'codSituacao': 907, 'despacho': 'Recebimento pela CCJC.', 'url': None, 'ambito': 'Regimental', 'apreciacao': 'Proposição Sujeita à Apreciação Conclusiva pelas Comissões - Art. 24 II'}|https://dadosabertos.camara.leg.br/api/v2/proposicoes/2323796/autores|Projeto de Lei||Alteração, Estatuto da OAB, competência, Subseção, Conselho seccional, Ordem dos Advogados do Brasil (OAB), criação, Política de Prevenção e Enfretamento do Assédio Moral, do Assédio Sexual e da Discriminação, Advogada, mulher.||||https://www.camara.leg.br/proposicoesWeb/prop_mostrarintegra?codteor=2172489|||
2323797|https://dadosabertos.camara.leg.br/api/v2/proposicoes/2323797|PL|139|1299|2022|Altera a Lei nº 11.340, de 7 de agosto de 2006, que cria mecanismos para coibir a violência doméstica e familiar contra a mulher, nos termos do § 8º do art. 226 da Constituição Federal, da Convenção sobre a Eliminação de Todas as Formas de Discriminação contra as Mulheres; e dá outras providências, acrescentando § ao art.9º|2022-05-18T15:55|https://dadosabertos.camara.leg.br/api/v2/orgaos/537870|{'dataHora': '2023-01-31T00:00', 'sequencia': 19, 'siglaOrgao': 'CMULHER', 'uriOrgao': 'https://dadosabertos.camara.leg.br/api/v2/orgaos/537870', 'uriUltimoRelator': 'https://dadosabertos.camara.leg.br/api/v2/deputados/160587', 'regime': 'Ordinário (Art. 151, III, RICD)', 'descricaoTramitacao': 'Saída de Relator da Comissão - Sem Parecer Apresentado', 'codTipoTramitacao': '1250', 'descricaoSituacao': 'Aguardando Designação de Relator', 'codSituacao': 907, 'despacho': '(Fim de Legislatura) O Relator, Dep. Fábio Trad, deixou de ser membro da Comissão', 'url': None, 'ambito': 'Regimental', 'apreciacao': 'Proposição Sujeita à Apreciação Conclusiva pelas Comissões - Art. 24 II'}|https://dadosabertos.camara.leg.br/api/v2/proposicoes/2323797/autores|Projeto de Lei||Alteração, Lei Maria da Penha, Responsabilidade civil do Estado,  Indenização por dano moral, mulher, vítima, violência doméstica, violência contra a mulher.||||https://www.camara.leg.br/proposicoesWeb/prop_mostrarintegra?codteor=2172491|||
2323800|https://dadosabertos.camara.leg.br/api/v2/proposicoes/2323800|PL|139|1300|2022|Altera o Decreto-Lei nº 2.848, de 7 de dezembro de 1940, que dispõe sobre o Código Penal - Do Estelionato e outras Fraudes, acrescentando inciso VII ao art. 171.|2022-05-18T15:59||{'dataHora': '2022-05-30T09:02', 'sequencia': 15, 'siglaOrgao': 'CCJC', 'uriOrgao': 'https://dadosabertos.camara.leg.br/api/v2/orgaos/2003', 'uriUltimoRelator': None, 'regime': 'Ordinário (Art. 151, III, RICD)', 'descricaoTramitacao': 'Recebimento', 'codTipoTramitacao': '500', 'descricaoSituacao': 'Aguardando Designação de Relator', 'codSituacao': 907, 'despacho': 'Recebimento pela CCJC.', 'url': None, 'ambito': 'Regimental', 'apreciacao': 'Proposição Sujeita à Apreciação do Plenário'}|https://dadosabertos.camara.leg.br/api/v2/proposicoes/2323800/autores|Projeto de Lei||Alteração, Código Penal, Crime contra o patrimônio, tipicidade penal, Estelionato, utilização, Moeda eletrônica.||||https://www.camara.leg.br/proposicoesWeb/prop_mostrarintegra?codteor=2172500|||
2323801|https://dadosabertos.camara.leg.br/api/v2/proposicoes/2323801|PL|139|1301|2022|Altera a Lei nº 13.640, de 26 de março de 2018, que regulamenta o transporte remunerado privado individual de passageiros, acrescentando inciso ao art. 11-A.|2022-05-18T16:02||{'dataHora': '2022-05-27T00:00', 'sequencia': 17, 'siglaOrgao': 'CCP', 'uriOrgao': 'https://dadosabertos.camara.leg.br/api/v2/orgaos/186', 'uriUltimoRelator': None, 'regime': 'Ordinário (Art. 151, III, RICD)', 'descricaoTramitacao': 'Publicação de Proposição', 'codTipoTramitacao': '604', 'descricaoSituacao': 'Tramitando em Conjunto', 'codSituacao': 925, 'despacho': 'Encaminhada à publicação. Publicação Inicial em avulso e no DCD de 28/05/2022 PAG 317', 'url': None, 'ambito': 'Regimental', 'apreciacao': 'Proposição Sujeita à Apreciação Conclusiva pelas Comissões - Art. 24 II'}|https://dadosabertos.camara.leg.br/api/v2/proposicoes/2323801/autores|Projeto de Lei||Alteração, Lei Federal, motorista, Transporte remunerado, Transporte individual, Transporte por aplicativo, Contribuinte individual, Instituto Nacional do Seguro Social (INSS), garantia, Seguro-desemprego, Desemprego involuntário, danificação, veículo.|https://dadosabertos.camara.leg.br/api/v2/proposicoes/2259942|||https://www.camara.leg.br/proposicoesWeb/prop_mostrarintegra?codteor=2172502|||
2323814|https://dadosabertos.camara.leg.br/api/v2/proposicoes/2323814|PL|139|1302|2022|Altera a Lei nº 10.671 de 15 de maio de  2003 - Estatuto de Defesa do Torcedor, para incluir como crime a injúria racial no âmbito desportivo.|2022-05-18T16:41||{'dataHora': '2022-05-30T09:04', 'sequencia': 16, 'siglaOrgao': 'CCJC', 'uriOrgao': 'https://dadosabertos.camara.leg.br/api/v2/orgaos/2003', 'uriUltimoRelator': None, 'regime': 'Ordinário (Art. 151, III, RICD)', 'descricaoTramitacao': 'Apensação', 'codTipoTramitacao': '106', 'descricaoSituacao': 'Tramitando em Conjunto', 'codSituacao': 925, 'despacho': 'Apensação desta proposição ao PL 7383/2014.', 'url': None, 'ambito': 'Protocolar', 'apreciacao': 'Proposição Sujeita à Apreciação do Plenário'}|https://dadosabertos.camara.leg.br/api/v2/proposicoes/2323814/autores|Projeto de Lei||Alteração, Estatuto de Defesa do Torcedor (2003), inclusão, crime, Injúria racial, utilização, elemento, grupo racial, cor de pele, grupo étnico, estádio esportivo, ginásio de esporte, pena. _Procedimento, clube esportivo, descrição, infração, súmula, autor, crime, estrangeiro.|https://dadosabertos.camara.leg.br/api/v2/proposicoes/611672|||https://www.camara.leg.br/proposicoesWeb/prop_mostrarintegra?codteor=2172547|||
2323851|https://dadosabertos.camara.leg.br/api/v2/proposicoes/2323851|PL|139|1305|2022|Acrescenta parágrafo ao art. 2º da Lei nº 11.738, de 2008, para explicitar a aplicação do piso salarial nacional dos profissionais do magistério público da educação básica aos profissionais do magistério indígena.|2022-05-18T17:26||{'dataHora': '2023-03-17T15:00', 'sequencia': 23, 'siglaOrgao': 'CPOVOS', 'uriOrgao': 'https://dadosabertos.camara.leg.br/api/v2/orgaos/539384', 'uriUltimoRelator': None, 'regime': 'Ordinário (Art. 151, III, RICD)', 'descricaoTramitacao': 'Recebimento', 'codTipoTramitacao': '500', 'descricaoSituacao': 'Aguardando Designação de Relator', 'codSituacao': 907, 'despacho': 'Recebimento pela CPOVOS.', 'url': None, 'ambito': 'Regimental', 'apreciacao': 'Proposição Sujeita à Apreciação Conclusiva pelas Comissões - Art. 24 II'}|https://dadosabertos.camara.leg.br/api/v2/proposicoes/2323851/autores|Projeto de Lei||Alteração, Lei do Piso Salarial, piso salarial, Carreira do Magistério Público da Educação Básica, aplicação, profissional, Educação indígena.||||https://www.camara.leg.br/proposicoesWeb/prop_mostrarintegra?codteor=2172688|||
2323871|https://dadosabertos.camara.leg.br/api/v2/proposicoes/2323871|PL|139|1306|2022|Dispõe sobre medidas de amparo à agricultura familiar, para estimular o aumento da produção e da geração de renda.|2022-05-18T18:09||{'dataHora': '2023-03-30T10:35', 'sequencia': 19, 'siglaOrgao': 'CAPADR', 'uriOrgao': 'https://dadosabertos.camara.leg.br/api/v2/orgaos/2001', 'uriUltimoRelator': None, 'regime': 'Prioridade (Art. 151, II, RICD)', 'descricaoTramitacao': 'Notificação de Apensação', 'codTipoTramitacao': '504', 'descricaoSituacao': 'Tramitando em Conjunto', 'codSituacao': 925, 'despacho': 'Apensação do PL 264/2023 a esta proposição.', 'url': None, 'ambito': 'Protocolar', 'apreciacao': 'Proposição Sujeita à Apreciação Conclusiva pelas Comissões - Art. 24 II'}|https://dadosabertos.camara.leg.br/api/v2/proposicoes/2323871/autores|Projeto de Lei||Concessão, auxílio financeiro, agricultura familiar, estímulo, aumento, produção, geração, renda, beneficiário. _União, transferência, recursos financeiros, ausência, ressarcimento, agricultor familiar, comprometimento, implantação, fase, projeto (administração), valor, família, agricultor, mulher.|https://dadosabertos.camara.leg.br/api/v2/proposicoes/2269820|||https://www.camara.leg.br/proposicoesWeb/prop_mostrarintegra?codteor=2172758|||
2323872|https://dadosabertos.camara.leg.br/api/v2/proposicoes/2323872|PL|139|1307|2022|Dispõe sobre a obrigação da concessionária e permissionária do serviço público de distribuição de energia elétrica realizar a conexão das instalações da unidade consumidora ao sistema de distribuição.|2022-05-18T18:10|https://dadosabertos.camara.leg.br/api/v2/orgaos/2004|{'dataHora': '2023-01-31T00:00', 'sequencia': 19, 'siglaOrgao': 'CDC', 'uriOrgao': 'https://dadosabertos.camara.leg.br/api/v2/orgaos/2004', 'uriUltimoRelator': 'https://dadosabertos.camara.leg.br/api/v2/deputados/204542', 'regime': 'Ordinário (Art. 151, III, RICD)', 'descricaoTramitacao': 'Saída de Relator da Comissão - Sem Parecer Apresentado', 'codTipoTramitacao': '1250', 'descricaoSituacao': 'Aguardando Designação de Relator', 'codSituacao': 907, 'despacho': '(Fim de Legislatura) O Relator, Dep. Denis Bezerra, deixou de ser membro da Comissão', 'url': None, 'ambito': 'Regimental', 'apreciacao': 'Proposição Sujeita à Apreciação Conclusiva pelas Comissões - Art. 24 II'}|https://dadosabertos.camara.leg.br/api/v2/proposicoes/2323872/autores|Projeto de Lei||Obrigatoriedade, Concessionária de serviço de energia elétrica, realização, conexão, instalação, unidade consumidora de energia, rede de distribuição de energia elétrica, prazo, descumprimento, multa.||||https://www.camara.leg.br/proposicoesWeb/prop_mostrarintegra?codteor=2172761|||
2323877|https://dadosabertos.camara.leg.br/api/v2/proposicoes/2323877|PL|139|1308|2022|Altera a Lei nº 9.427, de 26 de dezembro de 1996, para estabelecer que a multa a ser aplicada às distribuidoras de energia elétrica por descumprimento dos limites de continuidade deverá equivaler a, no mínimo, um desconto tarifário de trinta por cento sobre o valor da fatura concernente ao ciclo tarifário subsequente à ocorrência da irregularidade.|2022-05-18T18:12||{'dataHora': '2022-05-30T00:00', 'sequencia': 17, 'siglaOrgao': 'CDC', 'uriOrgao': 'https://dadosabertos.camara.leg.br/api/v2/orgaos/2004', 'uriUltimoRelator': None, 'regime': 'Prioridade (Art. 151, II, RICD)', 'descricaoTramitacao': 'Designação de Relator', 'codTipoTramitacao': '320', 'descricaoSituacao': 'Tramitando em Conjunto', 'codSituacao': 925, 'despacho': 'Designado Relator, Dep. Bozzella (UNIÃO-SP)', 'url': None, 'ambito': 'Protocolar', 'apreciacao': 'Proposição Sujeita à Apreciação do Plenário'}|https://dadosabertos.camara.leg.br/api/v2/proposicoes/2323877/autores|Projeto de Lei||Alteração, Lei da Agência Nacional de Energia Elétrica, interrupção, fornecimento, energia elétrica, Concessionária de serviço de energia elétrica, aplicação, multa, benefício, usuário, equivalência, percentagem, valor, fatura, período subsequente.|https://dadosabertos.camara.leg.br/api/v2/proposicoes/2265383|||https://www.camara.leg.br/proposicoesWeb/prop_mostrarintegra?codteor=2172779|||
2323942|https://dadosabertos.camara.leg.br/api/v2/proposicoes/2323942|PL|139|1309|2022|Altera a Lei nº 10.260, de 20 de julho de 2001, que dispõe sobre o Fundo de Financiamento ao estudante do Ensino Superior, para conceder desconto nas parcelas do FIES.|2022-05-18T20:07||{'dataHora': '2022-08-15T00:00', 'sequencia': 17, 'siglaOrgao': 'CE', 'uriOrgao': 'https://dadosabertos.camara.leg.br/api/v2/orgaos/2009', 'uriUltimoRelator': None, 'regime': 'Ordinário (Art. 151, III, RICD)', 'descricaoTramitacao': 'Devolução ao Relator', 'codTipoTramitacao': '170', 'descricaoSituacao': 'Tramitando em Conjunto', 'codSituacao': 925, 'despacho': 'Devolvido ao Relator, Dep. Felipe Rigoni (UNIÃO-ES)', 'url': None, 'ambito': 'Protocolar', 'apreciacao': 'Proposição Sujeita à Apreciação Conclusiva pelas Comissões - Art. 24 II'}|https://dadosabertos.camara.leg.br/api/v2/proposicoes/2323942/autores|Projeto de Lei||Alteração, Lei do Financiamento Estudantil, agente financeiro, desconto, parcela vincenda, crédito, Fundo de Financiamento Estudantil (Fies), estudante, adimplemento, estímulo, antecipação, parcela, liquidação, dívida.|https://dadosabertos.camara.leg.br/api/v2/proposicoes/2313793|||https://www.camara.leg.br/proposicoesWeb/prop_mostrarintegra?codteor=2173089|||
2323950|https://dadosabertos.camara.leg.br/api/v2/proposicoes/2323950|PL|139|1310|2022|Altera a Lei nº 9.250, de 26 de dezembro de 1995, para incluir despesas com transporte escolar particular e com formação de condutores entre aquelas dedutíveis da base de cálculo do imposto de renda da pessoa física.|2022-05-18T20:41||{'dataHora': '2022-05-30T10:24', 'sequencia': 15, 'siglaOrgao': 'CFT', 'uriOrgao': 'https://dadosabertos.camara.leg.br/api/v2/orgaos/2010', 'uriUltimoRelator': None, 'regime': 'Ordinário (Art. 151, III, RICD)', 'descricaoTramitacao': 'Recebimento', 'codTipoTramitacao': '500', 'descricaoSituacao': 'Aguardando Designação de Relator', 'codSituacao': 907, 'despacho': 'Recebimento pela CFT.', 'url': None, 'ambito': 'Regimental', 'apreciacao': 'Proposição Sujeita à Apreciação Conclusiva pelas Comissões - Art. 24 II'}|https://dadosabertos.camara.leg.br/api/v2/proposicoes/2323950/autores|Projeto de Lei||Alteração, Legislação Tributária Federal, dedução, base de cálculo, Imposto sobre a Renda da Pessoa Física (IRPF), despesa, transporte escolar, particular, formação de condutor.||||https://www.camara.leg.br/proposicoesWeb/prop_mostrarintegra?codteor=2173117|||
