id|uri|siglaTipo|codTipo|numero|ano|ementa|dataApresentacao|uriOrgaoNumerador|statusProposicao|uriAutores|descricaoTipo|ementaDetalhada|keywords|uriPropPrincipal|uriPropAnterior|uriPropPosterior|urlInteiroTeor|urnFinal|texto|justificativa
2318836|https://dadosabertos.camara.leg.br/api/v2/proposicoes/2318836|PL|139|737|2022|Criminaliza as condutas de quem submete outra pessoa a terapia de conversão, anuncia ou promove terapia de conversão, obtém, direta ou indiretamente, vantagem material oriunda de terapia de conversão.|2022-03-29T10:44||{'dataHora': '2022-07-01T13:12', 'sequencia': 18, 'siglaOrgao': 'CCJC', 'uriOrgao': 'https://dadosabertos.camara.leg.br/api/v2/orgaos/2003', 'uriUltimoRelator': None, 'regime': 'Ordinário (Art. 151, III, RICD)', 'descricaoTramitacao': 'Notificação de Apensação', 'codTipoTramitacao': '504', 'descricaoSituacao': 'Aguardando Designação de Relator', 'codSituacao': 907, 'despacho': 'Apensação do PL 1795/2022 a esta proposição.', 'url': None, 'ambito': 'Protocolar', 'apreciacao': 'Proposição Sujeita à Apreciação do Plenário'}|https://dadosabertos.camara.leg.br/api/v2/proposicoes/2318836/autores|Projeto de Lei|Altera o Decreto-lei nº 2.848 de 1940.|Alteração, Código Penal, Crime contra a saúde pública, tipicidade penal, Terapia de Conversão, tratamento, repressão, orientação sexual, Identidade de gênero, Expressão de gênero, detenção.||||https://www.camara.leg.br/proposicoesWeb/prop_mostrarintegra?codteor=2153215|||
2318837|https://dadosabertos.camara.leg.br/api/v2/proposicoes/2318837|PL|139|738|2022|Institui o Selo Empresa Amiga da Mulher para empresas públicas e provadas em todo o país.|2022-03-29T10:46||{'dataHora': '2022-12-22T11:29', 'sequencia': 18, 'siglaOrgao': 'CMULHER', 'uriOrgao': 'https://dadosabertos.camara.leg.br/api/v2/orgaos/537870', 'uriUltimoRelator': None, 'regime': 'Ordinário (Art. 151, III, RICD)', 'descricaoTramitacao': 'Recebimento', 'codTipoTramitacao': '500', 'descricaoSituacao': 'Tramitando em Conjunto', 'codSituacao': 925, 'despacho': 'Recebimento pela CMULHER, apensado ao PL-2478/2021', 'url': None, 'ambito': 'Regimental', 'apreciacao': 'Proposição Sujeita à Apreciação Conclusiva pelas Comissões - Art. 24 II'}|https://dadosabertos.camara.leg.br/api/v2/proposicoes/2318837/autores|Projeto de Lei||Criação, Selo Empresa Amiga da Mulher, pessoa jurídica, Boas práticas, Ambiente de trabalho, Igualdade entre os sexos,  mercado de trabalho, Equiparação salarial, combate, Importunação sexual, assédio sexual, assédio moral, Violência física, Violência moral, Violência psicológica, Discriminação de gênero, mulher.|https://dadosabertos.camara.leg.br/api/v2/proposicoes/2289915|||https://www.camara.leg.br/proposicoesWeb/prop_mostrarintegra?codteor=2153219|||
2318840|https://dadosabertos.camara.leg.br/api/v2/proposicoes/2318840|PL|139|739|2022|Institui o piso salarial nacional para os Conselheiros Tutelares.|2022-03-29T11:37||{'dataHora': '2023-03-29T19:14', 'sequencia': 18, 'siglaOrgao': 'CPASF', 'uriOrgao': 'https://dadosabertos.camara.leg.br/api/v2/orgaos/539387', 'uriUltimoRelator': None, 'regime': 'Ordinário (Art. 151, III, RICD)', 'descricaoTramitacao': 'Recebimento', 'codTipoTramitacao': '500', 'descricaoSituacao': 'Tramitando em Conjunto', 'codSituacao': 925, 'despacho': 'Recebimento pela CPASF, apensado ao PL-7779/2014', 'url': None, 'ambito': 'Regimental', 'apreciacao': 'Proposição Sujeita à Apreciação Conclusiva pelas Comissões - Art. 24 II'}|https://dadosabertos.camara.leg.br/api/v2/proposicoes/2318840/autores|Projeto de Lei||Fixação, Piso salarial, Conselheiro Tutelar, atualização, Índice Nacional de Preços ao Consumidor (INPC).|https://dadosabertos.camara.leg.br/api/v2/proposicoes/619647|||https://www.camara.leg.br/proposicoesWeb/prop_mostrarintegra?codteor=2153232|||
2318845|https://dadosabertos.camara.leg.br/api/v2/proposicoes/2318845|PL|139|740|2022|Garante isenção do imposto de renda a famílias quando o dependente for pessoa com alguma doença grave.|2022-03-29T13:16||{'dataHora': '2022-03-31T00:00', 'sequencia': 13, 'siglaOrgao': 'CCP', 'uriOrgao': 'https://dadosabertos.camara.leg.br/api/v2/orgaos/186', 'uriUltimoRelator': None, 'regime': 'Prioridade (Art. 151, II, RICD)', 'descricaoTramitacao': 'Publicação de Proposição', 'codTipoTramitacao': '604', 'descricaoSituacao': 'Tramitando em Conjunto', 'codSituacao': 925, 'despacho': 'Encaminhada à publicação. Publicação Inicial em avulso e no DCD de 01/04/2022 PAG 285', 'url': None, 'ambito': 'Regimental', 'apreciacao': 'Proposição Sujeita à Apreciação do Plenário'}|https://dadosabertos.camara.leg.br/api/v2/proposicoes/2318845/autores|Projeto de Lei|Altera as Leis nº 7.713 de 1988 e 9.249 de 1995.|Alteração, Legislação Tributária Federal, isenção tributária, Imposto  de renda da pessoa física (IRPF), contribuinte,  dependente, doença grave, ausência renda, benefício fiscal, tributação. _ Compensação, renúncia fiscal, aumento, alíquota, Juros sobre capital próprio, Imposto de Renda Retido na Fonte (IRRF), pessoa jurídica, lucro.|https://dadosabertos.camara.leg.br/api/v2/proposicoes/617848|||https://www.camara.leg.br/proposicoesWeb/prop_mostrarintegra?codteor=2153245|||
2318846|https://dadosabertos.camara.leg.br/api/v2/proposicoes/2318846|PL|139|741|2022|Estabelece a obrigatoriedade de informatização e digitalização de prontuários médicos de pacientes hospitalizados ou em atendimento hospitalar.|2022-03-29T13:20||{'dataHora': '2022-04-05T00:00', 'sequencia': 17, 'siglaOrgao': 'CCP', 'uriOrgao': 'https://dadosabertos.camara.leg.br/api/v2/orgaos/186', 'uriUltimoRelator': None, 'regime': 'Prioridade (Art. 151, II, RICD)', 'descricaoTramitacao': 'Publicação de Proposição', 'codTipoTramitacao': '604', 'descricaoSituacao': 'Tramitando em Conjunto', 'codSituacao': 925, 'despacho': 'Encaminhada à publicação. Publicação Inicial em avulso e no DCD de 06/04/2022 PAG 611', 'url': None, 'ambito': 'Regimental', 'apreciacao': 'Proposição Sujeita à Apreciação do Plenário'}|https://dadosabertos.camara.leg.br/api/v2/proposicoes/2318846/autores|Projeto de Lei||Obrigatoriedade, informatização, digitalização, prontuário médico, hospital público, hospital privado, unidade de saúde.|https://dadosabertos.camara.leg.br/api/v2/proposicoes/2198608|||https://www.camara.leg.br/proposicoesWeb/prop_mostrarintegra?codteor=2153247|||
2318849|https://dadosabertos.camara.leg.br/api/v2/proposicoes/2318849|PL|139|742|2022|"Altera o art. 98 da Lei nº 13.105, de 16
de março de 2015, Código de Processo
Civil, para conceder Gratuidade da
Justiça para as despesas com a
realização de perícia médica e de outros
exames considerados essenciais para
pessoas com insuficiência de recursos."|2022-03-29T13:59||{'dataHora': '2022-04-01T10:20', 'sequencia': 15, 'siglaOrgao': 'CCJC', 'uriOrgao': 'https://dadosabertos.camara.leg.br/api/v2/orgaos/2003', 'uriUltimoRelator': None, 'regime': 'Ordinário (Art. 151, III, RICD)', 'descricaoTramitacao': 'Recebimento', 'codTipoTramitacao': '500', 'descricaoSituacao': 'Aguardando Designação de Relator', 'codSituacao': 907, 'despacho': 'Recebimento pela CCJC.', 'url': None, 'ambito': 'Regimental', 'apreciacao': 'Proposição Sujeita à Apreciação Conclusiva pelas Comissões - Art. 24 II'}|https://dadosabertos.camara.leg.br/api/v2/proposicoes/2318849/autores|Projeto de Lei||Alteração, Código de Processo Civil (2015), justiça gratuita, despesa, perícia médica, beneficiário, Instituto Nacional do Seguro Social (INSS),  insuficiência, recursos, pagamento, custas, despesa processual, Honorários advocatícios.||||https://www.camara.leg.br/proposicoesWeb/prop_mostrarintegra?codteor=2153253|||
2318856|https://dadosabertos.camara.leg.br/api/v2/proposicoes/2318856|PL|139|743|2022|Altera a Lei n° 13.105, de 16 de março de 2015- Código de Processo Civil, nos termos em que especifica|2022-03-29T15:01|https://dadosabertos.camara.leg.br/api/v2/orgaos/2003|{'dataHora': '2023-01-31T00:00', 'sequencia': 19, 'siglaOrgao': 'CCJC', 'uriOrgao': 'https://dadosabertos.camara.leg.br/api/v2/orgaos/2003', 'uriUltimoRelator': 'https://dadosabertos.camara.leg.br/api/v2/deputados/160545', 'regime': 'Ordinário (Art. 151, III, RICD)', 'descricaoTramitacao': 'Saída de Relator da Comissão - Sem Parecer Apresentado', 'codTipoTramitacao': '1250', 'descricaoSituacao': 'Aguardando Designação de Relator', 'codSituacao': 907, 'despacho': '(Fim de Legislatura) O Relator, Dep. Alexandre Leite, deixou de ser membro da Comissão', 'url': None, 'ambito': 'Regimental', 'apreciacao': 'Proposição Sujeita à Apreciação Conclusiva pelas Comissões - Art. 24 II'}|https://dadosabertos.camara.leg.br/api/v2/proposicoes/2318856/autores|Projeto de Lei||Alteração, Código de Processo Civil (2015), critério, impenhorabilidade, criptoativos, valor, salário-mínimo, papel moeda, conta corrente, conta poupança, Fundo de Índice de Renda Fixa, Título público, fundo de investimento, reserva monetária, devedor.||||https://www.camara.leg.br/proposicoesWeb/prop_mostrarintegra?codteor=2153296|||
2318857|https://dadosabertos.camara.leg.br/api/v2/proposicoes/2318857|PL|139|744|2022|Altera a Lei 10.233 de 05 de junho de 2001, que dispõe sobre a reestruturação dos transportes aquaviário e terrestre, cria o Conselho Nacional de Integração de Políticas de Transporte, a Agência Nacional de Transportes Terrestres, a Agência Nacional de Transportes Aquaviários e o Departamento Nacional de Infra-Estrutura de Transportes, e dá outras providências.|2022-03-29T15:06||{'dataHora': '2022-04-07T00:00', 'sequencia': 17, 'siglaOrgao': 'CVT', 'uriOrgao': 'https://dadosabertos.camara.leg.br/api/v2/orgaos/2016', 'uriUltimoRelator': None, 'regime': 'Ordinário (Art. 151, III, RICD)', 'descricaoTramitacao': 'Designação de Relator', 'codTipoTramitacao': '320', 'descricaoSituacao': 'Tramitando em Conjunto', 'codSituacao': 925, 'despacho': 'Designado Relator, Dep. Isnaldo Bulhões Jr. (MDB-AL)', 'url': None, 'ambito': 'Protocolar', 'apreciacao': 'Proposição Sujeita à Apreciação Conclusiva pelas Comissões - Art. 24 II'}|https://dadosabertos.camara.leg.br/api/v2/proposicoes/2318857/autores|Projeto de Lei||Alteração, Lei de Reestruturação dos Transportes Aquaviário e Terrestre, outorga, Autorização (administração pública), fretamento, Transporte coletivo, transporte de passageiro, demanda, pessoa, grupo de pessoas, realização, viagem.|https://dadosabertos.camara.leg.br/api/v2/proposicoes/2236659|||https://www.camara.leg.br/proposicoesWeb/prop_mostrarintegra?codteor=2153299|||
2318858|https://dadosabertos.camara.leg.br/api/v2/proposicoes/2318858|PL|139|746|2022|Altera a Lei nº 8.906, de 4 de julho de 1994, para estipular direitos e garantias para a advogada e o advogado enquanto for responsável por pessoa com deficiência.|2022-03-29T15:18||{'dataHora': '2022-04-05T00:00', 'sequencia': 17, 'siglaOrgao': 'CPD', 'uriOrgao': 'https://dadosabertos.camara.leg.br/api/v2/orgaos/537480', 'uriUltimoRelator': None, 'regime': 'Ordinário (Art. 151, III, RICD)', 'descricaoTramitacao': 'Designação de Relator', 'codTipoTramitacao': '320', 'descricaoSituacao': 'Tramitando em Conjunto', 'codSituacao': 925, 'despacho': 'Designado Relator, Dep. Rubens Otoni (PT-GO)', 'url': None, 'ambito': 'Protocolar', 'apreciacao': 'Proposição Sujeita à Apreciação Conclusiva pelas Comissões - Art. 24 II'}|https://dadosabertos.camara.leg.br/api/v2/proposicoes/2318858/autores|Projeto de Lei||Alteração, Estatuto da OAB, direitos, advogada, advogado, pessoa com deficiência, Acessibilidade arquitetônica, Acessibilidade comunicacional, Acessibilidade digital, Conselho Federal, Ordem dos Advogados do Brasil (OAB), isenção, percentual, anuidade.|https://dadosabertos.camara.leg.br/api/v2/proposicoes/2278246|||https://www.camara.leg.br/proposicoesWeb/prop_mostrarintegra?codteor=2153306|||
2318860|https://dadosabertos.camara.leg.br/api/v2/proposicoes/2318860|PL|139|747|2022|Altera a Lei nº 11.959, de 29 de junho de 2009, que dispõe sobre a Política Nacional de Desenvolvimento Sustentável da Aquicultura e da Pesca, regula as atividades pesqueiras, revoga a Lei nº 7.679, de 23 de novembro de 1988, e dispositivos do Decreto-Lei nº 221, de 28 de fevereiro de 1967, e dá outras providências.|2022-03-29T15:45|https://dadosabertos.camara.leg.br/api/v2/orgaos/6174|{'dataHora': '2023-01-31T00:00', 'sequencia': 19, 'siglaOrgao': 'CMADS', 'uriOrgao': 'https://dadosabertos.camara.leg.br/api/v2/orgaos/6174', 'uriUltimoRelator': 'https://dadosabertos.camara.leg.br/api/v2/deputados/160632', 'regime': 'Ordinário (Art. 151, III, RICD)', 'descricaoTramitacao': 'Saída de Relator da Comissão - Sem Parecer Apresentado', 'codTipoTramitacao': '1250', 'descricaoSituacao': 'Aguardando Designação de Relator', 'codSituacao': 907, 'despacho': '(Fim de Legislatura) O Relator, Dep. Zé Silva, deixou de ser membro da Comissão', 'url': None, 'ambito': 'Regimental', 'apreciacao': 'Proposição Sujeita à Apreciação Conclusiva pelas Comissões - Art. 24 II'}|https://dadosabertos.camara.leg.br/api/v2/proposicoes/2318860/autores|Projeto de Lei||Alteração, Lei da Aquicultura e Pesca, aperfeiçoamento, legislação, aquicultura. _Regulamentação, desburocratização, atividade econômica, aquicultura. _ Alteração, Código de Pesca (1967), revogação, dispositivo legal, pagamento, taxa anual, Aquicultor, empresa, comercialização, animal aquático.||||https://www.camara.leg.br/proposicoesWeb/prop_mostrarintegra?codteor=2153319|||
2318875|https://dadosabertos.camara.leg.br/api/v2/proposicoes/2318875|PL|139|752|2022|Confere ao Munícipio de Santa Rosa de Lima, localizado no Estado de Santa Catarina, o título de Capital Nacional da Meliponicultura.|2022-03-29T16:48|https://dadosabertos.camara.leg.br/api/v2/orgaos/2001|{'dataHora': '2022-10-26T14:19', 'sequencia': 29, 'siglaOrgao': 'CCJC', 'uriOrgao': 'https://dadosabertos.camara.leg.br/api/v2/orgaos/2003', 'uriUltimoRelator': 'https://dadosabertos.camara.leg.br/api/v2/deputados/160604', 'regime': 'Ordinário (Art. 151, III, RICD)', 'descricaoTramitacao': 'Recebimento', 'codTipoTramitacao': '500', 'descricaoSituacao': 'Aguardando Designação de Relator', 'codSituacao': 907, 'despacho': 'Recebimento pela CCJC.', 'url': None, 'ambito': 'Regimental', 'apreciacao': 'Proposição Sujeita à Apreciação Conclusiva pelas Comissões - Art. 24 II'}|https://dadosabertos.camara.leg.br/api/v2/proposicoes/2318875/autores|Projeto de Lei||Título de capital nacional, Capital Nacional da Meliponicultura, Santa Rosa de Lima (SC), Santa Catarina, Título de Topônimo.||||https://www.camara.leg.br/proposicoesWeb/prop_mostrarintegra?codteor=2153378|||
2318879|https://dadosabertos.camara.leg.br/api/v2/proposicoes/2318879|PL|139|753|2022|Altera a Lei nº 13.146, de 6 de julho de 2015, que “institui a Lei Brasileira de Inclusão da Pessoa com Deficiência - Estatuto da Pessoa com Deficiência”, a fim de estabelecer o percentual de veículos adaptados para uso de pessoa com deficiência a ser adotado pelas empresas de transporte de fretamento e de turismo.|2022-03-29T17:17||{'dataHora': '2022-04-07T00:00', 'sequencia': 17, 'siglaOrgao': 'CVT', 'uriOrgao': 'https://dadosabertos.camara.leg.br/api/v2/orgaos/2016', 'uriUltimoRelator': None, 'regime': 'Ordinário (Art. 151, III, RICD)', 'descricaoTramitacao': 'Designação de Relator', 'codTipoTramitacao': '320', 'descricaoSituacao': 'Tramitando em Conjunto', 'codSituacao': 925, 'despacho': 'Designado Relator, Dep. Vanderlei Macris (PSDB-SP)', 'url': None, 'ambito': 'Protocolar', 'apreciacao': 'Proposição Sujeita à Apreciação Conclusiva pelas Comissões - Art. 24 II'}|https://dadosabertos.camara.leg.br/api/v2/proposicoes/2318879/autores|Projeto de Lei||Alteração, Estatuto da Pessoa com Deficiência, caracterização, transporte coletivo, natureza pública, natureza privada. _ Empresa de transporte, fretamento, transporte de turismo,  aquisição, renovação, percentual, frota, veículo adaptado, utilização, pessoa com deficiência.|https://dadosabertos.camara.leg.br/api/v2/proposicoes/2172783|||https://www.camara.leg.br/proposicoesWeb/prop_mostrarintegra?codteor=2153396|||
2318897|https://dadosabertos.camara.leg.br/api/v2/proposicoes/2318897|PL|139|754|2022|Altera a Lei nº 14.216, de 7 de outubro de 2021, que “Estabelece medidas excepcionais em razão da Emergência em Saúde Pública de Importância Nacional (Espin) decorrente da infecção humana pelo coronavírus SARS-CoV-2, para suspender o cumprimento de medida judicial, extrajudicial ou administrativa que resulte em desocupação ou remoção forçada coletiva em imóvel privado ou público, exclusivamente urbano, e a concessão de liminar em ação de despejo de que trata a Lei nº 8.245, de 18 de outubro de 1991, e para estimular a celebração de acordos nas relações locatícias. “|2022-03-29T17:36||{'dataHora': '2022-04-05T00:00', 'sequencia': 16, 'siglaOrgao': 'CCP', 'uriOrgao': 'https://dadosabertos.camara.leg.br/api/v2/orgaos/186', 'uriUltimoRelator': None, 'regime': 'Prioridade (Art. 151, II, RICD)', 'descricaoTramitacao': 'Publicação de Proposição', 'codTipoTramitacao': '604', 'descricaoSituacao': 'Tramitando em Conjunto', 'codSituacao': 925, 'despacho': 'Encaminhada à publicação. Publicação Inicial em avulso e no DCD de 06/04/2022 PAG 627', 'url': None, 'ambito': 'Regimental', 'apreciacao': 'Proposição Sujeita à Apreciação Conclusiva pelas Comissões - Art. 24 II'}|https://dadosabertos.camara.leg.br/api/v2/proposicoes/2318897/autores|Projeto de Lei||Alteração, Lei Federal, Emergência em Saúde Pública de Importância Nacional (ESPIN), decorrência, coronavírus, suspensão, cumprimento, Medida judicial, Medida extrajudicial, Ato administrativo, resultado, desocupação, remoção forçada, imóvel privado, imóvel público, imóvel urbano. _Concessão, Medida liminar, Ação de despejo. _Aplicação, disposição (texto legislativo), desocupação coletiva, área rural.|https://dadosabertos.camara.leg.br/api/v2/proposicoes/2310027|||https://www.camara.leg.br/proposicoesWeb/prop_mostrarintegra?codteor=2153445|||
2318916|https://dadosabertos.camara.leg.br/api/v2/proposicoes/2318916|PL|139|755|2022|Estabelece responsabilidade civil por parte do Poder Público em razão de dano provocado ao proprietário do imóvel lindeiro desvalorizado em decorrência da construção de viaduto.|2022-03-29T18:20||{'dataHora': '2022-04-01T10:20', 'sequencia': 15, 'siglaOrgao': 'CCJC', 'uriOrgao': 'https://dadosabertos.camara.leg.br/api/v2/orgaos/2003', 'uriUltimoRelator': None, 'regime': 'Ordinário (Art. 151, III, RICD)', 'descricaoTramitacao': 'Recebimento', 'codTipoTramitacao': '500', 'descricaoSituacao': 'Aguardando Designação de Relator', 'codSituacao': 907, 'despacho': 'Recebimento pela CCJC.', 'url': None, 'ambito': 'Regimental', 'apreciacao': 'Proposição Sujeita à Apreciação Conclusiva pelas Comissões - Art. 24 II'}|https://dadosabertos.camara.leg.br/api/v2/proposicoes/2318916/autores|Projeto de Lei||Determinação, responsabilidade civil, Poder público, dano material, proprietário, imóvel lindeiro, desvalorização, decorrência, construção, viaduto, indenização.||||https://www.camara.leg.br/proposicoesWeb/prop_mostrarintegra?codteor=2153496|||
2318923|https://dadosabertos.camara.leg.br/api/v2/proposicoes/2318923|PL|139|756|2022|Altera o §2º do art. 98 da Lei n. 9.503, de 23 de setembro de 1997 – Código de Trânsito Brasileiro - para estabelecer as modificações permitidas nas características de veículo automotor classificado na espécie misto, tipo utilitário, carroceria e jipe e qualquer outro tipo dotado de tração em todas as suas rodas, inclusive ônibus e caminhões.|2022-03-29T18:28||{'dataHora': '2022-11-17T07:35', 'sequencia': 21, 'siglaOrgao': 'CCJC', 'uriOrgao': 'https://dadosabertos.camara.leg.br/api/v2/orgaos/2003', 'uriUltimoRelator': None, 'regime': 'Ordinário (Art. 151, III, RICD)', 'descricaoTramitacao': 'Recebimento', 'codTipoTramitacao': '500', 'descricaoSituacao': 'Tramitando em Conjunto', 'codSituacao': 925, 'despacho': 'Recebimento pela CCJC, apensado ao PL-410/2022', 'url': None, 'ambito': 'Regimental', 'apreciacao': 'Proposição Sujeita à Apreciação Conclusiva pelas Comissões - Art. 24 II'}|https://dadosabertos.camara.leg.br/api/v2/proposicoes/2318923/autores|Projeto de Lei||Alteração, Código de Trânsito Brasileiro, autorização, customização, veículo automotor, classificação, veículo misto, utilitário, carroceria, camioneta, ônibus, caminhão, veículo 4x4.|https://dadosabertos.camara.leg.br/api/v2/proposicoes/2316631|||https://www.camara.leg.br/proposicoesWeb/prop_mostrarintegra?codteor=2153506|||
2318925|https://dadosabertos.camara.leg.br/api/v2/proposicoes/2318925|PL|139|757|2022|Altera a Lei nº 9.537, de 11 de dezembro de 1997, e a Lei nº 10.233, de 5 de junho de 2001, para estabelecer a competência da Agência Nacional de Transportes Aquaviários - Antaq para atuar na regulação econômica dos serviços de praticagem.|2022-03-29T18:39|https://dadosabertos.camara.leg.br/api/v2/orgaos/180|"{'dataHora': '2022-04-05T00:00', 'sequencia': 19, 'siglaOrgao': 'MESA', 'uriOrgao': 'https://dadosabertos.camara.leg.br/api/v2/orgaos/4', 'uriUltimoRelator': None, 'regime': 'Prioridade (Art. 151, II, RICD)', 'descricaoTramitacao': 'Notificação de Despacho', 'codTipoTramitacao': '203', 'descricaoSituacao': 'Tramitando em Conjunto', 'codSituacao': 925, 'despacho': 'Despacho exarado no Requerimento n. 455/2022, conforme o seguinte teor: ""Dou por prejudicado o Requerimento n. 455/2022, nos termos do art. 164, I, do Regimento Interno da Câmara dos Deputados, tendo em vista que os Projetos de Lei n. 1.565/2019 e n. 757/2022 já tramitam conjuntamente. Publique-se.""', 'url': None, 'ambito': 'Regimental', 'apreciacao': 'Proposição Sujeita à Apreciação Conclusiva pelas Comissões - Art. 24 II'}"|https://dadosabertos.camara.leg.br/api/v2/proposicoes/2318925/autores|Projeto de Lei||Alteração, Lei de Segurança do Tráfego Aquaviário, Agência Nacional de Transportes Aquaviários (ANTAQ), Regulação econômica, Serviços, navegação de praticagem, diretrizes.|https://dadosabertos.camara.leg.br/api/v2/proposicoes/2261182|||https://www.camara.leg.br/proposicoesWeb/prop_mostrarintegra?codteor=2153509|||
2318936|https://dadosabertos.camara.leg.br/api/v2/proposicoes/2318936|PL|139|758|2022|Altera a alínea “c” do inciso III do art. 29; e acrescenta a alínea “d” ao inciso III do art. 29, do Código de Trânsito Brasileiro (Lei 9.503, de 23 de setembro de 1997).|2022-03-29T18:46|https://dadosabertos.camara.leg.br/api/v2/orgaos/2016|{'dataHora': '2023-01-31T00:00', 'sequencia': 19, 'siglaOrgao': 'CVT', 'uriOrgao': 'https://dadosabertos.camara.leg.br/api/v2/orgaos/2016', 'uriUltimoRelator': 'https://dadosabertos.camara.leg.br/api/v2/deputados/204456', 'regime': 'Ordinário (Art. 151, III, RICD)', 'descricaoTramitacao': 'Saída de Relator da Comissão - Sem Parecer Apresentado', 'codTipoTramitacao': '1250', 'descricaoSituacao': 'Aguardando Designação de Relator', 'codSituacao': 907, 'despacho': '(Fim de Legislatura) O Relator, Dep. Gutemberg Reis, deixou de ser membro da Comissão', 'url': None, 'ambito': 'Regimental', 'apreciacao': 'Proposição Sujeita à Apreciação Conclusiva pelas Comissões - Art. 24 II'}|https://dadosabertos.camara.leg.br/api/v2/proposicoes/2318936/autores|Projeto de Lei||Alteração, Código de Trânsito Brasileiro, critério, preferência, circulação, veículo, via, cruzamento rodoviário, ausência, sinalização. _ Segurança jurídica, condutor, trânsito.||||https://www.camara.leg.br/proposicoesWeb/prop_mostrarintegra?codteor=2153535|||
2318962|https://dadosabertos.camara.leg.br/api/v2/proposicoes/2318962|PL|139|760|2022|Dispõe sobre incentivos fiscais destinados a promover o apoio à saúde mental de jovens e adolescentes e dá outras providências.|2022-03-29T20:28|https://dadosabertos.camara.leg.br/api/v2/orgaos/2014|{'dataHora': '2022-08-17T23:59', 'sequencia': 19, 'siglaOrgao': 'CSAUDE', 'uriOrgao': 'https://dadosabertos.camara.leg.br/api/v2/orgaos/2014', 'uriUltimoRelator': 'https://dadosabertos.camara.leg.br/api/v2/deputados/154919', 'regime': 'Ordinário (Art. 151, III, RICD)', 'descricaoTramitacao': 'Saída de Relator da Comissão - Sem Parecer Apresentado', 'codTipoTramitacao': '1250', 'descricaoSituacao': 'Aguardando Designação de Relator', 'codSituacao': 907, 'despacho': 'O Relator, Dep. Eleuses Paiva, deixou de ser membro da Comissão', 'url': None, 'ambito': 'Regimental', 'apreciacao': 'Proposição Sujeita à Apreciação Conclusiva pelas Comissões - Art. 24 II'}|https://dadosabertos.camara.leg.br/api/v2/proposicoes/2318962/autores|Projeto de Lei|Altera a Lei nº 9.250 de 1995.|"Criação, Programa de Suporte a Saúde Mental na Era Digital (PROSSMED), apoio, prevenção, saúde mental, jovem, adolescente, utilização, rede social, Tecnologia da informação. _ Incentivo fiscal, Entidade beneficente, Organização social, Organização da Sociedade Civil de Interesse Público (OSCIP), Atenção à saúde, saúde mental. _ Critério, pessoa física, pessoa jurídica, dedução, Imposto devido, doação, Entidade sem fins lucrativos, promoção, saúde mental.
_ Alteração, Legislação Tributária Federal, dedução, Imposto sobre a Renda da Pessoa Física (IRPF), doação, Programa de Suporte a Saúde Mental na Era Digital (PROSSMED), tributação, benefício fiscal."||||https://www.camara.leg.br/proposicoesWeb/prop_mostrarintegra?codteor=2153658|||
