id|uri|siglaTipo|codTipo|numero|ano|ementa|dataApresentacao|uriOrgaoNumerador|statusProposicao|uriAutores|descricaoTipo|ementaDetalhada|keywords|uriPropPrincipal|uriPropAnterior|uriPropPosterior|urlInteiroTeor|urnFinal|texto|justificativa
2334265|https://dadosabertos.camara.leg.br/api/v2/proposicoes/2334265|PL|139|2339|2022|Estabelece as regras a serem observadas pelas pessoas físicas ou jurídicas na venda de mercadorias estrangeiras, por meio de sítios eletrônicos ou demais meios eletrônicos, quando se tratar de remessa postal internacional.|2022-08-24T11:59||{'dataHora': '2022-10-04T00:00', 'sequencia': 14, 'siglaOrgao': 'CCP', 'uriOrgao': 'https://dadosabertos.camara.leg.br/api/v2/orgaos/186', 'uriUltimoRelator': None, 'regime': 'Ordinário (Art. 151, III, RICD)', 'descricaoTramitacao': 'Publicação de Proposição', 'codTipoTramitacao': '604', 'descricaoSituacao': 'Aguardando Designação de Relator', 'codSituacao': 907, 'despacho': 'Encaminhada à publicação. Publicação Inicial em avulso e no DCD de 05/10/2022 PAG 70', 'url': None, 'ambito': 'Regimental', 'apreciacao': 'Proposição Sujeita à Apreciação Conclusiva pelas Comissões - Art. 24 II'}|https://dadosabertos.camara.leg.br/api/v2/proposicoes/2334265/autores|Projeto de Lei|Altera o Decreto-Lei nº 37/1966 e o Decreto-Lei nº 1.804/1980|Mercadoria estrangeira, Produto importado, Sítio (internet), Loja virtual, regulamentação, Comércio eletrônico, Compra online, Pessoa física, Pessoa jurídica, Remessa postal internacional, Objeto postal, Tarifa aduaneira,  Importação, Imposto de Importação, Tributação simplificada||||https://www.camara.leg.br/proposicoesWeb/prop_mostrarintegra?codteor=2204223|||
2334270|https://dadosabertos.camara.leg.br/api/v2/proposicoes/2334270|PL|139|2340|2022|Dispõe sobre a proibição de cobrança de tarifas para utilização de estacionamento nos estabelecimentos prestadores de serviços públicos de saúde e regulamenta a cobrança em estabelecimentos privados prestadores de serviços de saúde.|2022-08-24T15:44||{'dataHora': '2022-09-01T00:00', 'sequencia': 16, 'siglaOrgao': 'CCP', 'uriOrgao': 'https://dadosabertos.camara.leg.br/api/v2/orgaos/186', 'uriUltimoRelator': None, 'regime': 'Ordinário (Art. 151, III, RICD)', 'descricaoTramitacao': 'Publicação de Proposição', 'codTipoTramitacao': '604', 'descricaoSituacao': 'Tramitando em Conjunto', 'codSituacao': 925, 'despacho': 'Encaminhada à publicação. Publicação Inicial em avulso e no DCD de 02/09/2022 PAG 59', 'url': None, 'ambito': 'Regimental', 'apreciacao': 'Proposição Sujeita à Apreciação do Plenário'}|https://dadosabertos.camara.leg.br/api/v2/proposicoes/2334270/autores|Projeto de Lei||Estacionamento pago, Estacionamento rotativo, gratuidade, proibição, cobrança, Veículo, Paciente, Acompanhante formal do paciente, Prestador de serviço, Hospital, Clínica médica, Pronto-socorro geral, Ambulatório hospitalar, Laboratório clínico, fixação, Multa, descumprimento|https://dadosabertos.camara.leg.br/api/v2/proposicoes/595266|||https://www.camara.leg.br/proposicoesWeb/prop_mostrarintegra?codteor=2204260|||
2334279|https://dadosabertos.camara.leg.br/api/v2/proposicoes/2334279|PL|139|2342|2022|Dispõe sobre a criação de funções no Quadro de Pessoal do Conselho Nacional de Justiça.|2022-08-24T18:46||{'dataHora': '2023-03-28T09:46', 'sequencia': 23, 'siglaOrgao': 'CASP', 'uriOrgao': 'https://dadosabertos.camara.leg.br/api/v2/orgaos/539388', 'uriUltimoRelator': None, 'regime': 'Prioridade (Art. 151, II, RICD)', 'descricaoTramitacao': 'Recebimento', 'codTipoTramitacao': '500', 'descricaoSituacao': 'Aguardando Designação de Relator', 'codSituacao': 907, 'despacho': 'Recebimento pela CASP.', 'url': None, 'ambito': 'Regimental', 'apreciacao': 'Proposição Sujeita à Apreciação Conclusiva pelas Comissões - Art. 24 II'}|https://dadosabertos.camara.leg.br/api/v2/proposicoes/2334279/autores|Projeto de Lei||Conselho Nacional de Justiça (CNJ), criação, Função comissionada, Quadro de pessoal, Despesa pública, Despesa pessoal, Dotação orçamentária, Orçamento anual,||||https://www.camara.leg.br/proposicoesWeb/prop_mostrarintegra?codteor=2204347|||
2334281|https://dadosabertos.camara.leg.br/api/v2/proposicoes/2334281|PL|139|2343|2022|Altera a Lei nº 9.029, de 13 de abril de 1995, para proibir a exclusão de candidato em concurso fundamentada exclusivamente em diagnóstico de neoplasia maligna, na forma que especifica.|2022-08-25T09:50||{'dataHora': '2022-10-04T00:00', 'sequencia': 12, 'siglaOrgao': 'CCP', 'uriOrgao': 'https://dadosabertos.camara.leg.br/api/v2/orgaos/186', 'uriUltimoRelator': None, 'regime': '.', 'descricaoTramitacao': 'Publicação de Proposição', 'codTipoTramitacao': '604', 'descricaoSituacao': 'Devolvida ao Autor', 'codSituacao': 1120, 'despacho': 'Encaminhada à publicação. Publicação Inicial no DCD de 05/10/2022 PAG 77', 'url': 'https://www.camara.leg.br/proposicoesWeb/prop_mostrarintegra?codteor=2236703', 'ambito': 'Regimental', 'apreciacao': 'Indefinida'}|https://dadosabertos.camara.leg.br/api/v2/proposicoes/2334281/autores|Projeto de Lei||Candidato a cargo público, Concurso público, alteração, Legislação, exclusão, desclassificação, Diagnóstico de saúde, Neoplasia maligna||||https://www.camara.leg.br/proposicoesWeb/prop_mostrarintegra?codteor=2204358|||
2334282|https://dadosabertos.camara.leg.br/api/v2/proposicoes/2334282|PL|139|2344|2022|Dispõe sobre a disponibilização de alimentos alternativos para alunos que tenham intolerância ou alergia que os imponha restrições alimentares e dá outras providências.|2022-08-25T10:21||{'dataHora': '2022-09-01T00:00', 'sequencia': 17, 'siglaOrgao': 'CCP', 'uriOrgao': 'https://dadosabertos.camara.leg.br/api/v2/orgaos/186', 'uriUltimoRelator': None, 'regime': 'Ordinário (Art. 151, III, RICD)', 'descricaoTramitacao': 'Publicação de Proposição', 'codTipoTramitacao': '604', 'descricaoSituacao': 'Tramitando em Conjunto', 'codSituacao': 925, 'despacho': 'Encaminhada à publicação. Publicação Inicial em avulso e no DCD de 02/09/2022 PAG 72', 'url': None, 'ambito': 'Regimental', 'apreciacao': 'Proposição Sujeita à Apreciação Conclusiva pelas Comissões - Art. 24 II'}|https://dadosabertos.camara.leg.br/api/v2/proposicoes/2334282/autores|Projeto de Lei||Escola pública, Alimentação escolar, Merenda escolar, Aluno, Restrição alimentar, obrigatoriedade, disponibilização, Dieta especial,|https://dadosabertos.camara.leg.br/api/v2/proposicoes/2308663|||https://www.camara.leg.br/proposicoesWeb/prop_mostrarintegra?codteor=2204359|||
2334284|https://dadosabertos.camara.leg.br/api/v2/proposicoes/2334284|PL|139|2345|2022|Estabelece que as empresas com 50 ou mais funcionários devem ofertar, semestralmente, palestras sobre o tema da violência doméstica.|2022-08-25T10:25||{'dataHora': '2022-10-04T00:00', 'sequencia': 16, 'siglaOrgao': 'CCP', 'uriOrgao': 'https://dadosabertos.camara.leg.br/api/v2/orgaos/186', 'uriUltimoRelator': None, 'regime': 'Ordinário (Art. 151, III, RICD)', 'descricaoTramitacao': 'Publicação de Proposição', 'codTipoTramitacao': '604', 'descricaoSituacao': 'Aguardando Designação de Relator', 'codSituacao': 907, 'despacho': 'Encaminhada à publicação. Publicação Inicial em avulso e no DCD de 05/10/2022 PAG 81', 'url': None, 'ambito': 'Regimental', 'apreciacao': 'Proposição Sujeita à Apreciação Conclusiva pelas Comissões - Art. 24 II'}|https://dadosabertos.camara.leg.br/api/v2/proposicoes/2334284/autores|Projeto de Lei||Violência doméstica, Violência contra a mulher, obrigatoriedade, Empresa, oferecimento, Semestral, Ação educacional, Palestra, autorização, Convênio, Universidade pública, Universidade privada, Organização da sociedade civil, fixação, Notificação, Multa, descumprimento||||https://www.camara.leg.br/proposicoesWeb/prop_mostrarintegra?codteor=2204362|||
2334285|https://dadosabertos.camara.leg.br/api/v2/proposicoes/2334285|PL|139|2346|2022|Dispõe sobre a obrigatoriedade de divulgação, pelo Poder Público, das escalas e plantões realizados nas unidades públicas de saúde.|2022-08-25T10:30||{'dataHora': '2022-09-01T00:00', 'sequencia': 15, 'siglaOrgao': 'CCP', 'uriOrgao': 'https://dadosabertos.camara.leg.br/api/v2/orgaos/186', 'uriUltimoRelator': None, 'regime': 'Prioridade (Art. 151, II, RICD)', 'descricaoTramitacao': 'Publicação de Proposição', 'codTipoTramitacao': '604', 'descricaoSituacao': 'Aguardando Designação de Relator', 'codSituacao': 907, 'despacho': 'Encaminhada à publicação. Publicação Inicial em avulso e no DCD de 02/09/2022 PAG 75', 'url': None, 'ambito': 'Regimental', 'apreciacao': 'Proposição Sujeita à Apreciação do Plenário'}|https://dadosabertos.camara.leg.br/api/v2/proposicoes/2334285/autores|Projeto de Lei||Unidade pública de saúde, Posto de saúde, Hospital, obrigatoriedade, Poder Executivo, divulgação, Sítio (internet), Plantão hospitalar, Escala de revezamento de trabalho, Profissional de saúde, Nome, Especialidade médica, disponibilidade, quantitativo, Atendimento ao público|https://dadosabertos.camara.leg.br/api/v2/proposicoes/2088930|||https://www.camara.leg.br/proposicoesWeb/prop_mostrarintegra?codteor=2204363|||
2334286|https://dadosabertos.camara.leg.br/api/v2/proposicoes/2334286|PL|139|2347|2022|Dispõe sobre a regulamentação da atividade profissional de influenciador digital profissional no âmbito  Federal.|2022-08-25T10:32||{'dataHora': '2022-09-26T10:57', 'sequencia': 16, 'siglaOrgao': 'CTRAB', 'uriOrgao': 'https://dadosabertos.camara.leg.br/api/v2/orgaos/2015', 'uriUltimoRelator': None, 'regime': 'Ordinário (Art. 151, III, RICD)', 'descricaoTramitacao': 'Apensação', 'codTipoTramitacao': '106', 'descricaoSituacao': 'Tramitando em Conjunto', 'codSituacao': 925, 'despacho': 'Apensação desta proposição ao PL 1282/2022.', 'url': None, 'ambito': 'Protocolar', 'apreciacao': 'Proposição Sujeita à Apreciação Conclusiva pelas Comissões - Art. 24 II'}|https://dadosabertos.camara.leg.br/api/v2/proposicoes/2334286/autores|Projeto de Lei||Regulamentação profissional, Influenciador Digital Profissional, criação, Conteúdo digital, Rede social, Mídia digital, competência, atribuição, Mercado de trabalho, Educação e formação profissional,|https://dadosabertos.camara.leg.br/api/v2/proposicoes/2323549|||https://www.camara.leg.br/proposicoesWeb/prop_mostrarintegra?codteor=2204364|||
2334290|https://dadosabertos.camara.leg.br/api/v2/proposicoes/2334290|PL|139|2348|2022|Acrescenta § 16 ao art. 20 da Lei nº 8.742, de 7 de dezembro de 1993, que institui a Lei Orgânica da Assistência Social, para dispor sobre o pagamento de abono anual para quem recebe o benefício de prestação continuada.|2022-08-25T11:30||{'dataHora': '2022-09-12T00:00', 'sequencia': 15, 'siglaOrgao': 'CCP', 'uriOrgao': 'https://dadosabertos.camara.leg.br/api/v2/orgaos/186', 'uriUltimoRelator': None, 'regime': 'Ordinário (Art. 151, III, RICD)', 'descricaoTramitacao': 'Publicação de Proposição', 'codTipoTramitacao': '604', 'descricaoSituacao': 'Tramitando em Conjunto', 'codSituacao': 925, 'despacho': 'Encaminhada à publicação. Publicação Inicial em avulso e no DCD de 13/09/2022 PAG 23', 'url': None, 'ambito': 'Regimental', 'apreciacao': 'Proposição Sujeita à Apreciação Conclusiva pelas Comissões - Art. 24 II'}|https://dadosabertos.camara.leg.br/api/v2/proposicoes/2334290/autores|Projeto de Lei||Lei Orgânica da Assistência Social, alteração, Valor monetário, Abono anual, Gratificação natalina, Trabalhador, Beneficiário, Valor de referência, Dezembro, Benefício de Prestação Continuada (BPC)|https://dadosabertos.camara.leg.br/api/v2/proposicoes/2299104|||https://www.camara.leg.br/proposicoesWeb/prop_mostrarintegra?codteor=2204371|||
2334294|https://dadosabertos.camara.leg.br/api/v2/proposicoes/2334294|PL|139|2349|2022|Dispõe sobre a obrigatoriedade de o Estado arcar com os custos necessários ao fornecimento dos serviços públicos essenciais de água e de energia elétrica nas feiras públicas.|2022-08-25T13:35|https://dadosabertos.camara.leg.br/api/v2/orgaos/2008|{'dataHora': '2023-03-29T00:00', 'sequencia': 22, 'siglaOrgao': 'CDE', 'uriOrgao': 'https://dadosabertos.camara.leg.br/api/v2/orgaos/2008', 'uriUltimoRelator': 'https://dadosabertos.camara.leg.br/api/v2/deputados/220700', 'regime': 'Ordinário (Art. 151, III, RICD)', 'descricaoTramitacao': 'Abertura de Prazo', 'codTipoTramitacao': '350', 'descricaoSituacao': 'Aguardando Parecer', 'codSituacao': 915, 'despacho': 'Prazo para Emendas ao Projeto (5 sessões a partir de 30/03/2023)', 'url': None, 'ambito': 'Regimental', 'apreciacao': 'Proposição Sujeita à Apreciação Conclusiva pelas Comissões - Art. 24 II'}|https://dadosabertos.camara.leg.br/api/v2/proposicoes/2334294/autores|Projeto de Lei||Feira livre, fornecimento, Energia elétrica, Abastecimento de água, gratuidade, Custeio, valor máximo, União, Estado (ente federado), Município, Prestação de serviço público relevante||||https://www.camara.leg.br/proposicoesWeb/prop_mostrarintegra?codteor=2204404|||
2334322|https://dadosabertos.camara.leg.br/api/v2/proposicoes/2334322|PL|139|2353|2022|Altera a Lei 12.318 de 26 de agosto de 2010, para tratar de hipóteses de alienação parental, prever sanções e dá outras providências.|2022-08-26T12:44|https://dadosabertos.camara.leg.br/api/v2/orgaos/180|{'dataHora': '2022-09-12T00:00', 'sequencia': 8, 'siglaOrgao': 'CCP', 'uriOrgao': 'https://dadosabertos.camara.leg.br/api/v2/orgaos/186', 'uriUltimoRelator': None, 'regime': '.', 'descricaoTramitacao': 'Publicação de Proposição', 'codTipoTramitacao': '604', 'descricaoSituacao': 'Retirado pelo Autor', 'codSituacao': 950, 'despacho': 'Encaminhada à publicação. Publicação Inicial no DCD de 13/09/2022 PAG 26', 'url': 'https://www.camara.leg.br/proposicoesWeb/prop_mostrarintegra?codteor=2234895', 'ambito': 'Regimental', 'apreciacao': 'Indefinida'}|https://dadosabertos.camara.leg.br/api/v2/proposicoes/2334322/autores|Projeto de Lei||Alteração, Lei da Alienação Parental, atos, alienação parental, interferência, desenvolvimento psíquico, criança, adolescente, promoção, indução, Pai, Mãe, parente, repúdio, genitor, inobservância, garantia, menor de idade, convivência familiar, magistrado, membro, Ministério público, profissional, equipe multidisciplinar. _Caracterização, atos, alienação parental, mudança de domicílio, inviabilização, convivência familiar, criança, pai. _Consideração, crime, contra, criança, adolescente, atos, omissão, proibição, convivência familiar, ascendente, descendente, pena.||||https://www.camara.leg.br/proposicoesWeb/prop_mostrarintegra?codteor=2204548|||
2334357|https://dadosabertos.camara.leg.br/api/v2/proposicoes/2334357|PL|139|2354|2022|Altera a Lei 12.318 de 26 de agosto de 2010, para tratar de hipóteses de alienação parental, prever sanções e dá outras providências.|2022-08-26T15:50||{'dataHora': '2022-10-04T00:00', 'sequencia': 14, 'siglaOrgao': 'CCP', 'uriOrgao': 'https://dadosabertos.camara.leg.br/api/v2/orgaos/186', 'uriUltimoRelator': None, 'regime': 'Ordinário (Art. 151, III, RICD)', 'descricaoTramitacao': 'Publicação de Proposição', 'codTipoTramitacao': '604', 'descricaoSituacao': 'Aguardando Designação de Relator', 'codSituacao': 907, 'despacho': 'Encaminhada à publicação. Publicação Inicial em avulso e no DCD de 05/10/2022 PAG 89', 'url': None, 'ambito': 'Regimental', 'apreciacao': 'Proposição Sujeita à Apreciação do Plenário'}|https://dadosabertos.camara.leg.br/api/v2/proposicoes/2334357/autores|Projeto de Lei||Alteração, Lei da Alienação Parental, atos, alienação parental, interferência, formação psicológica, criança, adolescente, promoção, indução, Pai, Mãe, parente, repúdio, genitor, inobservância, garantia, menor de idade, convivência familiar, magistrado, membro, Ministério público, profissional, equipe multidisciplinar. _Caracterização, atos, alienação parental, mudança de domicílio, inviabilização, convivência familiar, criança, pai. _Consideração, crime, contra, criança, adolescente, atos, omissão, proibição, convivência familiar, ascendente, descendente, pena.||||https://www.camara.leg.br/proposicoesWeb/prop_mostrarintegra?codteor=2204586|||
2334361|https://dadosabertos.camara.leg.br/api/v2/proposicoes/2334361|PL|139|2355|2022|Cria o PRONEPE – Programa Nacional de Equalização da Remuneração dos Profissionais da Enfermagem|2022-08-26T16:32||"{'dataHora': '2023-03-23T14:27', 'sequencia': 16, 'siglaOrgao': 'MESA', 'uriOrgao': 'https://dadosabertos.camara.leg.br/api/v2/orgaos/4', 'uriUltimoRelator': None, 'regime': 'Ordinário (Art. 151, III, RICD)', 'descricaoTramitacao': 'Distribuição', 'codTipoTramitacao': '110', 'descricaoSituacao': 'Aguardando Designação de Relator', 'codSituacao': 907, 'despacho': 'Decisão da Presidência  de 23/03/2023, conforme o seguinte teor: ""Tendo em vista a edição da Resolução da Câmara dos Deputados n. 1/2023 [...], criando a Comissão de Previdência, Assistência Social, Infância, Adolescência e Família e a Comissão de Saúde, revejo o despacho de distribuição aposto...""...""para o fim de determinar sua redistribuição à Comissão de Saúde, em substituição à Comissão de Seguridade Social e Família, extinta pela mesma Resolução.""', 'url': 'https://www.camara.leg.br/proposicoesWeb/prop_mostrarintegra?codteor=2248699', 'ambito': 'Regimental', 'apreciacao': 'Proposição Sujeita à Apreciação Conclusiva pelas Comissões - Art. 24 II'}"|https://dadosabertos.camara.leg.br/api/v2/proposicoes/2334361/autores|Projeto de Lei||Criação, Programa Nacional de Equalização da Remuneração dos Profissionais da Enfermagem (PRONEPE), complementação, salário, Enfermeiro, Técnico de enfermagem, Auxiliar de enfermagem, recursos, Seguro Obrigatório de Danos Pessoais Causados por Veículos Automotores de Vias Terrestres (Seguro DPVAT), diretrizes.||||https://www.camara.leg.br/proposicoesWeb/prop_mostrarintegra?codteor=2204601|||
2334374|https://dadosabertos.camara.leg.br/api/v2/proposicoes/2334374|PL|139|2357|2022|Dispõe sobre a integração dos alunos com deficiência nas aulas de educação física das unidades educacionais das redes públicas e privadas e dá outras providências.|2022-08-29T10:30||{'dataHora': '2022-10-17T00:00', 'sequencia': 17, 'siglaOrgao': 'CE', 'uriOrgao': 'https://dadosabertos.camara.leg.br/api/v2/orgaos/2009', 'uriUltimoRelator': None, 'regime': 'Prioridade (Art. 151, II, RICD)', 'descricaoTramitacao': 'Designação de Relator', 'codTipoTramitacao': '320', 'descricaoSituacao': 'Tramitando em Conjunto', 'codSituacao': 925, 'despacho': 'Designada Relatora, Dep. Professora Dayane Pimentel (UNIÃO-BA)', 'url': None, 'ambito': 'Protocolar', 'apreciacao': 'Proposição Sujeita à Apreciação do Plenário'}|https://dadosabertos.camara.leg.br/api/v2/proposicoes/2334374/autores|Projeto de Lei||Obrigatoriedade, escola pública, escola privada, Planejamento educacional, inclusão, aluno, pessoa com deficiência, aula, Educação física.|https://dadosabertos.camara.leg.br/api/v2/proposicoes/1579135|||https://www.camara.leg.br/proposicoesWeb/prop_mostrarintegra?codteor=2204685|||
2334375|https://dadosabertos.camara.leg.br/api/v2/proposicoes/2334375|PL|139|2358|2022|Institui-se como medida obrigatória, que os transportes públicos forneçam, por meio de avisos sonoros, seu destino e o valor da passagem a cada parada.|2022-08-29T10:32||{'dataHora': '2022-10-05T16:45', 'sequencia': 15, 'siglaOrgao': 'CVT', 'uriOrgao': 'https://dadosabertos.camara.leg.br/api/v2/orgaos/2016', 'uriUltimoRelator': None, 'regime': 'Ordinário (Art. 151, III, RICD)', 'descricaoTramitacao': 'Apensação', 'codTipoTramitacao': '106', 'descricaoSituacao': 'Tramitando em Conjunto', 'codSituacao': 925, 'despacho': 'Apensação desta proposição ao PL 5346/2020.', 'url': None, 'ambito': 'Protocolar', 'apreciacao': 'Proposição Sujeita à Apreciação Conclusiva pelas Comissões - Art. 24 II'}|https://dadosabertos.camara.leg.br/api/v2/proposicoes/2334375/autores|Projeto de Lei||Obrigatoriedade, Transporte público, Sinal sonoro, indicação, Trajeto, valor, Passagem do transporte coletivo. _ Descumprimento, notificação, multa.|https://dadosabertos.camara.leg.br/api/v2/proposicoes/2265936|||https://www.camara.leg.br/proposicoesWeb/prop_mostrarintegra?codteor=2204686|||
2334377|https://dadosabertos.camara.leg.br/api/v2/proposicoes/2334377|PL|139|2359|2022|Equipara as malformações congênitas Fissura Labiopalatina e/ou outras anomalias Craniofaciais às deficiências, para efeitos jurídicos e dá outras providências.|2022-08-29T10:34||{'dataHora': '2022-09-01T00:00', 'sequencia': 16, 'siglaOrgao': 'CCP', 'uriOrgao': 'https://dadosabertos.camara.leg.br/api/v2/orgaos/186', 'uriUltimoRelator': None, 'regime': 'Ordinário (Art. 151, III, RICD)', 'descricaoTramitacao': 'Publicação de Proposição', 'codTipoTramitacao': '604', 'descricaoSituacao': 'Tramitando em Conjunto', 'codSituacao': 925, 'despacho': 'Encaminhada à publicação. Publicação Inicial em avulso e no DCD de 02/09/2022 PAG 92', 'url': None, 'ambito': 'Regimental', 'apreciacao': 'Proposição Sujeita à Apreciação Conclusiva pelas Comissões - Art. 24 II'}|https://dadosabertos.camara.leg.br/api/v2/proposicoes/2334377/autores|Projeto de Lei||Equiparação, Doença congênita, Lábio leporino, Anormalidade craniofacial, deficiência física, efeito jurídico. _ Poder público, cadastro único, pessoa, Má-formação fetal, Tratamento especializado, Tratamento multidisciplinar.|https://dadosabertos.camara.leg.br/api/v2/proposicoes/2189943|||https://www.camara.leg.br/proposicoesWeb/prop_mostrarintegra?codteor=2204688|||
2334384|https://dadosabertos.camara.leg.br/api/v2/proposicoes/2334384|PL|139|2360|2022|Altera a Lei n° 12.468, de 26 de agosto de 2011, que regulamenta a profissão de taxista; altera a Lei nº 6.094, de 30 de agosto de 1974; e dá outras providências para estabelecer condições que não caracterizam transporte irregular de passageiros.|2022-08-29T13:10||{'dataHora': '2022-09-08T13:39', 'sequencia': 16, 'siglaOrgao': 'CDU', 'uriOrgao': 'https://dadosabertos.camara.leg.br/api/v2/orgaos/2006', 'uriUltimoRelator': None, 'regime': 'Ordinário (Art. 151, III, RICD)', 'descricaoTramitacao': 'Apensação', 'codTipoTramitacao': '106', 'descricaoSituacao': 'Tramitando em Conjunto', 'codSituacao': 925, 'despacho': 'Apensação desta proposição ao PL 215/2021.', 'url': None, 'ambito': 'Protocolar', 'apreciacao': 'Proposição Sujeita à Apreciação Conclusiva pelas Comissões - Art. 24 II'}|https://dadosabertos.camara.leg.br/api/v2/proposicoes/2334384/autores|Projeto de Lei||Alteração, Lei Federal, autorização, taxista, embarque, desembarque, passageiro, Limite territorial, Município, descaracterização, Transporte clandestino.|https://dadosabertos.camara.leg.br/api/v2/proposicoes/2268973|||https://www.camara.leg.br/proposicoesWeb/prop_mostrarintegra?codteor=2204745|||
2334388|https://dadosabertos.camara.leg.br/api/v2/proposicoes/2334388|PL|139|2361|2022|Altera o inciso XIV do art. 6º da Lei nº 7.713, de 22 de dezembro de 1988, para estender o benefício da isenção do imposto de renda nele previsto às pessoas que permanecem em atividade laboral.|2022-08-29T15:19||{'dataHora': '2022-10-04T00:00', 'sequencia': 13, 'siglaOrgao': 'CCP', 'uriOrgao': 'https://dadosabertos.camara.leg.br/api/v2/orgaos/186', 'uriUltimoRelator': None, 'regime': 'Prioridade (Art. 151, II, RICD)', 'descricaoTramitacao': 'Publicação de Proposição', 'codTipoTramitacao': '604', 'descricaoSituacao': 'Tramitando em Conjunto', 'codSituacao': 925, 'despacho': 'Encaminhada à publicação. Publicação Inicial em avulso e no DCD de 05/10/2022 PAG 97', 'url': 'https://www.camara.leg.br/proposicoesWeb/prop_mostrarintegra?codteor=2236708', 'ambito': 'Regimental', 'apreciacao': 'Proposição Sujeita à Apreciação do Plenário'}|https://dadosabertos.camara.leg.br/api/v2/proposicoes/2334388/autores|Projeto de Lei||Alteração, Legislação Tributária Federal, isenção, Imposto sobre a Renda da Pessoa Física (IRPF), Provento (remuneração), pessoa física, trabalhador, doença grave, permanência, trabalho, tributação.|https://dadosabertos.camara.leg.br/api/v2/proposicoes/2256331|||https://www.camara.leg.br/proposicoesWeb/prop_mostrarintegra?codteor=2204762|||
2334419|https://dadosabertos.camara.leg.br/api/v2/proposicoes/2334419|PL|139|2362|2022|Confere ao Município de Piranguinho, localizado no Estado de Minas Gerais, o título de “Capital Nacional do Pé de Moleque”.|2022-08-29T17:25||{'dataHora': '2022-09-01T16:47', 'sequencia': 15, 'siglaOrgao': 'CCULT', 'uriOrgao': 'https://dadosabertos.camara.leg.br/api/v2/orgaos/536996', 'uriUltimoRelator': None, 'regime': 'Ordinário (Art. 151, III, RICD)', 'descricaoTramitacao': 'Recebimento', 'codTipoTramitacao': '500', 'descricaoSituacao': 'Aguardando Designação de Relator', 'codSituacao': 907, 'despacho': 'Recebimento pela CCULT.', 'url': None, 'ambito': 'Regimental', 'apreciacao': 'Proposição Sujeita à Apreciação Conclusiva pelas Comissões - Art. 24 II'}|https://dadosabertos.camara.leg.br/api/v2/proposicoes/2334419/autores|Projeto de Lei||Título de capital nacional, Capital Nacional do Pé de Moleque, Piranguinho (MG), Minas Gerais, Título de topônimo.||||https://www.camara.leg.br/proposicoesWeb/prop_mostrarintegra?codteor=2204878|||
